src/acc/libsmm_acc/parameters/parameters_H100.json
[
{"m": 4, "n": 4, "k": 4, "tile_m": 1, "tile_n": 1, "threads": 32, "grouping": 8, "minblocks": 9, "algorithm": "medium", "perf": 366.075, "source": "autotuned"},
{"m": 4, "n": 4, "k": 5, "tile_m": 1, "tile_n": 1, "threads": 32, "grouping": 7, "minblocks": 19, "algorithm": "medium", "perf": 451.35, "source": "autotuned"},
{"m": 4, "n": 4, "k": 6, "tile_m": 1, "tile_n": 1, "threads": 32, "grouping": 8, "minblocks": 26, "algorithm": "medium", "perf": 550.825, "source": "autotuned"},
{"m": 4, "n": 4, "k": 7, "tile_m": 1, "tile_n": 1, "threads": 32, "grouping": 8, "minblocks": 22, "algorithm": "medium", "perf": 603.86, "source": "autotuned"},
{"m": 4, "n": 4, "k": 8, "threads": 32, "grouping": 6, "minblocks": 1, "algorithm": "tiny", "perf": 676.427, "source": "autotuned"},
{"m": 4, "n": 4, "k": 9, "tile_m": 1, "tile_n": 1, "threads": 64, "grouping": 9, "minblocks": 12, "algorithm": "medium", "perf": 675.162, "source": "autotuned"},
{"m": 4, "n": 4, "k": 10, "tile_m": 1, "tile_n": 1, "threads": 64, "grouping": 9, "minblocks": 10, "algorithm": "medium", "perf": 729.242, "source": "autotuned"},
{"m": 4, "n": 4, "k": 15, "threads": 32, "grouping": 4, "minblocks": 1, "algorithm": "tiny", "perf": 977.596, "source": "autotuned"},
{"m": 4, "n": 4, "k": 22, "tile_m": 1, "tile_n": 1, "threads": 32, "grouping": 3, "minblocks": 19, "algorithm": "small", "perf": 1213.46, "source": "autotuned"},
{"m": 4, "n": 4, "k": 23, "tile_m": 1, "tile_n": 1, "threads": 32, "grouping": 2, "minblocks": 7, "algorithm": "small", "perf": 1266.58, "source": "autotuned"},
{"m": 4, "n": 4, "k": 25, "tile_m": 1, "tile_n": 1, "threads": 96, "grouping": 8, "minblocks": 18, "algorithm": "small", "perf": 1151.49, "source": "autotuned"},
{"m": 4, "n": 4, "k": 26, "tile_m": 1, "tile_n": 1, "threads": 96, "grouping": 8, "minblocks": 21, "algorithm": "small", "perf": 1178.17, "source": "autotuned"},
{"m": 4, "n": 4, "k": 32, "tile_m": 1, "tile_n": 1, "threads": 32, "grouping": 2, "minblocks": 1, "algorithm": "small", "perf": 1469.79, "source": "autotuned"},
{"m": 4, "n": 4, "k": 45, "tile_m": 1, "tile_n": 1, "threads": 32, "grouping": 2, "minblocks": 11, "algorithm": "medium", "perf": 1413.67, "source": "autotuned"},
{"m": 4, "n": 5, "k": 4, "tile_m": 1, "tile_n": 1, "threads": 32, "grouping": 8, "minblocks": 5, "algorithm": "medium", "perf": 464.88, "source": "autotuned"},
{"m": 4, "n": 5, "k": 5, "tile_m": 1, "tile_n": 1, "threads": 32, "grouping": 8, "minblocks": 14, "algorithm": "medium", "perf": 549.598, "source": "autotuned"},
{"m": 4, "n": 5, "k": 6, "tile_m": 2, "tile_n": 1, "threads": 32, "grouping": 8, "minblocks": 15, "algorithm": "medium", "perf": 668.804, "source": "autotuned"},
{"m": 4, "n": 5, "k": 7, "tile_m": 1, "tile_n": 1, "threads": 64, "grouping": 9, "minblocks": 18, "algorithm": "medium", "perf": 683.29, "source": "autotuned"},
{"m": 4, "n": 5, "k": 8, "tile_m": 1, "tile_n": 1, "threads": 64, "grouping": 9, "minblocks": 11, "algorithm": "medium", "perf": 745.753, "source": "autotuned"},
{"m": 4, "n": 5, "k": 9, "tile_m": 1, "tile_n": 1, "threads": 64, "grouping": 9, "minblocks": 26, "algorithm": "medium", "perf": 826.166, "source": "autotuned"},
{"m": 4, "n": 5, "k": 13, "tile_m": 2, "tile_n": 1, "threads": 96, "grouping": 8, "minblocks": 14, "algorithm": "medium", "perf": 1017.43, "source": "autotuned"},
{"m": 4, "n": 5, "k": 22, "tile_m": 2, "tile_n": 1, "threads": 128, "grouping": 8, "minblocks": 16, "algorithm": "medium", "perf": 1315.67, "source": "autotuned"},
{"m": 4, "n": 5, "k": 23, "tile_m": 2, "tile_n": 1, "threads": 128, "grouping": 8, "minblocks": 15, "algorithm": "medium", "perf": 1326.63, "source": "autotuned"},
{"m": 4, "n": 5, "k": 26, "tile_m": 1, "tile_n": 1, "threads": 160, "grouping": 16, "minblocks": 3, "algorithm": "medium", "perf": 1275.3, "source": "autotuned"},
{"m": 4, "n": 5, "k": 28, "tile_m": 2, "tile_n": 1, "threads": 160, "grouping": 16, "minblocks": 8, "algorithm": "medium", "perf": 1346.13, "source": "autotuned"},
{"m": 4, "n": 5, "k": 32, "tile_m": 2, "tile_n": 1, "threads": 32, "grouping": 8, "minblocks": 10, "algorithm": "medium", "perf": 1428.18, "source": "autotuned"},
{"m": 4, "n": 5, "k": 45, "tile_m": 2, "tile_n": 1, "threads": 32, "grouping": 8, "minblocks": 19, "algorithm": "medium", "perf": 1555.1, "source": "autotuned"},
{"m": 4, "n": 6, "k": 4, "tile_m": 1, "tile_n": 1, "threads": 32, "grouping": 8, "minblocks": 11, "algorithm": "medium", "perf": 554.101, "source": "autotuned"},
{"m": 4, "n": 6, "k": 5, "tile_m": 1, "tile_n": 1, "threads": 32, "grouping": 8, "minblocks": 21, "algorithm": "medium", "perf": 674.623, "source": "autotuned"},
{"m": 4, "n": 6, "k": 7, "tile_m": 1, "tile_n": 1, "threads": 64, "grouping": 9, "minblocks": 9, "algorithm": "medium", "perf": 823.132, "source": "autotuned"},
{"m": 4, "n": 7, "k": 4, "tile_m": 2, "tile_n": 1, "threads": 32, "grouping": 8, "minblocks": 4, "algorithm": "medium", "perf": 630.655, "source": "autotuned"},
{"m": 4, "n": 7, "k": 5, "tile_m": 1, "tile_n": 1, "threads": 64, "grouping": 8, "minblocks": 8, "algorithm": "medium", "perf": 754.747, "source": "autotuned"},
{"m": 4, "n": 7, "k": 13, "tile_m": 2, "tile_n": 1, "threads": 96, "grouping": 8, "minblocks": 16, "algorithm": "medium", "perf": 1396.65, "source": "autotuned"},
{"m": 4, "n": 7, "k": 25, "tile_m": 2, "tile_n": 1, "threads": 32, "grouping": 5, "minblocks": 25, "algorithm": "medium", "perf": 1682.27, "source": "autotuned"},
{"m": 4, "n": 7, "k": 26, "tile_m": 2, "tile_n": 1, "threads": 32, "grouping": 5, "minblocks": 25, "algorithm": "medium", "perf": 1734.12, "source": "autotuned"},
{"m": 4, "n": 7, "k": 28, "tile_m": 2, "tile_n": 1, "threads": 32, "grouping": 8, "minblocks": 16, "algorithm": "medium", "perf": 1749.25, "source": "autotuned"},
{"m": 4, "n": 7, "k": 32, "tile_m": 2, "tile_n": 1, "threads": 32, "grouping": 8, "minblocks": 16, "algorithm": "medium", "perf": 1887.52, "source": "autotuned"},
{"m": 4, "n": 7, "k": 45, "tile_m": 2, "tile_n": 1, "w": 18, "v": 4, "threads": 32, "grouping": 16, "minblocks": 1, "algorithm": "largeDB2", "perf": 2111.61, "source": "autotuned"},
{"m": 4, "n": 8, "k": 4, "tile_m": 1, "tile_n": 1, "threads": 32, "grouping": 6, "minblocks": 16, "algorithm": "medium", "perf": 591.395, "source": "autotuned"},
{"m": 4, "n": 8, "k": 5, "tile_m": 1, "tile_n": 1, "threads": 64, "grouping": 8, "minblocks": 10, "algorithm": "medium", "perf": 840.101, "source": "autotuned"},
{"m": 4, "n": 8, "k": 7, "tile_m": 1, "tile_n": 1, "threads": 64, "grouping": 6, "minblocks": 16, "algorithm": "medium", "perf": 1098.38, "source": "autotuned"},
{"m": 4, "n": 8, "k": 8, "tile_m": 1, "tile_n": 1, "threads": 64, "grouping": 6, "minblocks": 16, "algorithm": "medium", "perf": 1034.75, "source": "autotuned"},
{"m": 4, "n": 8, "k": 9, "tile_m": 2, "tile_n": 1, "threads": 96, "grouping": 8, "minblocks": 16, "algorithm": "medium", "perf": 1224.34, "source": "autotuned"},
{"m": 4, "n": 9, "k": 5, "tile_m": 2, "tile_n": 1, "threads": 64, "grouping": 9, "minblocks": 22, "algorithm": "medium", "perf": 889.326, "source": "autotuned"},
{"m": 4, "n": 9, "k": 6, "tile_m": 2, "tile_n": 1, "threads": 64, "grouping": 9, "minblocks": 3, "algorithm": "medium", "perf": 1039.49, "source": "autotuned"},
{"m": 4, "n": 9, "k": 7, "tile_m": 2, "tile_n": 1, "threads": 64, "grouping": 9, "minblocks": 6, "algorithm": "medium", "perf": 1160.67, "source": "autotuned"},
{"m": 4, "n": 9, "k": 8, "tile_m": 2, "tile_n": 1, "threads": 96, "grouping": 8, "minblocks": 14, "algorithm": "medium", "perf": 1202.82, "source": "autotuned"},
{"m": 4, "n": 9, "k": 9, "tile_m": 2, "tile_n": 1, "threads": 96, "grouping": 8, "minblocks": 14, "algorithm": "medium", "perf": 1293.68, "source": "autotuned"},
{"m": 4, "n": 9, "k": 22, "tile_m": 2, "tile_n": 1, "threads": 96, "grouping": 8, "minblocks": 16, "algorithm": "medium", "perf": 1876.77, "source": "autotuned"},
{"m": 4, "n": 9, "k": 32, "tile_m": 2, "tile_n": 1, "threads": 32, "grouping": 8, "minblocks": 17, "algorithm": "medium", "perf": 2223.35, "source": "autotuned"},
{"m": 4, "n": 13, "k": 7, "tile_m": 2, "tile_n": 1, "threads": 96, "grouping": 8, "minblocks": 16, "algorithm": "medium", "perf": 1535.77, "source": "autotuned"},
{"m": 4, "n": 13, "k": 22, "tile_m": 2, "tile_n": 1, "threads": 96, "grouping": 8, "minblocks": 16, "algorithm": "medium", "perf": 2590.8, "source": "autotuned"},
{"m": 4, "n": 13, "k": 25, "tile_m": 2, "tile_n": 1, "threads": 32, "grouping": 8, "minblocks": 18, "algorithm": "medium", "perf": 2593.32, "source": "autotuned"},
{"m": 4, "n": 13, "k": 26, "tile_m": 2, "tile_n": 1, "threads": 32, "grouping": 8, "minblocks": 16, "algorithm": "medium", "perf": 2671.01, "source": "autotuned"},
{"m": 4, "n": 13, "k": 28, "tile_m": 2, "tile_n": 1, "threads": 32, "grouping": 8, "minblocks": 16, "algorithm": "medium", "perf": 2730.64, "source": "autotuned"},
{"m": 4, "n": 13, "k": 32, "tile_m": 2, "tile_n": 1, "threads": 32, "grouping": 8, "minblocks": 1, "algorithm": "medium", "perf": 2865.63, "source": "autotuned"},
{"m": 4, "n": 13, "k": 45, "tile_m": 2, "tile_n": 1, "threads": 32, "grouping": 8, "minblocks": 2, "algorithm": "medium", "perf": 3047.03, "source": "autotuned"},
{"m": 4, "n": 15, "k": 4, "tile_m": 2, "tile_n": 1, "threads": 64, "grouping": 9, "minblocks": 6, "algorithm": "medium", "perf": 1235.78, "source": "autotuned"},
{"m": 4, "n": 22, "k": 22, "tile_m": 2, "tile_n": 2, "threads": 32, "grouping": 8, "minblocks": 11, "algorithm": "medium", "perf": 3183.46, "source": "autotuned"},
{"m": 4, "n": 22, "k": 23, "tile_m": 2, "tile_n": 2, "threads": 32, "grouping": 8, "minblocks": 4, "algorithm": "medium", "perf": 3237.69, "source": "autotuned"},
{"m": 4, "n": 23, "k": 4, "tile_m": 1, "tile_n": 3, "threads": 96, "grouping": 8, "minblocks": 16, "algorithm": "medium", "perf": 1567.05, "source": "autotuned"},
{"m": 4, "n": 23, "k": 23, "tile_m": 2, "tile_n": 2, "threads": 32, "grouping": 8, "minblocks": 8, "algorithm": "medium", "perf": 3085.51, "source": "autotuned"},
{"m": 4, "n": 23, "k": 26, "tile_m": 2, "tile_n": 2, "threads": 32, "grouping": 8, "minblocks": 4, "algorithm": "medium", "perf": 3374.82, "source": "autotuned"},
{"m": 4, "n": 25, "k": 4, "tile_m": 2, "tile_n": 1, "threads": 64, "grouping": 7, "minblocks": 21, "algorithm": "medium", "perf": 1510.27, "source": "autotuned"},
{"m": 4, "n": 25, "k": 5, "tile_m": 2, "tile_n": 2, "threads": 32, "grouping": 8, "minblocks": 5, "algorithm": "medium", "perf": 1786.27, "source": "autotuned"},
{"m": 4, "n": 25, "k": 7, "tile_m": 2, "tile_n": 2, "threads": 32, "grouping": 8, "minblocks": 24, "algorithm": "medium", "perf": 2213.0, "source": "autotuned"},
{"m": 4, "n": 25, "k": 9, "tile_m": 2, "tile_n": 1, "threads": 64, "grouping": 8, "minblocks": 21, "algorithm": "medium", "perf": 2383.15, "source": "autotuned"},
{"m": 4, "n": 25, "k": 13, "tile_m": 2, "tile_n": 2, "threads": 32, "grouping": 8, "minblocks": 17, "algorithm": "medium", "perf": 2732.58, "source": "autotuned"},
{"m": 4, "n": 25, "k": 25, "tile_m": 2, "tile_n": 2, "threads": 32, "grouping": 12, "minblocks": 5, "algorithm": "medium", "perf": 3294.84, "source": "autotuned"},
{"m": 4, "n": 26, "k": 4, "tile_m": 2, "tile_n": 2, "threads": 32, "grouping": 5, "minblocks": 15, "algorithm": "medium", "perf": 1592.74, "source": "autotuned"},
{"m": 4, "n": 26, "k": 7, "tile_m": 2, "tile_n": 2, "threads": 32, "grouping": 8, "minblocks": 6, "algorithm": "medium", "perf": 2368.45, "source": "autotuned"},
{"m": 4, "n": 26, "k": 9, "tile_m": 2, "tile_n": 2, "threads": 64, "grouping": 9, "minblocks": 16, "algorithm": "medium", "perf": 2507.58, "source": "autotuned"},
{"m": 4, "n": 26, "k": 13, "tile_m": 2, "tile_n": 2, "threads": 32, "grouping": 8, "minblocks": 9, "algorithm": "medium", "perf": 2957.19, "source": "autotuned"},
{"m": 4, "n": 26, "k": 22, "tile_m": 2, "tile_n": 2, "threads": 32, "grouping": 8, "minblocks": 8, "algorithm": "medium", "perf": 3428.27, "source": "autotuned"},
{"m": 4, "n": 26, "k": 23, "tile_m": 2, "tile_n": 2, "threads": 32, "grouping": 8, "minblocks": 7, "algorithm": "medium", "perf": 3756.28, "source": "autotuned"},
{"m": 4, "n": 26, "k": 25, "tile_m": 2, "tile_n": 2, "threads": 32, "grouping": 12, "minblocks": 6, "algorithm": "medium", "perf": 3514.61, "source": "autotuned"},
{"m": 4, "n": 26, "k": 26, "tile_m": 2, "tile_n": 2, "threads": 32, "grouping": 12, "minblocks": 4, "algorithm": "medium", "perf": 3511.65, "source": "autotuned"},
{"m": 4, "n": 26, "k": 28, "tile_m": 2, "tile_n": 2, "threads": 32, "grouping": 12, "minblocks": 4, "algorithm": "medium", "perf": 3625.28, "source": "autotuned"},
{"m": 4, "n": 26, "k": 32, "tile_m": 2, "tile_n": 2, "threads": 32, "grouping": 12, "minblocks": 2, "algorithm": "medium", "perf": 3734.9, "source": "autotuned"},
{"m": 4, "n": 26, "k": 45, "tile_m": 2, "tile_n": 2, "threads": 32, "grouping": 16, "minblocks": 5, "algorithm": "medium", "perf": 3610.38, "source": "autotuned"},
{"m": 4, "n": 28, "k": 4, "tile_m": 2, "tile_n": 2, "threads": 128, "grouping": 9, "minblocks": 13, "algorithm": "medium", "perf": 1691.8, "source": "autotuned"},
{"m": 4, "n": 28, "k": 5, "tile_m": 2, "tile_n": 2, "threads": 32, "grouping": 8, "minblocks": 12, "algorithm": "medium", "perf": 2023.29, "source": "autotuned"},
{"m": 4, "n": 28, "k": 7, "tile_m": 2, "tile_n": 2, "threads": 32, "grouping": 8, "minblocks": 23, "algorithm": "medium", "perf": 2462.57, "source": "autotuned"},
{"m": 4, "n": 28, "k": 9, "tile_m": 2, "tile_n": 2, "threads": 64, "grouping": 9, "minblocks": 15, "algorithm": "medium", "perf": 2734.41, "source": "autotuned"},
{"m": 4, "n": 28, "k": 13, "tile_m": 2, "tile_n": 2, "threads": 32, "grouping": 8, "minblocks": 19, "algorithm": "medium", "perf": 3138.07, "source": "autotuned"},
{"m": 4, "n": 28, "k": 25, "tile_m": 2, "tile_n": 2, "threads": 32, "grouping": 12, "minblocks": 5, "algorithm": "medium", "perf": 3648.16, "source": "autotuned"},
{"m": 4, "n": 28, "k": 26, "tile_m": 2, "tile_n": 2, "threads": 32, "grouping": 12, "minblocks": 9, "algorithm": "medium", "perf": 3661.73, "source": "autotuned"},
{"m": 4, "n": 28, "k": 28, "tile_m": 2, "tile_n": 2, "threads": 32, "grouping": 12, "minblocks": 8, "algorithm": "medium", "perf": 3689.12, "source": "autotuned"},
{"m": 4, "n": 28, "k": 32, "tile_m": 2, "tile_n": 2, "threads": 32, "grouping": 12, "minblocks": 7, "algorithm": "medium", "perf": 3885.61, "source": "autotuned"},
{"m": 4, "n": 28, "k": 45, "tile_m": 2, "tile_n": 2, "threads": 32, "grouping": 16, "minblocks": 5, "algorithm": "medium", "perf": 3703.41, "source": "autotuned"},
{"m": 4, "n": 32, "k": 4, "tile_m": 2, "tile_n": 2, "threads": 32, "grouping": 5, "minblocks": 5, "algorithm": "small", "perf": 1957.61, "source": "autotuned"},
{"m": 4, "n": 32, "k": 7, "tile_m": 2, "tile_n": 2, "threads": 32, "grouping": 8, "minblocks": 25, "algorithm": "medium", "perf": 2777.51, "source": "autotuned"},
{"m": 4, "n": 32, "k": 9, "tile_m": 2, "tile_n": 2, "threads": 64, "grouping": 9, "minblocks": 16, "algorithm": "medium", "perf": 2973.07, "source": "autotuned"},
{"m": 4, "n": 32, "k": 13, "tile_m": 2, "tile_n": 2, "threads": 32, "grouping": 8, "minblocks": 7, "algorithm": "medium", "perf": 3484.34, "source": "autotuned"},
{"m": 4, "n": 32, "k": 25, "tile_m": 2, "tile_n": 2, "threads": 32, "grouping": 12, "minblocks": 6, "algorithm": "medium", "perf": 3908.42, "source": "autotuned"},
{"m": 4, "n": 32, "k": 26, "tile_m": 2, "tile_n": 2, "threads": 32, "grouping": 12, "minblocks": 3, "algorithm": "medium", "perf": 3918.05, "source": "autotuned"},
{"m": 4, "n": 32, "k": 28, "tile_m": 2, "tile_n": 2, "threads": 32, "grouping": 12, "minblocks": 6, "algorithm": "medium", "perf": 3983.47, "source": "autotuned"},
{"m": 4, "n": 32, "k": 32, "tile_m": 2, "tile_n": 2, "threads": 32, "grouping": 12, "minblocks": 6, "algorithm": "medium", "perf": 4040.71, "source": "autotuned"},
{"m": 4, "n": 32, "k": 45, "tile_m": 2, "tile_n": 2, "threads": 32, "grouping": 16, "minblocks": 4, "algorithm": "medium", "perf": 3813.24, "source": "autotuned"},
{"m": 4, "n": 45, "k": 4, "tile_m": 2, "tile_n": 3, "threads": 32, "grouping": 8, "minblocks": 19, "algorithm": "medium", "perf": 2414.0, "source": "autotuned"},
{"m": 4, "n": 45, "k": 5, "tile_m": 2, "tile_n": 3, "threads": 32, "grouping": 8, "minblocks": 3, "algorithm": "medium", "perf": 2692.35, "source": "autotuned"},
{"m": 4, "n": 45, "k": 7, "tile_m": 2, "tile_n": 3, "threads": 32, "grouping": 8, "minblocks": 21, "algorithm": "medium", "perf": 3374.05, "source": "autotuned"},
{"m": 4, "n": 45, "k": 9, "tile_m": 2, "tile_n": 3, "threads": 32, "grouping": 8, "minblocks": 15, "algorithm": "medium", "perf": 3322.65, "source": "autotuned"},
{"m": 4, "n": 45, "k": 13, "tile_m": 2, "tile_n": 3, "threads": 32, "grouping": 11, "minblocks": 10, "algorithm": "medium", "perf": 3817.24, "source": "autotuned"},
{"m": 4, "n": 45, "k": 26, "tile_m": 2, "tile_n": 3, "threads": 32, "grouping": 16, "minblocks": 3, "algorithm": "medium", "perf": 3829.94, "source": "autotuned"},
{"m": 4, "n": 45, "k": 28, "tile_m": 2, "tile_n": 3, "threads": 32, "grouping": 16, "minblocks": 3, "algorithm": "medium", "perf": 3851.47, "source": "autotuned"},
{"m": 4, "n": 45, "k": 32, "tile_m": 2, "tile_n": 3, "threads": 32, "grouping": 16, "minblocks": 2, "algorithm": "medium", "perf": 3951.85, "source": "autotuned"},
{"m": 4, "n": 45, "k": 45, "tile_m": 2, "tile_n": 1, "w": 18, "v": 26, "threads": 96, "grouping": 16, "minblocks": 8, "algorithm": "largeDB2", "perf": 3803.41, "source": "autotuned"},
{"m": 5, "n": 4, "k": 4, "tile_m": 1, "tile_n": 1, "threads": 32, "grouping": 9, "minblocks": 5, "algorithm": "medium", "perf": 454.076, "source": "autotuned"},
{"m": 5, "n": 4, "k": 6, "tile_m": 1, "tile_n": 1, "threads": 32, "grouping": 8, "minblocks": 8, "algorithm": "medium", "perf": 647.304, "source": "autotuned"},
{"m": 5, "n": 4, "k": 7, "tile_m": 1, "tile_n": 1, "threads": 64, "grouping": 4, "minblocks": 27, "algorithm": "medium", "perf": 655.374, "source": "autotuned"},
{"m": 5, "n": 4, "k": 8, "tile_m": 1, "tile_n": 1, "threads": 64, "grouping": 11, "minblocks": 7, "algorithm": "medium", "perf": 711.212, "source": "autotuned"},
{"m": 5, "n": 4, "k": 9, "tile_m": 1, "tile_n": 1, "threads": 64, "grouping": 9, "minblocks": 11, "algorithm": "medium", "perf": 771.143, "source": "autotuned"},
{"m": 5, "n": 4, "k": 13, "tile_m": 1, "tile_n": 1, "threads": 96, "grouping": 8, "minblocks": 21, "algorithm": "medium", "perf": 900.779, "source": "autotuned"},
{"m": 5, "n": 4, "k": 22, "tile_m": 1, "tile_n": 1, "threads": 128, "grouping": 4, "minblocks": 8, "algorithm": "medium", "perf": 1135.73, "source": "autotuned"},
{"m": 5, "n": 4, "k": 23, "tile_m": 1, "tile_n": 1, "threads": 32, "grouping": 2, "minblocks": 1, "algorithm": "small", "perf": 1136.89, "source": "autotuned"},
{"m": 5, "n": 4, "k": 25, "tile_m": 1, "tile_n": 1, "threads": 128, "grouping": 4, "minblocks": 15, "algorithm": "medium", "perf": 1185.77, "source": "autotuned"},
{"m": 5, "n": 4, "k": 26, "tile_m": 1, "tile_n": 1, "threads": 160, "grouping": 11, "minblocks": 10, "algorithm": "medium", "perf": 1152.4, "source": "autotuned"},
{"m": 5, "n": 4, "k": 28, "tile_m": 1, "tile_n": 1, "threads": 160, "grouping": 16, "minblocks": 9, "algorithm": "medium", "perf": 1198.47, "source": "autotuned"},
{"m": 5, "n": 4, "k": 32, "tile_m": 1, "tile_n": 1, "threads": 32, "grouping": 4, "minblocks": 23, "algorithm": "medium", "perf": 1242.22, "source": "autotuned"},
{"m": 5, "n": 4, "k": 45, "tile_m": 1, "tile_n": 1, "threads": 64, "grouping": 3, "minblocks": 18, "algorithm": "medium", "perf": 1318.42, "source": "autotuned"},
{"m": 5, "n": 5, "k": 4, "tile_m": 1, "tile_n": 1, "threads": 32, "grouping": 8, "minblocks": 27, "algorithm": "medium", "perf": 566.428, "source": "autotuned"},
{"m": 5, "n": 5, "k": 5, "tile_m": 1, "tile_n": 1, "threads": 32, "grouping": 9, "minblocks": 25, "algorithm": "medium", "perf": 682.341, "source": "autotuned"},
{"m": 5, "n": 5, "k": 6, "tile_m": 1, "tile_n": 1, "threads": 32, "grouping": 9, "minblocks": 24, "algorithm": "medium", "perf": 815.686, "source": "autotuned"},
{"m": 5, "n": 5, "k": 7, "tile_m": 1, "tile_n": 1, "threads": 64, "grouping": 9, "minblocks": 10, "algorithm": "medium", "perf": 806.18, "source": "autotuned"},
{"m": 5, "n": 5, "k": 8, "tile_m": 1, "tile_n": 1, "threads": 64, "grouping": 9, "minblocks": 26, "algorithm": "medium", "perf": 892.365, "source": "autotuned"},
{"m": 5, "n": 5, "k": 9, "tile_m": 1, "tile_n": 1, "threads": 64, "grouping": 9, "minblocks": 17, "algorithm": "medium", "perf": 957.672, "source": "autotuned"},
{"m": 5, "n": 5, "k": 12, "tile_m": 1, "tile_n": 1, "threads": 64, "grouping": 4, "minblocks": 26, "algorithm": "medium", "perf": 1147.21, "source": "autotuned"},
{"m": 5, "n": 5, "k": 13, "tile_m": 1, "tile_n": 1, "threads": 32, "grouping": 4, "minblocks": 29, "algorithm": "small", "perf": 1146.85, "source": "autotuned"},
{"m": 5, "n": 5, "k": 16, "tile_m": 1, "tile_n": 1, "threads": 32, "grouping": 3, "minblocks": 5, "algorithm": "small", "perf": 1307.74, "source": "autotuned"},
{"m": 5, "n": 5, "k": 22, "tile_m": 1, "tile_n": 1, "threads": 128, "grouping": 4, "minblocks": 14, "algorithm": "medium", "perf": 1399.77, "source": "autotuned"},
{"m": 5, "n": 5, "k": 23, "tile_m": 1, "tile_n": 1, "threads": 128, "grouping": 18, "minblocks": 2, "algorithm": "medium", "perf": 1402.88, "source": "autotuned"},
{"m": 5, "n": 5, "k": 24, "tile_m": 1, "tile_n": 1, "threads": 128, "grouping": 4, "minblocks": 15, "algorithm": "medium", "perf": 1434.65, "source": "autotuned"},
{"m": 5, "n": 5, "k": 25, "tile_m": 1, "tile_n": 1, "threads": 128, "grouping": 4, "minblocks": 16, "algorithm": "medium", "perf": 1473.47, "source": "autotuned"},
{"m": 5, "n": 5, "k": 28, "tile_m": 1, "tile_n": 1, "threads": 32, "grouping": 4, "minblocks": 21, "algorithm": "medium", "perf": 1516.98, "source": "autotuned"},
{"m": 5, "n": 5, "k": 32, "tile_m": 1, "tile_n": 1, "threads": 32, "grouping": 4, "minblocks": 23, "algorithm": "medium", "perf": 1608.22, "source": "autotuned"},
{"m": 5, "n": 5, "k": 45, "tile_m": 1, "tile_n": 1, "threads": 32, "grouping": 2, "minblocks": 6, "algorithm": "medium", "perf": 1652.94, "source": "autotuned"},
{"m": 5, "n": 6, "k": 4, "tile_m": 1, "tile_n": 1, "threads": 32, "grouping": 8, "minblocks": 18, "algorithm": "medium", "perf": 674.332, "source": "autotuned"},
{"m": 5, "n": 6, "k": 5, "tile_m": 1, "tile_n": 1, "threads": 32, "grouping": 8, "minblocks": 3, "algorithm": "medium", "perf": 821.659, "source": "autotuned"},
{"m": 5, "n": 6, "k": 7, "tile_m": 1, "tile_n": 1, "threads": 64, "grouping": 8, "minblocks": 10, "algorithm": "medium", "perf": 989.373, "source": "autotuned"},
{"m": 5, "n": 6, "k": 8, "tile_m": 1, "tile_n": 1, "threads": 64, "grouping": 8, "minblocks": 10, "algorithm": "medium", "perf": 1090.96, "source": "autotuned"},
{"m": 5, "n": 6, "k": 9, "tile_m": 1, "tile_n": 1, "threads": 64, "grouping": 8, "minblocks": 10, "algorithm": "medium", "perf": 1159.92, "source": "autotuned"},
{"m": 5, "n": 7, "k": 4, "tile_m": 4, "tile_n": 1, "threads": 32, "grouping": 8, "minblocks": 1, "algorithm": "medium", "perf": 735.854, "source": "autotuned"},
{"m": 5, "n": 7, "k": 5, "tile_m": 1, "tile_n": 1, "threads": 64, "grouping": 10, "minblocks": 16, "algorithm": "medium", "perf": 798.361, "source": "autotuned"},
{"m": 5, "n": 7, "k": 6, "tile_m": 2, "tile_n": 1, "threads": 64, "grouping": 9, "minblocks": 22, "algorithm": "medium", "perf": 904.728, "source": "autotuned"},
{"m": 5, "n": 7, "k": 7, "tile_m": 2, "tile_n": 1, "threads": 64, "grouping": 9, "minblocks": 22, "algorithm": "medium", "perf": 992.528, "source": "autotuned"},
{"m": 5, "n": 7, "k": 8, "tile_m": 2, "tile_n": 1, "threads": 64, "grouping": 9, "minblocks": 21, "algorithm": "medium", "perf": 1078.01, "source": "autotuned"},
{"m": 5, "n": 7, "k": 9, "tile_m": 2, "tile_n": 1, "threads": 64, "grouping": 9, "minblocks": 23, "algorithm": "medium", "perf": 1136.7, "source": "autotuned"},
{"m": 5, "n": 7, "k": 13, "tile_m": 4, "tile_n": 1, "threads": 96, "grouping": 8, "minblocks": 14, "algorithm": "medium", "perf": 1411.7, "source": "autotuned"},
{"m": 5, "n": 7, "k": 26, "tile_m": 3, "tile_n": 1, "threads": 32, "grouping": 8, "minblocks": 9, "algorithm": "medium", "perf": 1704.9, "source": "autotuned"},
{"m": 5, "n": 7, "k": 28, "tile_m": 4, "tile_n": 1, "threads": 32, "grouping": 8, "minblocks": 18, "algorithm": "medium", "perf": 1743.8, "source": "autotuned"},
{"m": 5, "n": 7, "k": 32, "tile_m": 3, "tile_n": 1, "threads": 32, "grouping": 4, "minblocks": 19, "algorithm": "medium", "perf": 1855.72, "source": "autotuned"},
{"m": 5, "n": 7, "k": 45, "tile_m": 3, "tile_n": 1, "w": 18, "v": 4, "threads": 32, "grouping": 16, "minblocks": 8, "algorithm": "largeDB2", "perf": 2003.71, "source": "autotuned"},
{"m": 5, "n": 8, "k": 4, "tile_m": 1, "tile_n": 2, "threads": 64, "grouping": 9, "minblocks": 14, "algorithm": "medium", "perf": 779.464, "source": "autotuned"},
{"m": 5, "n": 8, "k": 5, "tile_m": 2, "tile_n": 1, "threads": 64, "grouping": 13, "minblocks": 1, "algorithm": "medium", "perf": 903.282, "source": "autotuned"},
{"m": 5, "n": 8, "k": 6, "tile_m": 1, "tile_n": 2, "threads": 64, "grouping": 9, "minblocks": 24, "algorithm": "medium", "perf": 1055.27, "source": "autotuned"},
{"m": 5, "n": 8, "k": 7, "tile_m": 2, "tile_n": 1, "threads": 64, "grouping": 13, "minblocks": 1, "algorithm": "medium", "perf": 1142.9, "source": "autotuned"},
{"m": 5, "n": 8, "k": 8, "tile_m": 1, "tile_n": 2, "threads": 64, "grouping": 5, "minblocks": 28, "algorithm": "small", "perf": 1142.38, "source": "autotuned"},
{"m": 5, "n": 8, "k": 9, "tile_m": 3, "tile_n": 1, "threads": 96, "grouping": 8, "minblocks": 14, "algorithm": "medium", "perf": 1312.03, "source": "autotuned"},
{"m": 5, "n": 9, "k": 4, "tile_m": 1, "tile_n": 1, "threads": 64, "grouping": 9, "minblocks": 23, "algorithm": "medium", "perf": 863.489, "source": "autotuned"},
{"m": 5, "n": 9, "k": 7, "tile_m": 2, "tile_n": 1, "threads": 64, "grouping": 9, "minblocks": 24, "algorithm": "medium", "perf": 1234.31, "source": "autotuned"},
{"m": 5, "n": 9, "k": 9, "tile_m": 3, "tile_n": 1, "threads": 96, "grouping": 11, "minblocks": 11, "algorithm": "medium", "perf": 1439.68, "source": "autotuned"},
{"m": 5, "n": 9, "k": 16, "tile_m": 3, "tile_n": 1, "threads": 32, "grouping": 6, "minblocks": 22, "algorithm": "medium", "perf": 1769.34, "source": "autotuned"},
{"m": 5, "n": 9, "k": 22, "tile_m": 3, "tile_n": 1, "threads": 32, "grouping": 8, "minblocks": 23, "algorithm": "medium", "perf": 1972.4, "source": "autotuned"},
{"m": 5, "n": 9, "k": 28, "tile_m": 3, "tile_n": 1, "threads": 32, "grouping": 8, "minblocks": 19, "algorithm": "medium", "perf": 2150.84, "source": "autotuned"},
{"m": 5, "n": 9, "k": 32, "tile_m": 3, "tile_n": 1, "threads": 32, "grouping": 4, "minblocks": 18, "algorithm": "medium", "perf": 2303.34, "source": "autotuned"},
{"m": 5, "n": 9, "k": 45, "tile_m": 3, "tile_n": 1, "w": 20, "v": 6, "threads": 32, "grouping": 16, "minblocks": 2, "algorithm": "largeDB2", "perf": 2396.25, "source": "autotuned"},
{"m": 5, "n": 12, "k": 5, "tile_m": 1, "tile_n": 2, "threads": 64, "grouping": 11, "minblocks": 24, "algorithm": "medium", "perf": 1309.2, "source": "autotuned"},
{"m": 5, "n": 12, "k": 26, "tile_m": 3, "tile_n": 1, "w": 12, "v": 12, "threads": 32, "grouping": 16, "minblocks": 4, "algorithm": "largeDB2", "perf": 2693.4, "source": "autotuned"},
{"m": 5, "n": 13, "k": 7, "tile_m": 3, "tile_n": 1, "threads": 96, "grouping": 8, "minblocks": 14, "algorithm": "medium", "perf": 1719.68, "source": "autotuned"},
{"m": 5, "n": 13, "k": 13, "tile_m": 3, "tile_n": 1, "threads": 32, "grouping": 7, "minblocks": 7, "algorithm": "medium", "perf": 2102.27, "source": "autotuned"},
{"m": 5, "n": 13, "k": 28, "tile_m": 3, "tile_n": 1, "w": 12, "v": 10, "threads": 32, "grouping": 16, "minblocks": 4, "algorithm": "largeDB2", "perf": 2889.79, "source": "autotuned"},
{"m": 5, "n": 16, "k": 5, "tile_m": 3, "tile_n": 1, "threads": 96, "grouping": 8, "minblocks": 14, "algorithm": "medium", "perf": 1671.68, "source": "autotuned"},
{"m": 5, "n": 16, "k": 13, "tile_m": 3, "tile_n": 1, "threads": 32, "grouping": 8, "minblocks": 1, "algorithm": "medium", "perf": 2497.28, "source": "autotuned"},
{"m": 5, "n": 16, "k": 16, "tile_m": 3, "tile_n": 1, "w": 6, "v": 16, "threads": 32, "grouping": 16, "minblocks": 8, "algorithm": "largeDB2", "perf": 2976.91, "source": "autotuned"},
{"m": 5, "n": 16, "k": 23, "tile_m": 3, "tile_n": 1, "w": 10, "v": 16, "threads": 32, "grouping": 16, "minblocks": 8, "algorithm": "largeDB2", "perf": 3258.62, "source": "autotuned"},
{"m": 5, "n": 16, "k": 32, "tile_m": 3, "tile_n": 1, "w": 12, "v": 16, "threads": 32, "grouping": 16, "minblocks": 12, "algorithm": "largeDB2", "perf": 3359.53, "source": "autotuned"},
{"m": 5, "n": 22, "k": 4, "tile_m": 3, "tile_n": 2, "threads": 96, "grouping": 8, "minblocks": 16, "algorithm": "medium", "perf": 1702.42, "source": "autotuned"},
{"m": 5, "n": 22, "k": 5, "tile_m": 5, "tile_n": 1, "threads": 32, "grouping": 8, "minblocks": 5, "algorithm": "medium", "perf": 1903.41, "source": "autotuned"},
{"m": 5, "n": 22, "k": 9, "tile_m": 5, "tile_n": 1, "threads": 64, "grouping": 9, "minblocks": 15, "algorithm": "medium", "perf": 2356.01, "source": "autotuned"},
{"m": 5, "n": 22, "k": 13, "tile_m": 3, "tile_n": 2, "w": 6, "v": 22, "threads": 32, "grouping": 16, "minblocks": 4, "algorithm": "largeDB2", "perf": 2881.79, "source": "autotuned"},
{"m": 5, "n": 22, "k": 22, "tile_m": 3, "tile_n": 2, "threads": 32, "grouping": 8, "minblocks": 13, "algorithm": "medium", "perf": 3450.34, "source": "autotuned"},
{"m": 5, "n": 22, "k": 23, "tile_m": 3, "tile_n": 2, "w": 10, "v": 22, "threads": 32, "grouping": 16, "minblocks": 8, "algorithm": "largeDB2", "perf": 3292.09, "source": "autotuned"},
{"m": 5, "n": 22, "k": 26, "tile_m": 3, "tile_n": 2, "w": 12, "v": 22, "threads": 32, "grouping": 16, "minblocks": 12, "algorithm": "largeDB2", "perf": 3342.17, "source": "autotuned"},
{"m": 5, "n": 23, "k": 4, "tile_m": 5, "tile_n": 1, "threads": 96, "grouping": 8, "minblocks": 14, "algorithm": "medium", "perf": 1739.31, "source": "autotuned"},
{"m": 5, "n": 23, "k": 5, "tile_m": 3, "tile_n": 2, "threads": 32, "grouping": 8, "minblocks": 20, "algorithm": "medium", "perf": 1993.53, "source": "autotuned"},
{"m": 5, "n": 23, "k": 9, "tile_m": 3, "tile_n": 2, "threads": 32, "grouping": 5, "minblocks": 26, "algorithm": "medium", "perf": 2493.25, "source": "autotuned"},
{"m": 5, "n": 23, "k": 13, "tile_m": 3, "tile_n": 2, "threads": 32, "grouping": 8, "minblocks": 5, "algorithm": "medium", "perf": 2957.66, "source": "autotuned"},
{"m": 5, "n": 23, "k": 16, "tile_m": 3, "tile_n": 2, "threads": 32, "grouping": 8, "minblocks": 6, "algorithm": "medium", "perf": 3240.45, "source": "autotuned"},
{"m": 5, "n": 23, "k": 22, "tile_m": 5, "tile_n": 1, "threads": 32, "grouping": 8, "minblocks": 13, "algorithm": "medium", "perf": 3263.43, "source": "autotuned"},
{"m": 5, "n": 23, "k": 23, "tile_m": 5, "tile_n": 1, "w": 10, "v": 14, "threads": 32, "grouping": 16, "minblocks": 12, "algorithm": "largeDB2", "perf": 3178.17, "source": "autotuned"},
{"m": 5, "n": 23, "k": 26, "tile_m": 3, "tile_n": 2, "threads": 32, "grouping": 12, "minblocks": 6, "algorithm": "medium", "perf": 3435.88, "source": "autotuned"},
{"m": 5, "n": 24, "k": 5, "tile_m": 5, "tile_n": 1, "threads": 32, "grouping": 8, "minblocks": 7, "algorithm": "medium", "perf": 2050.87, "source": "autotuned"},
{"m": 5, "n": 24, "k": 13, "tile_m": 3, "tile_n": 2, "w": 6, "v": 24, "threads": 32, "grouping": 16, "minblocks": 4, "algorithm": "largeDB2", "perf": 3162.08, "source": "autotuned"},
{"m": 5, "n": 24, "k": 24, "tile_m": 3, "tile_n": 2, "threads": 32, "grouping": 12, "minblocks": 4, "algorithm": "medium", "perf": 3631.77, "source": "autotuned"},
{"m": 5, "n": 24, "k": 26, "tile_m": 3, "tile_n": 2, "threads": 32, "grouping": 12, "minblocks": 7, "algorithm": "medium", "perf": 3695.65, "source": "autotuned"},
{"m": 5, "n": 24, "k": 32, "tile_m": 3, "tile_n": 2, "threads": 32, "grouping": 12, "minblocks": 8, "algorithm": "medium", "perf": 3899.7, "source": "autotuned"},
{"m": 5, "n": 25, "k": 4, "tile_m": 5, "tile_n": 1, "threads": 32, "grouping": 7, "minblocks": 5, "algorithm": "medium", "perf": 1812.16, "source": "autotuned"},
{"m": 5, "n": 25, "k": 5, "tile_m": 3, "tile_n": 2, "threads": 32, "grouping": 8, "minblocks": 2, "algorithm": "medium", "perf": 2132.32, "source": "autotuned"},
{"m": 5, "n": 25, "k": 7, "tile_m": 3, "tile_n": 1, "threads": 64, "grouping": 7, "minblocks": 22, "algorithm": "medium", "perf": 2378.46, "source": "autotuned"},
{"m": 5, "n": 25, "k": 9, "tile_m": 5, "tile_n": 1, "threads": 64, "grouping": 9, "minblocks": 16, "algorithm": "medium", "perf": 2641.67, "source": "autotuned"},
{"m": 5, "n": 25, "k": 13, "tile_m": 3, "tile_n": 2, "threads": 32, "grouping": 8, "minblocks": 4, "algorithm": "medium", "perf": 3120.83, "source": "autotuned"},
{"m": 5, "n": 25, "k": 26, "tile_m": 3, "tile_n": 2, "threads": 32, "grouping": 12, "minblocks": 6, "algorithm": "medium", "perf": 3616.26, "source": "autotuned"},
{"m": 5, "n": 25, "k": 28, "tile_m": 3, "tile_n": 2, "threads": 32, "grouping": 12, "minblocks": 9, "algorithm": "medium", "perf": 3669.91, "source": "autotuned"},
{"m": 5, "n": 26, "k": 4, "tile_m": 3, "tile_n": 2, "threads": 32, "grouping": 8, "minblocks": 27, "algorithm": "medium", "perf": 1942.72, "source": "autotuned"},
{"m": 5, "n": 26, "k": 7, "tile_m": 3, "tile_n": 1, "threads": 64, "grouping": 7, "minblocks": 22, "algorithm": "medium", "perf": 2455.12, "source": "autotuned"},
{"m": 5, "n": 26, "k": 9, "tile_m": 5, "tile_n": 1, "threads": 64, "grouping": 9, "minblocks": 16, "algorithm": "medium", "perf": 2726.85, "source": "autotuned"},
{"m": 5, "n": 26, "k": 12, "tile_m": 3, "tile_n": 2, "threads": 32, "grouping": 8, "minblocks": 13, "algorithm": "medium", "perf": 3306.99, "source": "autotuned"},
{"m": 5, "n": 26, "k": 13, "tile_m": 3, "tile_n": 2, "w": 6, "v": 26, "threads": 32, "grouping": 16, "minblocks": 2, "algorithm": "largeDB2", "perf": 3410.29, "source": "autotuned"},
{"m": 5, "n": 26, "k": 22, "tile_m": 3, "tile_n": 2, "w": 10, "v": 26, "threads": 32, "grouping": 16, "minblocks": 4, "algorithm": "largeDB2", "perf": 3481.46, "source": "autotuned"},
{"m": 5, "n": 26, "k": 23, "tile_m": 3, "tile_n": 2, "threads": 32, "grouping": 11, "minblocks": 1, "algorithm": "medium", "perf": 3650.82, "source": "autotuned"},
{"m": 5, "n": 26, "k": 24, "tile_m": 3, "tile_n": 2, "threads": 32, "grouping": 12, "minblocks": 6, "algorithm": "medium", "perf": 3814.21, "source": "autotuned"},
{"m": 5, "n": 26, "k": 25, "tile_m": 5, "tile_n": 1, "threads": 32, "grouping": 12, "minblocks": 7, "algorithm": "medium", "perf": 3658.31, "source": "autotuned"},
{"m": 5, "n": 26, "k": 28, "tile_m": 3, "tile_n": 2, "threads": 32, "grouping": 12, "minblocks": 1, "algorithm": "medium", "perf": 3887.34, "source": "autotuned"},
{"m": 5, "n": 26, "k": 45, "tile_m": 3, "tile_n": 2, "w": 18, "v": 26, "threads": 32, "grouping": 16, "minblocks": 2, "algorithm": "largeDB2", "perf": 4137.52, "source": "autotuned"},
{"m": 5, "n": 28, "k": 4, "tile_m": 3, "tile_n": 2, "threads": 32, "grouping": 8, "minblocks": 18, "algorithm": "medium", "perf": 2058.09, "source": "autotuned"},
{"m": 5, "n": 28, "k": 5, "tile_m": 5, "tile_n": 1, "threads": 32, "grouping": 8, "minblocks": 7, "algorithm": "medium", "perf": 2354.84, "source": "autotuned"},
{"m": 5, "n": 28, "k": 7, "tile_m": 5, "tile_n": 1, "threads": 64, "grouping": 9, "minblocks": 15, "algorithm": "medium", "perf": 2512.0, "source": "autotuned"},
{"m": 5, "n": 28, "k": 9, "tile_m": 5, "tile_n": 1, "threads": 64, "grouping": 9, "minblocks": 18, "algorithm": "medium", "perf": 2916.83, "source": "autotuned"},
{"m": 5, "n": 28, "k": 13, "tile_m": 3, "tile_n": 2, "w": 6, "v": 28, "threads": 32, "grouping": 16, "minblocks": 8, "algorithm": "largeDB2", "perf": 3502.22, "source": "autotuned"},
{"m": 5, "n": 28, "k": 25, "tile_m": 3, "tile_n": 2, "threads": 32, "grouping": 11, "minblocks": 5, "algorithm": "medium", "perf": 3855.83, "source": "autotuned"},
{"m": 5, "n": 28, "k": 26, "tile_m": 3, "tile_n": 2, "threads": 32, "grouping": 12, "minblocks": 4, "algorithm": "medium", "perf": 4062.26, "source": "autotuned"},
{"m": 5, "n": 28, "k": 28, "tile_m": 3, "tile_n": 2, "threads": 32, "grouping": 12, "minblocks": 8, "algorithm": "medium", "perf": 4078.94, "source": "autotuned"},
{"m": 5, "n": 28, "k": 32, "tile_m": 3, "tile_n": 2, "threads": 32, "grouping": 12, "minblocks": 4, "algorithm": "medium", "perf": 4189.53, "source": "autotuned"},
{"m": 5, "n": 28, "k": 45, "tile_m": 3, "tile_n": 2, "w": 16, "v": 28, "threads": 32, "grouping": 16, "minblocks": 12, "algorithm": "largeDB2", "perf": 4257.13, "source": "autotuned"},
{"m": 5, "n": 32, "k": 4, "tile_m": 3, "tile_n": 2, "threads": 32, "grouping": 8, "minblocks": 25, "algorithm": "medium", "perf": 2240.52, "source": "autotuned"},
{"m": 5, "n": 32, "k": 7, "tile_m": 5, "tile_n": 1, "threads": 64, "grouping": 9, "minblocks": 15, "algorithm": "medium", "perf": 2896.32, "source": "autotuned"},
{"m": 5, "n": 32, "k": 9, "tile_m": 3, "tile_n": 2, "w": 4, "v": 32, "threads": 32, "grouping": 16, "minblocks": 1, "algorithm": "largeDB2", "perf": 3345.02, "source": "autotuned"},
{"m": 5, "n": 32, "k": 12, "tile_m": 3, "tile_n": 2, "w": 4, "v": 32, "threads": 32, "grouping": 16, "minblocks": 8, "algorithm": "largeDB2", "perf": 3987.41, "source": "autotuned"},
{"m": 5, "n": 32, "k": 13, "tile_m": 3, "tile_n": 2, "w": 6, "v": 32, "threads": 32, "grouping": 16, "minblocks": 4, "algorithm": "largeDB2", "perf": 4011.54, "source": "autotuned"},
{"m": 5, "n": 32, "k": 16, "tile_m": 3, "tile_n": 2, "threads": 32, "grouping": 8, "minblocks": 13, "algorithm": "medium", "perf": 4108.78, "source": "autotuned"},
{"m": 5, "n": 32, "k": 24, "tile_m": 3, "tile_n": 2, "threads": 32, "grouping": 12, "minblocks": 8, "algorithm": "medium", "perf": 4379.93, "source": "autotuned"},
{"m": 5, "n": 32, "k": 25, "tile_m": 3, "tile_n": 2, "threads": 32, "grouping": 11, "minblocks": 2, "algorithm": "medium", "perf": 4255.14, "source": "autotuned"},
{"m": 5, "n": 32, "k": 28, "tile_m": 3, "tile_n": 2, "threads": 32, "grouping": 12, "minblocks": 6, "algorithm": "medium", "perf": 4447.3, "source": "autotuned"},
{"m": 5, "n": 32, "k": 32, "tile_m": 3, "tile_n": 2, "threads": 32, "grouping": 12, "minblocks": 6, "algorithm": "medium", "perf": 4629.35, "source": "autotuned"},
{"m": 5, "n": 32, "k": 45, "tile_m": 3, "tile_n": 2, "w": 22, "v": 32, "threads": 32, "grouping": 16, "minblocks": 8, "algorithm": "largeDB2", "perf": 4456.84, "source": "autotuned"},
{"m": 5, "n": 45, "k": 4, "tile_m": 3, "tile_n": 3, "threads": 32, "grouping": 8, "minblocks": 1, "algorithm": "medium", "perf": 2621.79, "source": "autotuned"},
{"m": 5, "n": 45, "k": 5, "tile_m": 3, "tile_n": 3, "threads": 32, "grouping": 8, "minblocks": 15, "algorithm": "medium", "perf": 3022.92, "source": "autotuned"},
{"m": 5, "n": 45, "k": 7, "tile_m": 5, "tile_n": 2, "threads": 32, "grouping": 8, "minblocks": 10, "algorithm": "medium", "perf": 3262.85, "source": "autotuned"},
{"m": 5, "n": 45, "k": 9, "tile_m": 3, "tile_n": 3, "threads": 32, "grouping": 8, "minblocks": 15, "algorithm": "medium", "perf": 3697.53, "source": "autotuned"},
{"m": 5, "n": 45, "k": 13, "tile_m": 3, "tile_n": 3, "threads": 32, "grouping": 11, "minblocks": 2, "algorithm": "medium", "perf": 4182.87, "source": "autotuned"},
{"m": 5, "n": 45, "k": 25, "tile_m": 3, "tile_n": 3, "threads": 32, "grouping": 16, "minblocks": 4, "algorithm": "medium", "perf": 4318.31, "source": "autotuned"},
{"m": 5, "n": 45, "k": 26, "tile_m": 3, "tile_n": 3, "threads": 32, "grouping": 16, "minblocks": 5, "algorithm": "medium", "perf": 4321.88, "source": "autotuned"},
{"m": 5, "n": 45, "k": 28, "tile_m": 3, "tile_n": 3, "threads": 32, "grouping": 16, "minblocks": 5, "algorithm": "medium", "perf": 4431.76, "source": "autotuned"},
{"m": 5, "n": 45, "k": 32, "tile_m": 3, "tile_n": 3, "threads": 32, "grouping": 16, "minblocks": 3, "algorithm": "medium", "perf": 4609.93, "source": "autotuned"},
{"m": 5, "n": 45, "k": 45, "tile_m": 3, "tile_n": 3, "w": 18, "v": 36, "threads": 32, "grouping": 16, "minblocks": 2, "algorithm": "largeDB2", "perf": 4564.98, "source": "autotuned"},
{"m": 6, "n": 4, "k": 4, "tile_m": 1, "tile_n": 1, "threads": 32, "grouping": 7, "minblocks": 24, "algorithm": "medium", "perf": 552.067, "source": "autotuned"},
{"m": 6, "n": 4, "k": 5, "tile_m": 1, "tile_n": 1, "threads": 32, "grouping": 8, "minblocks": 10, "algorithm": "medium", "perf": 669.629, "source": "autotuned"},
{"m": 6, "n": 4, "k": 6, "tile_m": 1, "tile_n": 1, "threads": 64, "grouping": 9, "minblocks": 23, "algorithm": "medium", "perf": 729.256, "source": "autotuned"},
{"m": 6, "n": 4, "k": 7, "tile_m": 1, "tile_n": 1, "threads": 64, "grouping": 9, "minblocks": 9, "algorithm": "medium", "perf": 825.099, "source": "autotuned"},
{"m": 6, "n": 4, "k": 8, "tile_m": 1, "tile_n": 1, "threads": 64, "grouping": 9, "minblocks": 25, "algorithm": "medium", "perf": 920.167, "source": "autotuned"},
{"m": 6, "n": 4, "k": 9, "tile_m": 1, "tile_n": 1, "threads": 64, "grouping": 9, "minblocks": 16, "algorithm": "medium", "perf": 981.577, "source": "autotuned"},
{"m": 6, "n": 5, "k": 5, "tile_m": 1, "tile_n": 1, "threads": 32, "grouping": 8, "minblocks": 1, "algorithm": "medium", "perf": 844.962, "source": "autotuned"},
{"m": 6, "n": 5, "k": 6, "tile_m": 1, "tile_n": 1, "threads": 64, "grouping": 8, "minblocks": 10, "algorithm": "medium", "perf": 935.463, "source": "autotuned"},
{"m": 6, "n": 5, "k": 7, "tile_m": 1, "tile_n": 1, "threads": 64, "grouping": 9, "minblocks": 4, "algorithm": "medium", "perf": 1018.81, "source": "autotuned"},
{"m": 6, "n": 5, "k": 8, "tile_m": 1, "tile_n": 1, "threads": 64, "grouping": 9, "minblocks": 25, "algorithm": "medium", "perf": 1137.38, "source": "autotuned"},
{"m": 6, "n": 5, "k": 9, "tile_m": 1, "tile_n": 1, "threads": 64, "grouping": 8, "minblocks": 10, "algorithm": "medium", "perf": 1220.54, "source": "autotuned"},
{"m": 6, "n": 6, "k": 5, "tile_m": 1, "tile_n": 2, "threads": 32, "grouping": 10, "minblocks": 16, "algorithm": "medium", "perf": 926.533, "source": "autotuned"},
{"m": 6, "n": 6, "k": 6, "tile_m": 1, "tile_n": 2, "threads": 64, "grouping": 9, "minblocks": 19, "algorithm": "medium", "perf": 994.577, "source": "autotuned"},
{"m": 6, "n": 6, "k": 7, "tile_m": 1, "tile_n": 2, "threads": 64, "grouping": 9, "minblocks": 18, "algorithm": "medium", "perf": 1113.68, "source": "autotuned"},
{"m": 6, "n": 6, "k": 8, "tile_m": 1, "tile_n": 2, "threads": 64, "grouping": 9, "minblocks": 22, "algorithm": "medium", "perf": 1226.76, "source": "autotuned"},
{"m": 6, "n": 7, "k": 4, "tile_m": 1, "tile_n": 2, "threads": 32, "grouping": 9, "minblocks": 5, "algorithm": "medium", "perf": 889.294, "source": "autotuned"},
{"m": 6, "n": 7, "k": 5, "tile_m": 1, "tile_n": 2, "threads": 64, "grouping": 9, "minblocks": 8, "algorithm": "medium", "perf": 998.942, "source": "autotuned"},
{"m": 6, "n": 7, "k": 6, "tile_m": 1, "tile_n": 2, "threads": 64, "grouping": 9, "minblocks": 24, "algorithm": "medium", "perf": 1155.24, "source": "autotuned"},
{"m": 6, "n": 7, "k": 7, "tile_m": 1, "tile_n": 2, "threads": 64, "grouping": 9, "minblocks": 24, "algorithm": "medium", "perf": 1283.04, "source": "autotuned"},
{"m": 6, "n": 7, "k": 8, "tile_m": 1, "tile_n": 2, "threads": 64, "grouping": 9, "minblocks": 24, "algorithm": "medium", "perf": 1405.34, "source": "autotuned"},
{"m": 6, "n": 7, "k": 9, "tile_m": 1, "tile_n": 2, "threads": 64, "grouping": 9, "minblocks": 21, "algorithm": "medium", "perf": 1500.83, "source": "autotuned"},
{"m": 6, "n": 8, "k": 5, "tile_m": 1, "tile_n": 2, "threads": 64, "grouping": 9, "minblocks": 18, "algorithm": "medium", "perf": 1176.73, "source": "autotuned"},
{"m": 6, "n": 8, "k": 6, "tile_m": 1, "tile_n": 2, "threads": 64, "grouping": 9, "minblocks": 18, "algorithm": "medium", "perf": 1384.12, "source": "autotuned"},
{"m": 6, "n": 8, "k": 7, "tile_m": 1, "tile_n": 2, "threads": 64, "grouping": 9, "minblocks": 18, "algorithm": "medium", "perf": 1510.86, "source": "autotuned"},
{"m": 6, "n": 8, "k": 8, "tile_m": 1, "tile_n": 2, "threads": 64, "grouping": 5, "minblocks": 29, "algorithm": "small", "perf": 1445.59, "source": "autotuned"},
{"m": 6, "n": 8, "k": 9, "tile_m": 1, "tile_n": 2, "threads": 96, "grouping": 9, "minblocks": 14, "algorithm": "medium", "perf": 1596.28, "source": "autotuned"},
{"m": 6, "n": 9, "k": 4, "tile_m": 1, "tile_n": 2, "threads": 64, "grouping": 9, "minblocks": 18, "algorithm": "medium", "perf": 1072.72, "source": "autotuned"},
{"m": 6, "n": 9, "k": 5, "tile_m": 1, "tile_n": 2, "threads": 64, "grouping": 9, "minblocks": 1, "algorithm": "medium", "perf": 1275.03, "source": "autotuned"},
{"m": 6, "n": 9, "k": 6, "tile_m": 1, "tile_n": 2, "threads": 64, "grouping": 9, "minblocks": 24, "algorithm": "medium", "perf": 1461.82, "source": "autotuned"},
{"m": 6, "n": 9, "k": 7, "tile_m": 1, "tile_n": 2, "threads": 64, "grouping": 9, "minblocks": 21, "algorithm": "medium", "perf": 1623.25, "source": "autotuned"},
{"m": 6, "n": 9, "k": 8, "tile_m": 1, "tile_n": 2, "threads": 96, "grouping": 12, "minblocks": 3, "algorithm": "medium", "perf": 1650.72, "source": "autotuned"},
{"m": 6, "n": 9, "k": 9, "tile_m": 1, "tile_n": 2, "threads": 96, "grouping": 8, "minblocks": 21, "algorithm": "medium", "perf": 1783.65, "source": "autotuned"},
{"m": 7, "n": 4, "k": 4, "tile_m": 1, "tile_n": 1, "threads": 32, "grouping": 8, "minblocks": 5, "algorithm": "medium", "perf": 638.95, "source": "autotuned"},
{"m": 7, "n": 4, "k": 5, "tile_m": 1, "tile_n": 1, "threads": 64, "grouping": 8, "minblocks": 8, "algorithm": "medium", "perf": 705.011, "source": "autotuned"},
{"m": 7, "n": 4, "k": 6, "tile_m": 1, "tile_n": 1, "threads": 64, "grouping": 8, "minblocks": 8, "algorithm": "medium", "perf": 809.206, "source": "autotuned"},
{"m": 7, "n": 4, "k": 7, "tile_m": 1, "tile_n": 1, "threads": 64, "grouping": 8, "minblocks": 8, "algorithm": "medium", "perf": 904.037, "source": "autotuned"},
{"m": 7, "n": 4, "k": 8, "tile_m": 1, "tile_n": 1, "threads": 64, "grouping": 8, "minblocks": 8, "algorithm": "medium", "perf": 996.914, "source": "autotuned"},
{"m": 7, "n": 4, "k": 9, "tile_m": 1, "tile_n": 1, "threads": 64, "grouping": 4, "minblocks": 26, "algorithm": "medium", "perf": 1072.4, "source": "autotuned"},
{"m": 7, "n": 4, "k": 13, "tile_m": 1, "tile_n": 1, "threads": 96, "grouping": 8, "minblocks": 19, "algorithm": "medium", "perf": 1240.47, "source": "autotuned"},
{"m": 7, "n": 4, "k": 25, "tile_m": 1, "tile_n": 1, "threads": 128, "grouping": 8, "minblocks": 14, "algorithm": "medium", "perf": 1467.42, "source": "autotuned"},
{"m": 7, "n": 4, "k": 26, "tile_m": 1, "tile_n": 1, "threads": 128, "grouping": 8, "minblocks": 13, "algorithm": "medium", "perf": 1506.43, "source": "autotuned"},
{"m": 7, "n": 4, "k": 28, "tile_m": 1, "tile_n": 1, "threads": 128, "grouping": 8, "minblocks": 14, "algorithm": "medium", "perf": 1553.58, "source": "autotuned"},
{"m": 7, "n": 4, "k": 32, "tile_m": 1, "tile_n": 1, "threads": 32, "grouping": 4, "minblocks": 5, "algorithm": "medium", "perf": 1620.08, "source": "autotuned"},
{"m": 7, "n": 4, "k": 45, "tile_m": 1, "tile_n": 1, "w": 16, "v": 4, "threads": 32, "grouping": 16, "minblocks": 2, "algorithm": "largeDB2", "perf": 1817.0, "source": "autotuned"},
{"m": 7, "n": 5, "k": 4, "tile_m": 1, "tile_n": 3, "threads": 32, "grouping": 10, "minblocks": 16, "algorithm": "medium", "perf": 724.982, "source": "autotuned"},
{"m": 7, "n": 5, "k": 5, "tile_m": 2, "tile_n": 1, "threads": 64, "grouping": 8, "minblocks": 23, "algorithm": "medium", "perf": 822.723, "source": "autotuned"},
{"m": 7, "n": 5, "k": 6, "tile_m": 2, "tile_n": 1, "threads": 64, "grouping": 8, "minblocks": 22, "algorithm": "medium", "perf": 944.799, "source": "autotuned"},
{"m": 7, "n": 5, "k": 7, "tile_m": 2, "tile_n": 1, "threads": 64, "grouping": 8, "minblocks": 21, "algorithm": "medium", "perf": 1036.22, "source": "autotuned"},
{"m": 7, "n": 5, "k": 9, "tile_m": 2, "tile_n": 1, "threads": 64, "grouping": 9, "minblocks": 23, "algorithm": "medium", "perf": 1237.17, "source": "autotuned"},
{"m": 7, "n": 5, "k": 13, "tile_m": 2, "tile_n": 1, "threads": 96, "grouping": 8, "minblocks": 21, "algorithm": "medium", "perf": 1438.13, "source": "autotuned"},
{"m": 7, "n": 5, "k": 25, "tile_m": 4, "tile_n": 1, "threads": 32, "grouping": 8, "minblocks": 3, "algorithm": "medium", "perf": 1690.42, "source": "autotuned"},
{"m": 7, "n": 5, "k": 26, "tile_m": 4, "tile_n": 1, "threads": 32, "grouping": 8, "minblocks": 5, "algorithm": "medium", "perf": 1693.43, "source": "autotuned"},
{"m": 7, "n": 5, "k": 28, "tile_m": 4, "tile_n": 1, "threads": 32, "grouping": 8, "minblocks": 17, "algorithm": "medium", "perf": 1726.65, "source": "autotuned"},
{"m": 7, "n": 5, "k": 32, "tile_m": 4, "tile_n": 1, "threads": 32, "grouping": 8, "minblocks": 1, "algorithm": "medium", "perf": 1828.46, "source": "autotuned"},
{"m": 7, "n": 5, "k": 45, "tile_m": 2, "tile_n": 1, "w": 18, "v": 4, "threads": 32, "grouping": 16, "minblocks": 1, "algorithm": "largeDB2", "perf": 1983.18, "source": "autotuned"},
{"m": 7, "n": 6, "k": 5, "tile_m": 2, "tile_n": 1, "threads": 64, "grouping": 9, "minblocks": 4, "algorithm": "medium", "perf": 986.616, "source": "autotuned"},
{"m": 7, "n": 6, "k": 6, "tile_m": 2, "tile_n": 1, "threads": 64, "grouping": 9, "minblocks": 2, "algorithm": "medium", "perf": 1113.68, "source": "autotuned"},
{"m": 7, "n": 6, "k": 7, "tile_m": 2, "tile_n": 1, "threads": 64, "grouping": 9, "minblocks": 23, "algorithm": "medium", "perf": 1239.03, "source": "autotuned"},
{"m": 7, "n": 6, "k": 8, "tile_m": 2, "tile_n": 1, "threads": 64, "grouping": 9, "minblocks": 23, "algorithm": "medium", "perf": 1357.93, "source": "autotuned"},
{"m": 7, "n": 6, "k": 9, "tile_m": 2, "tile_n": 1, "threads": 64, "grouping": 9, "minblocks": 23, "algorithm": "medium", "perf": 1443.7, "source": "autotuned"},
{"m": 7, "n": 7, "k": 4, "tile_m": 2, "tile_n": 1, "threads": 32, "grouping": 9, "minblocks": 15, "algorithm": "medium", "perf": 1009.55, "source": "autotuned"},
{"m": 7, "n": 7, "k": 6, "tile_m": 2, "tile_n": 1, "threads": 64, "grouping": 9, "minblocks": 12, "algorithm": "medium", "perf": 1263.88, "source": "autotuned"},
{"m": 7, "n": 7, "k": 7, "tile_m": 2, "tile_n": 1, "threads": 64, "grouping": 11, "minblocks": 2, "algorithm": "medium", "perf": 1372.28, "source": "autotuned"},
{"m": 7, "n": 7, "k": 8, "tile_m": 2, "tile_n": 1, "threads": 64, "grouping": 9, "minblocks": 21, "algorithm": "medium", "perf": 1511.92, "source": "autotuned"},
{"m": 7, "n": 7, "k": 9, "tile_m": 4, "tile_n": 1, "threads": 32, "grouping": 5, "minblocks": 22, "algorithm": "small", "perf": 1634.71, "source": "autotuned"},
{"m": 7, "n": 7, "k": 25, "tile_m": 4, "tile_n": 1, "threads": 32, "grouping": 8, "minblocks": 21, "algorithm": "medium", "perf": 2385.41, "source": "autotuned"},
{"m": 7, "n": 7, "k": 26, "tile_m": 4, "tile_n": 1, "threads": 32, "grouping": 8, "minblocks": 7, "algorithm": "medium", "perf": 2413.12, "source": "autotuned"},
{"m": 7, "n": 7, "k": 28, "tile_m": 4, "tile_n": 1, "threads": 32, "grouping": 8, "minblocks": 20, "algorithm": "medium", "perf": 2401.68, "source": "autotuned"},
{"m": 7, "n": 7, "k": 32, "tile_m": 4, "tile_n": 1, "threads": 32, "grouping": 8, "minblocks": 10, "algorithm": "medium", "perf": 2539.77, "source": "autotuned"},
{"m": 7, "n": 8, "k": 6, "tile_m": 2, "tile_n": 1, "threads": 64, "grouping": 9, "minblocks": 23, "algorithm": "medium", "perf": 1453.98, "source": "autotuned"},
{"m": 7, "n": 8, "k": 7, "tile_m": 2, "tile_n": 1, "threads": 64, "grouping": 8, "minblocks": 21, "algorithm": "medium", "perf": 1593.16, "source": "autotuned"},
{"m": 7, "n": 8, "k": 8, "tile_m": 2, "tile_n": 1, "threads": 64, "grouping": 7, "minblocks": 3, "algorithm": "small", "perf": 1600.29, "source": "autotuned"},
{"m": 7, "n": 8, "k": 9, "tile_m": 4, "tile_n": 1, "threads": 96, "grouping": 8, "minblocks": 16, "algorithm": "medium", "perf": 1802.44, "source": "autotuned"},
{"m": 7, "n": 9, "k": 4, "tile_m": 1, "tile_n": 1, "threads": 64, "grouping": 11, "minblocks": 27, "algorithm": "medium", "perf": 1137.69, "source": "autotuned"},
{"m": 7, "n": 9, "k": 6, "tile_m": 2, "tile_n": 2, "threads": 64, "grouping": 9, "minblocks": 19, "algorithm": "medium", "perf": 1484.93, "source": "autotuned"},
{"m": 7, "n": 9, "k": 7, "tile_m": 2, "tile_n": 2, "threads": 64, "grouping": 9, "minblocks": 10, "algorithm": "medium", "perf": 1609.57, "source": "autotuned"},
{"m": 7, "n": 9, "k": 8, "tile_m": 4, "tile_n": 1, "threads": 96, "grouping": 8, "minblocks": 14, "algorithm": "medium", "perf": 1794.95, "source": "autotuned"},
{"m": 7, "n": 9, "k": 9, "tile_m": 4, "tile_n": 1, "threads": 96, "grouping": 8, "minblocks": 16, "algorithm": "medium", "perf": 1879.2, "source": "autotuned"},
{"m": 7, "n": 9, "k": 13, "tile_m": 4, "tile_n": 1, "threads": 128, "grouping": 16, "minblocks": 9, "algorithm": "medium", "perf": 2143.53, "source": "autotuned"},
{"m": 7, "n": 9, "k": 25, "tile_m": 4, "tile_n": 1, "threads": 32, "grouping": 8, "minblocks": 6, "algorithm": "medium", "perf": 2564.75, "source": "autotuned"},
{"m": 7, "n": 9, "k": 45, "tile_m": 4, "tile_n": 1, "w": 16, "v": 8, "threads": 32, "grouping": 16, "minblocks": 1, "algorithm": "largeDB2", "perf": 2979.65, "source": "autotuned"},
{"m": 7, "n": 13, "k": 4, "tile_m": 4, "tile_n": 1, "threads": 64, "grouping": 9, "minblocks": 1, "algorithm": "medium", "perf": 1612.38, "source": "autotuned"},
{"m": 7, "n": 13, "k": 5, "tile_m": 4, "tile_n": 1, "threads": 96, "grouping": 8, "minblocks": 14, "algorithm": "medium", "perf": 1797.14, "source": "autotuned"},
{"m": 7, "n": 13, "k": 7, "tile_m": 4, "tile_n": 1, "threads": 96, "grouping": 8, "minblocks": 14, "algorithm": "medium", "perf": 2254.94, "source": "autotuned"},
{"m": 7, "n": 13, "k": 9, "tile_m": 4, "tile_n": 1, "threads": 128, "grouping": 8, "minblocks": 15, "algorithm": "medium", "perf": 2446.03, "source": "autotuned"},
{"m": 7, "n": 13, "k": 13, "tile_m": 2, "tile_n": 2, "threads": 96, "grouping": 8, "minblocks": 14, "algorithm": "medium", "perf": 2747.55, "source": "autotuned"},
{"m": 7, "n": 13, "k": 25, "tile_m": 4, "tile_n": 1, "threads": 32, "grouping": 8, "minblocks": 3, "algorithm": "medium", "perf": 3482.88, "source": "autotuned"},
{"m": 7, "n": 13, "k": 26, "tile_m": 4, "tile_n": 1, "w": 12, "v": 8, "threads": 32, "grouping": 16, "minblocks": 2, "algorithm": "largeDB2", "perf": 3499.02, "source": "autotuned"},
{"m": 7, "n": 13, "k": 28, "tile_m": 4, "tile_n": 1, "w": 12, "v": 8, "threads": 32, "grouping": 16, "minblocks": 4, "algorithm": "largeDB2", "perf": 3576.0, "source": "autotuned"},
{"m": 7, "n": 13, "k": 32, "tile_m": 4, "tile_n": 1, "w": 14, "v": 8, "threads": 32, "grouping": 16, "minblocks": 8, "algorithm": "largeDB2", "perf": 3627.53, "source": "autotuned"},
{"m": 7, "n": 13, "k": 45, "tile_m": 4, "tile_n": 1, "w": 18, "v": 10, "threads": 32, "grouping": 16, "minblocks": 12, "algorithm": "largeDB2", "perf": 3806.95, "source": "autotuned"},
{"m": 7, "n": 25, "k": 4, "tile_m": 4, "tile_n": 2, "threads": 32, "grouping": 8, "minblocks": 1, "algorithm": "medium", "perf": 2396.56, "source": "autotuned"},
{"m": 7, "n": 25, "k": 5, "tile_m": 4, "tile_n": 1, "threads": 64, "grouping": 8, "minblocks": 19, "algorithm": "medium", "perf": 2593.95, "source": "autotuned"},
{"m": 7, "n": 25, "k": 7, "tile_m": 4, "tile_n": 1, "threads": 64, "grouping": 8, "minblocks": 23, "algorithm": "medium", "perf": 3020.42, "source": "autotuned"},
{"m": 7, "n": 25, "k": 9, "tile_m": 4, "tile_n": 2, "threads": 32, "grouping": 8, "minblocks": 10, "algorithm": "medium", "perf": 3448.54, "source": "autotuned"},
{"m": 7, "n": 25, "k": 13, "tile_m": 4, "tile_n": 2, "threads": 32, "grouping": 8, "minblocks": 15, "algorithm": "medium", "perf": 4100.38, "source": "autotuned"},
{"m": 7, "n": 25, "k": 25, "tile_m": 4, "tile_n": 2, "threads": 32, "grouping": 11, "minblocks": 6, "algorithm": "medium", "perf": 4517.93, "source": "autotuned"},
{"m": 7, "n": 25, "k": 26, "tile_m": 4, "tile_n": 2, "threads": 32, "grouping": 12, "minblocks": 8, "algorithm": "medium", "perf": 4619.17, "source": "autotuned"},
{"m": 7, "n": 25, "k": 28, "tile_m": 4, "tile_n": 2, "threads": 32, "grouping": 12, "minblocks": 4, "algorithm": "medium", "perf": 4696.45, "source": "autotuned"},
{"m": 7, "n": 25, "k": 45, "tile_m": 4, "tile_n": 2, "w": 16, "v": 24, "threads": 32, "grouping": 16, "minblocks": 12, "algorithm": "largeDB2", "perf": 5195.07, "source": "autotuned"},
{"m": 7, "n": 26, "k": 4, "tile_m": 4, "tile_n": 2, "threads": 32, "grouping": 8, "minblocks": 22, "algorithm": "medium", "perf": 2532.71, "source": "autotuned"},
{"m": 7, "n": 26, "k": 5, "tile_m": 4, "tile_n": 1, "threads": 64, "grouping": 8, "minblocks": 24, "algorithm": "medium", "perf": 2575.34, "source": "autotuned"},
{"m": 7, "n": 26, "k": 9, "tile_m": 4, "tile_n": 2, "threads": 32, "grouping": 8, "minblocks": 13, "algorithm": "medium", "perf": 3470.37, "source": "autotuned"},
{"m": 7, "n": 26, "k": 13, "tile_m": 4, "tile_n": 2, "w": 6, "v": 26, "threads": 32, "grouping": 16, "minblocks": 8, "algorithm": "largeDB2", "perf": 4415.56, "source": "autotuned"},
{"m": 7, "n": 26, "k": 25, "tile_m": 4, "tile_n": 2, "w": 12, "v": 26, "threads": 32, "grouping": 16, "minblocks": 1, "algorithm": "largeDB2", "perf": 4627.0, "source": "autotuned"},
{"m": 7, "n": 26, "k": 26, "tile_m": 4, "tile_n": 2, "threads": 32, "grouping": 12, "minblocks": 4, "algorithm": "medium", "perf": 4828.44, "source": "autotuned"},
{"m": 7, "n": 26, "k": 28, "tile_m": 4, "tile_n": 2, "threads": 32, "grouping": 12, "minblocks": 4, "algorithm": "medium", "perf": 4885.87, "source": "autotuned"},
{"m": 7, "n": 26, "k": 32, "tile_m": 4, "tile_n": 2, "w": 12, "v": 26, "threads": 32, "grouping": 16, "minblocks": 12, "algorithm": "largeDB2", "perf": 4987.86, "source": "autotuned"},
{"m": 7, "n": 26, "k": 45, "tile_m": 4, "tile_n": 2, "w": 16, "v": 26, "threads": 32, "grouping": 16, "minblocks": 2, "algorithm": "largeDB2", "perf": 5323.3, "source": "autotuned"},
{"m": 7, "n": 28, "k": 4, "tile_m": 4, "tile_n": 2, "threads": 32, "grouping": 8, "minblocks": 25, "algorithm": "medium", "perf": 2711.15, "source": "autotuned"},
{"m": 7, "n": 28, "k": 5, "tile_m": 4, "tile_n": 1, "threads": 64, "grouping": 8, "minblocks": 20, "algorithm": "medium", "perf": 2718.04, "source": "autotuned"},
{"m": 7, "n": 28, "k": 7, "tile_m": 4, "tile_n": 2, "threads": 32, "grouping": 7, "minblocks": 24, "algorithm": "medium", "perf": 3236.86, "source": "autotuned"},
{"m": 7, "n": 28, "k": 9, "tile_m": 4, "tile_n": 2, "threads": 32, "grouping": 8, "minblocks": 14, "algorithm": "medium", "perf": 3724.93, "source": "autotuned"},
{"m": 7, "n": 28, "k": 13, "tile_m": 4, "tile_n": 2, "threads": 32, "grouping": 8, "minblocks": 13, "algorithm": "medium", "perf": 4281.89, "source": "autotuned"},
{"m": 7, "n": 28, "k": 26, "tile_m": 4, "tile_n": 2, "threads": 32, "grouping": 12, "minblocks": 1, "algorithm": "medium", "perf": 5102.7, "source": "autotuned"},
{"m": 7, "n": 28, "k": 28, "tile_m": 4, "tile_n": 2, "threads": 32, "grouping": 11, "minblocks": 2, "algorithm": "medium", "perf": 4980.09, "source": "autotuned"},
{"m": 7, "n": 28, "k": 32, "tile_m": 4, "tile_n": 2, "w": 12, "v": 28, "threads": 32, "grouping": 16, "minblocks": 12, "algorithm": "largeDB2", "perf": 5234.12, "source": "autotuned"},
{"m": 7, "n": 28, "k": 45, "tile_m": 4, "tile_n": 2, "w": 16, "v": 28, "threads": 32, "grouping": 16, "minblocks": 2, "algorithm": "largeDB2", "perf": 5513.07, "source": "autotuned"},
{"m": 7, "n": 32, "k": 4, "tile_m": 4, "tile_n": 2, "threads": 32, "grouping": 8, "minblocks": 16, "algorithm": "medium", "perf": 2992.2, "source": "autotuned"},
{"m": 7, "n": 32, "k": 5, "tile_m": 4, "tile_n": 1, "threads": 64, "grouping": 9, "minblocks": 19, "algorithm": "medium", "perf": 3149.46, "source": "autotuned"},
{"m": 7, "n": 32, "k": 7, "tile_m": 4, "tile_n": 1, "threads": 64, "grouping": 9, "minblocks": 22, "algorithm": "medium", "perf": 3651.29, "source": "autotuned"},
{"m": 7, "n": 32, "k": 9, "tile_m": 4, "tile_n": 2, "w": 4, "v": 32, "threads": 32, "grouping": 16, "minblocks": 4, "algorithm": "largeDB2", "perf": 4409.54, "source": "autotuned"},
{"m": 7, "n": 32, "k": 26, "tile_m": 4, "tile_n": 2, "w": 12, "v": 32, "threads": 32, "grouping": 16, "minblocks": 8, "algorithm": "largeDB2", "perf": 5281.8, "source": "autotuned"},
{"m": 7, "n": 32, "k": 28, "tile_m": 4, "tile_n": 2, "w": 12, "v": 32, "threads": 32, "grouping": 16, "minblocks": 2, "algorithm": "largeDB2", "perf": 5402.38, "source": "autotuned"},
{"m": 7, "n": 32, "k": 32, "tile_m": 4, "tile_n": 2, "w": 12, "v": 32, "threads": 32, "grouping": 16, "minblocks": 1, "algorithm": "largeDB2", "perf": 5579.95, "source": "autotuned"},
{"m": 7, "n": 32, "k": 45, "tile_m": 4, "tile_n": 2, "w": 22, "v": 32, "threads": 32, "grouping": 16, "minblocks": 1, "algorithm": "largeDB2", "perf": 5840.79, "source": "autotuned"},
{"m": 7, "n": 45, "k": 4, "tile_m": 4, "tile_n": 3, "threads": 32, "grouping": 8, "minblocks": 4, "algorithm": "medium", "perf": 3562.67, "source": "autotuned"},
{"m": 7, "n": 45, "k": 5, "tile_m": 4, "tile_n": 2, "threads": 64, "grouping": 9, "minblocks": 13, "algorithm": "medium", "perf": 3697.1, "source": "autotuned"},
{"m": 7, "n": 45, "k": 7, "tile_m": 4, "tile_n": 3, "threads": 32, "grouping": 8, "minblocks": 13, "algorithm": "medium", "perf": 4425.54, "source": "autotuned"},
{"m": 7, "n": 45, "k": 9, "tile_m": 4, "tile_n": 3, "threads": 32, "grouping": 8, "minblocks": 16, "algorithm": "medium", "perf": 4977.42, "source": "autotuned"},
{"m": 7, "n": 45, "k": 13, "tile_m": 4, "tile_n": 3, "threads": 32, "grouping": 11, "minblocks": 11, "algorithm": "medium", "perf": 5352.28, "source": "autotuned"},
{"m": 7, "n": 45, "k": 25, "tile_m": 4, "tile_n": 3, "threads": 32, "grouping": 16, "minblocks": 4, "algorithm": "medium", "perf": 5655.03, "source": "autotuned"},
{"m": 7, "n": 45, "k": 26, "tile_m": 4, "tile_n": 3, "threads": 32, "grouping": 16, "minblocks": 4, "algorithm": "medium", "perf": 5676.14, "source": "autotuned"},
{"m": 7, "n": 45, "k": 28, "tile_m": 4, "tile_n": 3, "threads": 32, "grouping": 16, "minblocks": 4, "algorithm": "medium", "perf": 5818.48, "source": "autotuned"},
{"m": 7, "n": 45, "k": 32, "tile_m": 4, "tile_n": 3, "threads": 32, "grouping": 16, "minblocks": 3, "algorithm": "medium", "perf": 6058.37, "source": "autotuned"},
{"m": 7, "n": 45, "k": 45, "tile_m": 4, "tile_n": 3, "w": 16, "v": 44, "threads": 32, "grouping": 16, "minblocks": 2, "algorithm": "largeDB2", "perf": 6005.69, "source": "autotuned"},
{"m": 8, "n": 4, "k": 4, "tile_m": 1, "tile_n": 1, "threads": 32, "grouping": 6, "minblocks": 16, "algorithm": "medium", "perf": 594.964, "source": "autotuned"},
{"m": 8, "n": 4, "k": 5, "tile_m": 1, "tile_n": 1, "threads": 64, "grouping": 6, "minblocks": 16, "algorithm": "medium", "perf": 842.028, "source": "autotuned"},
{"m": 8, "n": 4, "k": 6, "tile_m": 1, "tile_n": 1, "threads": 64, "grouping": 6, "minblocks": 16, "algorithm": "medium", "perf": 982.597, "source": "autotuned"},
{"m": 8, "n": 4, "k": 7, "tile_m": 1, "tile_n": 1, "threads": 64, "grouping": 6, "minblocks": 16, "algorithm": "medium", "perf": 1105.08, "source": "autotuned"},
{"m": 8, "n": 4, "k": 8, "tile_m": 1, "tile_n": 1, "threads": 64, "grouping": 5, "minblocks": 26, "algorithm": "small", "perf": 1031.28, "source": "autotuned"},
{"m": 8, "n": 5, "k": 5, "tile_m": 2, "tile_n": 1, "threads": 64, "grouping": 9, "minblocks": 1, "algorithm": "medium", "perf": 968.826, "source": "autotuned"},
{"m": 8, "n": 5, "k": 6, "tile_m": 2, "tile_n": 1, "threads": 64, "grouping": 9, "minblocks": 24, "algorithm": "medium", "perf": 1110.96, "source": "autotuned"},
{"m": 8, "n": 5, "k": 7, "tile_m": 2, "tile_n": 1, "threads": 64, "grouping": 9, "minblocks": 15, "algorithm": "medium", "perf": 1220.3, "source": "autotuned"},
{"m": 8, "n": 6, "k": 4, "tile_m": 1, "tile_n": 2, "threads": 64, "grouping": 9, "minblocks": 18, "algorithm": "medium", "perf": 1001.36, "source": "autotuned"},
{"m": 8, "n": 6, "k": 5, "tile_m": 1, "tile_n": 2, "threads": 64, "grouping": 9, "minblocks": 18, "algorithm": "medium", "perf": 1169.78, "source": "autotuned"},
{"m": 8, "n": 6, "k": 7, "tile_m": 1, "tile_n": 2, "threads": 64, "grouping": 9, "minblocks": 18, "algorithm": "medium", "perf": 1517.13, "source": "autotuned"},
{"m": 8, "n": 6, "k": 8, "tile_m": 1, "tile_n": 2, "threads": 64, "grouping": 5, "minblocks": 25, "algorithm": "small", "perf": 1433.28, "source": "autotuned"},
{"m": 8, "n": 6, "k": 9, "tile_m": 1, "tile_n": 2, "threads": 96, "grouping": 8, "minblocks": 20, "algorithm": "medium", "perf": 1615.46, "source": "autotuned"},
{"m": 8, "n": 7, "k": 5, "tile_m": 1, "tile_n": 2, "threads": 64, "grouping": 9, "minblocks": 23, "algorithm": "medium", "perf": 1339.84, "source": "autotuned"},
{"m": 8, "n": 7, "k": 6, "tile_m": 1, "tile_n": 2, "threads": 64, "grouping": 9, "minblocks": 22, "algorithm": "medium", "perf": 1541.57, "source": "autotuned"},
{"m": 8, "n": 7, "k": 8, "tile_m": 1, "tile_n": 2, "threads": 64, "grouping": 7, "minblocks": 2, "algorithm": "small", "perf": 1616.54, "source": "autotuned"},
{"m": 8, "n": 7, "k": 9, "tile_m": 1, "tile_n": 2, "threads": 96, "grouping": 8, "minblocks": 18, "algorithm": "medium", "perf": 1850.69, "source": "autotuned"},
{"m": 8, "n": 8, "k": 4, "tile_m": 1, "tile_n": 1, "threads": 64, "grouping": 13, "minblocks": 21, "algorithm": "medium", "perf": 1238.72, "source": "autotuned"},
{"m": 8, "n": 8, "k": 8, "tile_m": 1, "tile_n": 2, "threads": 64, "grouping": 8, "minblocks": 14, "algorithm": "small", "perf": 2020.35, "source": "autotuned"},
{"m": 8, "n": 9, "k": 4, "tile_m": 4, "tile_n": 1, "threads": 64, "grouping": 9, "minblocks": 18, "algorithm": "medium", "perf": 1314.36, "source": "autotuned"},
{"m": 8, "n": 9, "k": 6, "tile_m": 4, "tile_n": 1, "threads": 64, "grouping": 9, "minblocks": 20, "algorithm": "medium", "perf": 1739.72, "source": "autotuned"},
{"m": 8, "n": 9, "k": 8, "tile_m": 4, "tile_n": 1, "threads": 96, "grouping": 8, "minblocks": 15, "algorithm": "medium", "perf": 2050.81, "source": "autotuned"},
{"m": 9, "n": 4, "k": 4, "tile_m": 1, "tile_n": 1, "threads": 64, "grouping": 10, "minblocks": 16, "algorithm": "medium", "perf": 716.145, "source": "autotuned"},
{"m": 9, "n": 4, "k": 5, "tile_m": 1, "tile_n": 1, "threads": 64, "grouping": 10, "minblocks": 16, "algorithm": "medium", "perf": 821.468, "source": "autotuned"},
{"m": 9, "n": 4, "k": 6, "tile_m": 1, "tile_n": 2, "threads": 64, "grouping": 9, "minblocks": 21, "algorithm": "medium", "perf": 941.291, "source": "autotuned"},
{"m": 9, "n": 4, "k": 7, "tile_m": 2, "tile_n": 1, "threads": 64, "grouping": 9, "minblocks": 21, "algorithm": "medium", "perf": 1023.52, "source": "autotuned"},
{"m": 9, "n": 4, "k": 9, "tile_m": 1, "tile_n": 4, "threads": 96, "grouping": 12, "minblocks": 11, "algorithm": "medium", "perf": 1127.1, "source": "autotuned"},
{"m": 9, "n": 4, "k": 22, "tile_m": 1, "tile_n": 4, "threads": 32, "grouping": 8, "minblocks": 2, "algorithm": "medium", "perf": 1530.42, "source": "autotuned"},
{"m": 9, "n": 4, "k": 25, "tile_m": 2, "tile_n": 1, "threads": 128, "grouping": 8, "minblocks": 15, "algorithm": "medium", "perf": 1556.96, "source": "autotuned"},
{"m": 9, "n": 4, "k": 26, "tile_m": 1, "tile_n": 2, "threads": 128, "grouping": 8, "minblocks": 16, "algorithm": "medium", "perf": 1635.12, "source": "autotuned"},
{"m": 9, "n": 4, "k": 28, "tile_m": 1, "tile_n": 4, "w": 10, "v": 4, "threads": 32, "grouping": 16, "minblocks": 2, "algorithm": "largeDB2", "perf": 1766.91, "source": "autotuned"},
{"m": 9, "n": 4, "k": 32, "tile_m": 1, "tile_n": 4, "w": 8, "v": 4, "threads": 32, "grouping": 16, "minblocks": 1, "algorithm": "largeDB2", "perf": 1788.82, "source": "autotuned"},
{"m": 9, "n": 5, "k": 4, "tile_m": 1, "tile_n": 1, "threads": 64, "grouping": 11, "minblocks": 13, "algorithm": "medium", "perf": 872.525, "source": "autotuned"},
{"m": 9, "n": 5, "k": 5, "tile_m": 1, "tile_n": 1, "threads": 64, "grouping": 9, "minblocks": 16, "algorithm": "medium", "perf": 1007.23, "source": "autotuned"},
{"m": 9, "n": 5, "k": 9, "tile_m": 1, "tile_n": 2, "threads": 96, "grouping": 9, "minblocks": 21, "algorithm": "medium", "perf": 1359.49, "source": "autotuned"},
{"m": 9, "n": 5, "k": 16, "tile_m": 1, "tile_n": 2, "threads": 96, "grouping": 8, "minblocks": 15, "algorithm": "medium", "perf": 1669.01, "source": "autotuned"},
{"m": 9, "n": 5, "k": 22, "tile_m": 1, "tile_n": 2, "threads": 128, "grouping": 8, "minblocks": 15, "algorithm": "medium", "perf": 1779.8, "source": "autotuned"},
{"m": 9, "n": 5, "k": 26, "tile_m": 1, "tile_n": 2, "threads": 32, "grouping": 4, "minblocks": 6, "algorithm": "medium", "perf": 1811.71, "source": "autotuned"},
{"m": 9, "n": 5, "k": 32, "tile_m": 1, "tile_n": 2, "w": 14, "v": 4, "threads": 32, "grouping": 16, "minblocks": 12, "algorithm": "largeDB2", "perf": 1992.32, "source": "autotuned"},
{"m": 9, "n": 5, "k": 45, "tile_m": 2, "tile_n": 1, "w": 18, "v": 4, "threads": 32, "grouping": 16, "minblocks": 1, "algorithm": "largeDB2", "perf": 2103.46, "source": "autotuned"},
{"m": 9, "n": 6, "k": 4, "tile_m": 1, "tile_n": 2, "threads": 64, "grouping": 9, "minblocks": 12, "algorithm": "medium", "perf": 1006.69, "source": "autotuned"},
{"m": 9, "n": 6, "k": 6, "tile_m": 1, "tile_n": 2, "threads": 64, "grouping": 13, "minblocks": 13, "algorithm": "medium", "perf": 1334.33, "source": "autotuned"},
{"m": 9, "n": 6, "k": 7, "tile_m": 1, "tile_n": 2, "threads": 64, "grouping": 9, "minblocks": 2, "algorithm": "medium", "perf": 1476.32, "source": "autotuned"},
{"m": 9, "n": 6, "k": 8, "tile_m": 1, "tile_n": 2, "threads": 96, "grouping": 9, "minblocks": 17, "algorithm": "medium", "perf": 1518.93, "source": "autotuned"},
{"m": 9, "n": 7, "k": 4, "tile_m": 1, "tile_n": 1, "threads": 64, "grouping": 11, "minblocks": 25, "algorithm": "medium", "perf": 1140.21, "source": "autotuned"},
{"m": 9, "n": 7, "k": 5, "tile_m": 1, "tile_n": 1, "threads": 64, "grouping": 11, "minblocks": 26, "algorithm": "medium", "perf": 1311.51, "source": "autotuned"},
{"m": 9, "n": 7, "k": 7, "tile_m": 1, "tile_n": 1, "threads": 64, "grouping": 7, "minblocks": 12, "algorithm": "medium", "perf": 1579.32, "source": "autotuned"},
{"m": 9, "n": 7, "k": 9, "tile_m": 6, "tile_n": 1, "threads": 32, "grouping": 4, "minblocks": 30, "algorithm": "small", "perf": 1759.93, "source": "autotuned"},
{"m": 9, "n": 7, "k": 13, "tile_m": 6, "tile_n": 1, "threads": 32, "grouping": 4, "minblocks": 29, "algorithm": "small", "perf": 2039.64, "source": "autotuned"},
{"m": 9, "n": 7, "k": 25, "tile_m": 6, "tile_n": 1, "threads": 32, "grouping": 8, "minblocks": 6, "algorithm": "medium", "perf": 2367.64, "source": "autotuned"},
{"m": 9, "n": 7, "k": 32, "tile_m": 6, "tile_n": 1, "threads": 32, "grouping": 8, "minblocks": 15, "algorithm": "medium", "perf": 2530.81, "source": "autotuned"},
{"m": 9, "n": 8, "k": 4, "tile_m": 2, "tile_n": 2, "threads": 64, "grouping": 9, "minblocks": 20, "algorithm": "medium", "perf": 1250.16, "source": "autotuned"},
{"m": 9, "n": 8, "k": 5, "tile_m": 3, "tile_n": 1, "threads": 64, "grouping": 9, "minblocks": 24, "algorithm": "medium", "perf": 1436.06, "source": "autotuned"},
{"m": 9, "n": 8, "k": 6, "tile_m": 2, "tile_n": 2, "threads": 64, "grouping": 8, "minblocks": 22, "algorithm": "medium", "perf": 1636.43, "source": "autotuned"},
{"m": 9, "n": 8, "k": 8, "tile_m": 5, "tile_n": 1, "threads": 96, "grouping": 8, "minblocks": 14, "algorithm": "medium", "perf": 1846.17, "source": "autotuned"},
{"m": 9, "n": 9, "k": 4, "tile_m": 1, "tile_n": 3, "threads": 64, "grouping": 8, "minblocks": 17, "algorithm": "medium", "perf": 1370.56, "source": "autotuned"},
{"m": 9, "n": 9, "k": 5, "tile_m": 1, "tile_n": 3, "threads": 64, "grouping": 8, "minblocks": 17, "algorithm": "medium", "perf": 1608.71, "source": "autotuned"},
{"m": 9, "n": 9, "k": 6, "tile_m": 5, "tile_n": 1, "threads": 32, "grouping": 5, "minblocks": 31, "algorithm": "small", "perf": 1788.64, "source": "autotuned"},
{"m": 9, "n": 9, "k": 7, "tile_m": 5, "tile_n": 1, "threads": 96, "grouping": 8, "minblocks": 15, "algorithm": "medium", "perf": 1942.09, "source": "autotuned"},
{"m": 9, "n": 9, "k": 8, "tile_m": 5, "tile_n": 1, "threads": 32, "grouping": 8, "minblocks": 12, "algorithm": "small", "perf": 2110.32, "source": "autotuned"},
{"m": 9, "n": 9, "k": 10, "tile_m": 5, "tile_n": 1, "threads": 32, "grouping": 8, "minblocks": 1, "algorithm": "small", "perf": 2365.47, "source": "autotuned"},
{"m": 9, "n": 9, "k": 12, "tile_m": 5, "tile_n": 1, "threads": 96, "grouping": 8, "minblocks": 14, "algorithm": "small", "perf": 2436.85, "source": "autotuned"},
{"m": 9, "n": 9, "k": 13, "tile_m": 5, "tile_n": 1, "threads": 96, "grouping": 8, "minblocks": 14, "algorithm": "small", "perf": 2508.47, "source": "autotuned"},
{"m": 9, "n": 9, "k": 16, "tile_m": 5, "tile_n": 1, "threads": 32, "grouping": 8, "minblocks": 24, "algorithm": "medium", "perf": 2686.54, "source": "autotuned"},
{"m": 9, "n": 9, "k": 17, "tile_m": 5, "tile_n": 1, "threads": 32, "grouping": 8, "minblocks": 6, "algorithm": "medium", "perf": 2734.81, "source": "autotuned"},
{"m": 9, "n": 9, "k": 22, "tile_m": 5, "tile_n": 1, "threads": 32, "grouping": 8, "minblocks": 5, "algorithm": "medium", "perf": 2870.46, "source": "autotuned"},
{"m": 9, "n": 9, "k": 23, "tile_m": 5, "tile_n": 1, "threads": 32, "grouping": 8, "minblocks": 1, "algorithm": "medium", "perf": 2917.16, "source": "autotuned"},
{"m": 9, "n": 9, "k": 25, "tile_m": 5, "tile_n": 1, "threads": 32, "grouping": 8, "minblocks": 14, "algorithm": "medium", "perf": 2934.28, "source": "autotuned"},
{"m": 9, "n": 9, "k": 26, "tile_m": 5, "tile_n": 1, "threads": 32, "grouping": 8, "minblocks": 17, "algorithm": "medium", "perf": 2955.47, "source": "autotuned"},
{"m": 9, "n": 9, "k": 28, "tile_m": 5, "tile_n": 1, "threads": 32, "grouping": 8, "minblocks": 15, "algorithm": "medium", "perf": 3055.91, "source": "autotuned"},
{"m": 9, "n": 9, "k": 45, "tile_m": 5, "tile_n": 1, "threads": 32, "grouping": 11, "minblocks": 1, "algorithm": "medium", "perf": 3337.94, "source": "autotuned"},
{"m": 9, "n": 10, "k": 10, "tile_m": 5, "tile_n": 1, "threads": 128, "grouping": 11, "minblocks": 12, "algorithm": "medium", "perf": 2349.66, "source": "autotuned"},
{"m": 9, "n": 10, "k": 32, "tile_m": 5, "tile_n": 1, "threads": 32, "grouping": 8, "minblocks": 13, "algorithm": "medium", "perf": 3348.91, "source": "autotuned"},
{"m": 9, "n": 12, "k": 9, "tile_m": 5, "tile_n": 1, "threads": 128, "grouping": 11, "minblocks": 11, "algorithm": "medium", "perf": 2639.14, "source": "autotuned"},
{"m": 9, "n": 12, "k": 10, "tile_m": 5, "tile_n": 1, "threads": 128, "grouping": 11, "minblocks": 11, "algorithm": "medium", "perf": 2792.88, "source": "autotuned"},
{"m": 9, "n": 12, "k": 32, "tile_m": 5, "tile_n": 1, "w": 12, "v": 12, "threads": 32, "grouping": 16, "minblocks": 12, "algorithm": "largeDB2", "perf": 3829.85, "source": "autotuned"},
{"m": 9, "n": 13, "k": 4, "tile_m": 5, "tile_n": 1, "threads": 96, "grouping": 11, "minblocks": 13, "algorithm": "medium", "perf": 1828.97, "source": "autotuned"},
{"m": 9, "n": 13, "k": 5, "tile_m": 5, "tile_n": 1, "threads": 96, "grouping": 11, "minblocks": 12, "algorithm": "medium", "perf": 2123.16, "source": "autotuned"},
{"m": 9, "n": 13, "k": 9, "tile_m": 5, "tile_n": 1, "threads": 128, "grouping": 11, "minblocks": 12, "algorithm": "medium", "perf": 2870.82, "source": "autotuned"},
{"m": 9, "n": 13, "k": 13, "tile_m": 5, "tile_n": 1, "threads": 32, "grouping": 8, "minblocks": 22, "algorithm": "medium", "perf": 3109.02, "source": "autotuned"},
{"m": 9, "n": 13, "k": 16, "tile_m": 5, "tile_n": 1, "threads": 32, "grouping": 8, "minblocks": 5, "algorithm": "medium", "perf": 3416.09, "source": "autotuned"},
{"m": 9, "n": 13, "k": 22, "tile_m": 5, "tile_n": 1, "w": 10, "v": 8, "threads": 32, "grouping": 16, "minblocks": 1, "algorithm": "largeDB2", "perf": 3724.85, "source": "autotuned"},
{"m": 9, "n": 13, "k": 23, "tile_m": 5, "tile_n": 1, "threads": 32, "grouping": 8, "minblocks": 14, "algorithm": "medium", "perf": 3730.9, "source": "autotuned"},
{"m": 9, "n": 13, "k": 26, "tile_m": 5, "tile_n": 1, "w": 12, "v": 8, "threads": 32, "grouping": 16, "minblocks": 8, "algorithm": "largeDB2", "perf": 3885.03, "source": "autotuned"},
{"m": 9, "n": 16, "k": 5, "tile_m": 5, "tile_n": 1, "threads": 96, "grouping": 8, "minblocks": 15, "algorithm": "medium", "perf": 2636.48, "source": "autotuned"},
{"m": 9, "n": 16, "k": 13, "tile_m": 5, "tile_n": 1, "threads": 32, "grouping": 8, "minblocks": 17, "algorithm": "medium", "perf": 3784.27, "source": "autotuned"},
{"m": 9, "n": 16, "k": 16, "tile_m": 5, "tile_n": 1, "w": 6, "v": 16, "threads": 32, "grouping": 16, "minblocks": 12, "algorithm": "largeDB2", "perf": 4288.65, "source": "autotuned"},
{"m": 9, "n": 16, "k": 17, "tile_m": 5, "tile_n": 1, "w": 8, "v": 16, "threads": 32, "grouping": 16, "minblocks": 12, "algorithm": "largeDB2", "perf": 4341.78, "source": "autotuned"},
{"m": 9, "n": 16, "k": 22, "tile_m": 5, "tile_n": 1, "w": 10, "v": 16, "threads": 32, "grouping": 16, "minblocks": 12, "algorithm": "largeDB2", "perf": 4486.54, "source": "autotuned"},
{"m": 9, "n": 16, "k": 23, "tile_m": 5, "tile_n": 1, "w": 10, "v": 16, "threads": 32, "grouping": 16, "minblocks": 12, "algorithm": "largeDB2", "perf": 4532.2, "source": "autotuned"},
{"m": 9, "n": 17, "k": 9, "tile_m": 3, "tile_n": 2, "threads": 96, "grouping": 8, "minblocks": 14, "algorithm": "medium", "perf": 3014.8, "source": "autotuned"},
{"m": 9, "n": 17, "k": 16, "tile_m": 5, "tile_n": 2, "threads": 32, "grouping": 8, "minblocks": 18, "algorithm": "medium", "perf": 3905.53, "source": "autotuned"},
{"m": 9, "n": 17, "k": 17, "tile_m": 5, "tile_n": 2, "threads": 32, "grouping": 8, "minblocks": 16, "algorithm": "medium", "perf": 3865.99, "source": "autotuned"},
{"m": 9, "n": 17, "k": 22, "tile_m": 5, "tile_n": 2, "threads": 32, "grouping": 8, "minblocks": 13, "algorithm": "medium", "perf": 3945.76, "source": "autotuned"},
{"m": 9, "n": 17, "k": 23, "tile_m": 5, "tile_n": 2, "w": 10, "v": 16, "threads": 32, "grouping": 16, "minblocks": 8, "algorithm": "largeDB2", "perf": 3961.1, "source": "autotuned"},
{"m": 9, "n": 22, "k": 4, "tile_m": 5, "tile_n": 2, "threads": 96, "grouping": 11, "minblocks": 11, "algorithm": "medium", "perf": 2623.92, "source": "autotuned"},
{"m": 9, "n": 22, "k": 9, "tile_m": 5, "tile_n": 2, "threads": 32, "grouping": 8, "minblocks": 15, "algorithm": "medium", "perf": 3629.41, "source": "autotuned"},
{"m": 9, "n": 22, "k": 13, "tile_m": 5, "tile_n": 2, "w": 6, "v": 22, "threads": 32, "grouping": 16, "minblocks": 12, "algorithm": "largeDB2", "perf": 4334.69, "source": "autotuned"},
{"m": 9, "n": 22, "k": 16, "tile_m": 5, "tile_n": 2, "threads": 32, "grouping": 8, "minblocks": 16, "algorithm": "medium", "perf": 4748.74, "source": "autotuned"},
{"m": 9, "n": 22, "k": 17, "tile_m": 5, "tile_n": 2, "w": 8, "v": 22, "threads": 32, "grouping": 16, "minblocks": 1, "algorithm": "largeDB2", "perf": 4527.64, "source": "autotuned"},
{"m": 9, "n": 22, "k": 22, "tile_m": 5, "tile_n": 2, "w": 10, "v": 22, "threads": 32, "grouping": 16, "minblocks": 4, "algorithm": "largeDB2", "perf": 4765.62, "source": "autotuned"},
{"m": 9, "n": 22, "k": 23, "tile_m": 5, "tile_n": 2, "w": 8, "v": 22, "threads": 32, "grouping": 16, "minblocks": 1, "algorithm": "largeDB2", "perf": 4776.75, "source": "autotuned"},
{"m": 9, "n": 22, "k": 26, "tile_m": 5, "tile_n": 2, "w": 10, "v": 22, "threads": 32, "grouping": 16, "minblocks": 4, "algorithm": "largeDB2", "perf": 4989.93, "source": "autotuned"},
{"m": 9, "n": 23, "k": 4, "tile_m": 5, "tile_n": 2, "threads": 96, "grouping": 11, "minblocks": 12, "algorithm": "medium", "perf": 2744.4, "source": "autotuned"},
{"m": 9, "n": 23, "k": 5, "tile_m": 5, "tile_n": 2, "threads": 128, "grouping": 16, "minblocks": 8, "algorithm": "medium", "perf": 2869.26, "source": "autotuned"},
{"m": 9, "n": 23, "k": 9, "tile_m": 5, "tile_n": 2, "threads": 32, "grouping": 8, "minblocks": 1, "algorithm": "medium", "perf": 3822.73, "source": "autotuned"},
{"m": 9, "n": 23, "k": 13, "tile_m": 5, "tile_n": 2, "threads": 32, "grouping": 8, "minblocks": 18, "algorithm": "medium", "perf": 4520.3, "source": "autotuned"},
{"m": 9, "n": 23, "k": 16, "tile_m": 5, "tile_n": 2, "threads": 32, "grouping": 8, "minblocks": 13, "algorithm": "medium", "perf": 4776.12, "source": "autotuned"},
{"m": 9, "n": 23, "k": 22, "tile_m": 5, "tile_n": 2, "w": 10, "v": 18, "threads": 32, "grouping": 16, "minblocks": 4, "algorithm": "largeDB2", "perf": 4768.41, "source": "autotuned"},
{"m": 9, "n": 23, "k": 26, "tile_m": 5, "tile_n": 2, "w": 10, "v": 22, "threads": 32, "grouping": 16, "minblocks": 8, "algorithm": "largeDB2", "perf": 5011.18, "source": "autotuned"},
{"m": 9, "n": 26, "k": 4, "tile_m": 5, "tile_n": 2, "threads": 128, "grouping": 16, "minblocks": 9, "algorithm": "medium", "perf": 2756.92, "source": "autotuned"},
{"m": 9, "n": 26, "k": 5, "tile_m": 5, "tile_n": 2, "threads": 160, "grouping": 16, "minblocks": 8, "algorithm": "medium", "perf": 2965.95, "source": "autotuned"},
{"m": 9, "n": 26, "k": 9, "tile_m": 5, "tile_n": 2, "threads": 32, "grouping": 8, "minblocks": 9, "algorithm": "medium", "perf": 4060.64, "source": "autotuned"},
{"m": 9, "n": 26, "k": 13, "tile_m": 5, "tile_n": 2, "w": 6, "v": 26, "threads": 32, "grouping": 16, "minblocks": 1, "algorithm": "largeDB2", "perf": 4970.11, "source": "autotuned"},
{"m": 9, "n": 26, "k": 22, "tile_m": 5, "tile_n": 2, "w": 8, "v": 26, "threads": 32, "grouping": 16, "minblocks": 1, "algorithm": "largeDB2", "perf": 5203.38, "source": "autotuned"},
{"m": 9, "n": 26, "k": 23, "tile_m": 5, "tile_n": 2, "threads": 32, "grouping": 11, "minblocks": 7, "algorithm": "medium", "perf": 5304.12, "source": "autotuned"},
{"m": 9, "n": 26, "k": 26, "tile_m": 5, "tile_n": 2, "w": 10, "v": 24, "threads": 32, "grouping": 16, "minblocks": 12, "algorithm": "largeDB2", "perf": 5491.04, "source": "autotuned"},
{"m": 10, "n": 10, "k": 10, "tile_m": 1, "tile_n": 4, "threads": 128, "grouping": 8, "minblocks": 15, "algorithm": "medium", "perf": 2776.72, "source": "autotuned"},
{"m": 10, "n": 10, "k": 32, "tile_m": 1, "tile_n": 4, "threads": 32, "grouping": 8, "minblocks": 4, "algorithm": "medium", "perf": 4126.77, "source": "autotuned"},
{"m": 10, "n": 12, "k": 10, "tile_m": 1, "tile_n": 4, "threads": 128, "grouping": 8, "minblocks": 16, "algorithm": "medium", "perf": 3303.18, "source": "autotuned"},
{"m": 10, "n": 15, "k": 10, "tile_m": 5, "tile_n": 1, "threads": 160, "grouping": 16, "minblocks": 8, "algorithm": "medium", "perf": 3532.59, "source": "autotuned"},
{"m": 10, "n": 15, "k": 15, "tile_m": 5, "tile_n": 1, "threads": 32, "grouping": 8, "minblocks": 21, "algorithm": "medium", "perf": 4026.3, "source": "autotuned"},
{"m": 11, "n": 11, "k": 11, "tile_m": 2, "tile_n": 3, "threads": 128, "grouping": 11, "minblocks": 12, "algorithm": "medium", "perf": 3201.37, "source": "autotuned"},
{"m": 12, "n": 12, "k": 12, "tile_m": 2, "tile_n": 3, "threads": 32, "grouping": 8, "minblocks": 24, "algorithm": "medium", "perf": 3990.69, "source": "autotuned"},
{"m": 13, "n": 4, "k": 4, "tile_m": 1, "tile_n": 2, "threads": 64, "grouping": 11, "minblocks": 21, "algorithm": "medium", "perf": 978.132, "source": "autotuned"},
{"m": 13, "n": 4, "k": 5, "tile_m": 1, "tile_n": 4, "threads": 96, "grouping": 8, "minblocks": 15, "algorithm": "medium", "perf": 1081.23, "source": "autotuned"},
{"m": 13, "n": 4, "k": 13, "tile_m": 1, "tile_n": 4, "threads": 32, "grouping": 5, "minblocks": 25, "algorithm": "medium", "perf": 1726.5, "source": "autotuned"},
{"m": 13, "n": 4, "k": 22, "tile_m": 1, "tile_n": 4, "threads": 32, "grouping": 8, "minblocks": 13, "algorithm": "medium", "perf": 2157.54, "source": "autotuned"},
{"m": 13, "n": 4, "k": 23, "tile_m": 1, "tile_n": 4, "threads": 32, "grouping": 8, "minblocks": 18, "algorithm": "medium", "perf": 2173.25, "source": "autotuned"},
{"m": 13, "n": 4, "k": 26, "tile_m": 1, "tile_n": 4, "w": 12, "v": 4, "threads": 32, "grouping": 16, "minblocks": 12, "algorithm": "largeDB2", "perf": 2264.94, "source": "autotuned"},
{"m": 13, "n": 5, "k": 4, "tile_m": 2, "tile_n": 2, "threads": 64, "grouping": 8, "minblocks": 23, "algorithm": "medium", "perf": 1105.85, "source": "autotuned"},
{"m": 13, "n": 5, "k": 5, "tile_m": 2, "tile_n": 2, "threads": 96, "grouping": 8, "minblocks": 16, "algorithm": "medium", "perf": 1244.09, "source": "autotuned"},
{"m": 13, "n": 5, "k": 9, "tile_m": 2, "tile_n": 2, "threads": 128, "grouping": 8, "minblocks": 13, "algorithm": "medium", "perf": 1627.66, "source": "autotuned"},
{"m": 13, "n": 5, "k": 13, "tile_m": 2, "tile_n": 2, "threads": 96, "grouping": 8, "minblocks": 15, "algorithm": "medium", "perf": 1874.2, "source": "autotuned"},
{"m": 13, "n": 5, "k": 16, "tile_m": 1, "tile_n": 5, "threads": 32, "grouping": 8, "minblocks": 4, "algorithm": "medium", "perf": 2029.24, "source": "autotuned"},
{"m": 13, "n": 5, "k": 22, "tile_m": 1, "tile_n": 5, "threads": 32, "grouping": 8, "minblocks": 20, "algorithm": "medium", "perf": 2290.09, "source": "autotuned"},
{"m": 13, "n": 5, "k": 23, "tile_m": 1, "tile_n": 5, "threads": 32, "grouping": 8, "minblocks": 13, "algorithm": "medium", "perf": 2315.86, "source": "autotuned"},
{"m": 13, "n": 5, "k": 26, "tile_m": 1, "tile_n": 5, "threads": 32, "grouping": 8, "minblocks": 17, "algorithm": "medium", "perf": 2340.99, "source": "autotuned"},
{"m": 13, "n": 9, "k": 4, "tile_m": 3, "tile_n": 2, "threads": 64, "grouping": 11, "minblocks": 20, "algorithm": "medium", "perf": 1732.15, "source": "autotuned"},
{"m": 13, "n": 9, "k": 5, "tile_m": 7, "tile_n": 1, "threads": 96, "grouping": 11, "minblocks": 11, "algorithm": "medium", "perf": 1975.06, "source": "autotuned"},
{"m": 13, "n": 9, "k": 9, "tile_m": 4, "tile_n": 2, "threads": 128, "grouping": 16, "minblocks": 8, "algorithm": "medium", "perf": 2510.64, "source": "autotuned"},
{"m": 13, "n": 9, "k": 13, "tile_m": 7, "tile_n": 1, "threads": 32, "grouping": 8, "minblocks": 22, "algorithm": "medium", "perf": 2809.09, "source": "autotuned"},
{"m": 13, "n": 9, "k": 16, "tile_m": 7, "tile_n": 1, "threads": 32, "grouping": 8, "minblocks": 15, "algorithm": "medium", "perf": 3009.78, "source": "autotuned"},
{"m": 13, "n": 9, "k": 22, "tile_m": 7, "tile_n": 1, "threads": 32, "grouping": 8, "minblocks": 13, "algorithm": "medium", "perf": 3248.96, "source": "autotuned"},
{"m": 13, "n": 9, "k": 23, "tile_m": 7, "tile_n": 1, "w": 10, "v": 8, "threads": 32, "grouping": 16, "minblocks": 2, "algorithm": "largeDB2", "perf": 3284.74, "source": "autotuned"},
{"m": 13, "n": 9, "k": 26, "tile_m": 7, "tile_n": 1, "w": 12, "v": 8, "threads": 32, "grouping": 16, "minblocks": 12, "algorithm": "largeDB2", "perf": 3376.37, "source": "autotuned"},
{"m": 13, "n": 13, "k": 4, "tile_m": 7, "tile_n": 1, "threads": 96, "grouping": 11, "minblocks": 11, "algorithm": "medium", "perf": 2438.26, "source": "autotuned"},
{"m": 13, "n": 13, "k": 5, "tile_m": 7, "tile_n": 1, "threads": 96, "grouping": 11, "minblocks": 12, "algorithm": "medium", "perf": 2696.22, "source": "autotuned"},
{"m": 13, "n": 13, "k": 9, "tile_m": 7, "tile_n": 1, "threads": 32, "grouping": 8, "minblocks": 26, "algorithm": "medium", "perf": 3562.13, "source": "autotuned"},
{"m": 13, "n": 13, "k": 13, "tile_m": 7, "tile_n": 1, "threads": 32, "grouping": 8, "minblocks": 15, "algorithm": "medium", "perf": 4013.31, "source": "autotuned"},
{"m": 13, "n": 13, "k": 16, "tile_m": 8, "tile_n": 1, "threads": 32, "grouping": 8, "minblocks": 19, "algorithm": "medium", "perf": 4268.0, "source": "autotuned"},
{"m": 13, "n": 13, "k": 17, "tile_m": 7, "tile_n": 1, "threads": 32, "grouping": 11, "minblocks": 17, "algorithm": "medium", "perf": 4334.69, "source": "autotuned"},
{"m": 13, "n": 13, "k": 23, "tile_m": 7, "tile_n": 1, "threads": 32, "grouping": 11, "minblocks": 10, "algorithm": "medium", "perf": 4796.32, "source": "autotuned"},
{"m": 13, "n": 13, "k": 26, "tile_m": 7, "tile_n": 1, "threads": 32, "grouping": 11, "minblocks": 10, "algorithm": "medium", "perf": 4838.94, "source": "autotuned"},
{"m": 13, "n": 16, "k": 5, "tile_m": 7, "tile_n": 1, "threads": 96, "grouping": 11, "minblocks": 11, "algorithm": "medium", "perf": 3382.25, "source": "autotuned"},
{"m": 13, "n": 16, "k": 13, "tile_m": 7, "tile_n": 1, "threads": 32, "grouping": 8, "minblocks": 18, "algorithm": "medium", "perf": 4582.54, "source": "autotuned"},
{"m": 13, "n": 16, "k": 23, "tile_m": 7, "tile_n": 1, "w": 8, "v": 16, "threads": 32, "grouping": 16, "minblocks": 12, "algorithm": "largeDB2", "perf": 5358.9, "source": "autotuned"},
{"m": 13, "n": 17, "k": 13, "tile_m": 4, "tile_n": 3, "threads": 32, "grouping": 8, "minblocks": 16, "algorithm": "medium", "perf": 4469.51, "source": "autotuned"},
{"m": 13, "n": 17, "k": 17, "tile_m": 4, "tile_n": 3, "threads": 32, "grouping": 8, "minblocks": 15, "algorithm": "medium", "perf": 4709.49, "source": "autotuned"},
{"m": 13, "n": 17, "k": 23, "tile_m": 4, "tile_n": 3, "w": 10, "v": 14, "threads": 32, "grouping": 16, "minblocks": 4, "algorithm": "largeDB2", "perf": 4904.75, "source": "autotuned"},
{"m": 13, "n": 22, "k": 5, "tile_m": 4, "tile_n": 3, "threads": 128, "grouping": 16, "minblocks": 9, "algorithm": "medium", "perf": 3661.94, "source": "autotuned"},
{"m": 13, "n": 22, "k": 9, "tile_m": 4, "tile_n": 3, "w": 4, "v": 22, "threads": 32, "grouping": 16, "minblocks": 12, "algorithm": "largeDB2", "perf": 4728.75, "source": "autotuned"},
{"m": 13, "n": 22, "k": 13, "tile_m": 4, "tile_n": 3, "w": 6, "v": 22, "threads": 32, "grouping": 16, "minblocks": 12, "algorithm": "largeDB2", "perf": 5496.3, "source": "autotuned"},
{"m": 13, "n": 22, "k": 22, "tile_m": 4, "tile_n": 3, "w": 8, "v": 22, "threads": 32, "grouping": 16, "minblocks": 2, "algorithm": "largeDB2", "perf": 5824.15, "source": "autotuned"},
{"m": 13, "n": 22, "k": 23, "tile_m": 4, "tile_n": 3, "w": 8, "v": 22, "threads": 32, "grouping": 16, "minblocks": 1, "algorithm": "largeDB2", "perf": 5962.0, "source": "autotuned"},
{"m": 13, "n": 23, "k": 4, "tile_m": 4, "tile_n": 3, "threads": 96, "grouping": 16, "minblocks": 9, "algorithm": "medium", "perf": 3520.82, "source": "autotuned"},
{"m": 13, "n": 23, "k": 5, "tile_m": 4, "tile_n": 3, "threads": 128, "grouping": 16, "minblocks": 9, "algorithm": "medium", "perf": 3807.68, "source": "autotuned"},
{"m": 13, "n": 23, "k": 9, "tile_m": 7, "tile_n": 2, "threads": 32, "grouping": 8, "minblocks": 16, "algorithm": "medium", "perf": 4821.93, "source": "autotuned"},
{"m": 13, "n": 23, "k": 13, "tile_m": 4, "tile_n": 3, "w": 6, "v": 22, "threads": 32, "grouping": 16, "minblocks": 1, "algorithm": "largeDB2", "perf": 5581.17, "source": "autotuned"},
{"m": 13, "n": 23, "k": 16, "tile_m": 7, "tile_n": 2, "threads": 32, "grouping": 8, "minblocks": 13, "algorithm": "medium", "perf": 5751.8, "source": "autotuned"},
{"m": 13, "n": 23, "k": 17, "tile_m": 4, "tile_n": 3, "w": 6, "v": 22, "threads": 32, "grouping": 16, "minblocks": 4, "algorithm": "largeDB2", "perf": 5745.3, "source": "autotuned"},
{"m": 13, "n": 23, "k": 22, "tile_m": 4, "tile_n": 3, "w": 8, "v": 22, "threads": 32, "grouping": 16, "minblocks": 2, "algorithm": "largeDB2", "perf": 5978.25, "source": "autotuned"},
{"m": 13, "n": 23, "k": 23, "tile_m": 4, "tile_n": 3, "w": 10, "v": 12, "threads": 32, "grouping": 16, "minblocks": 1, "algorithm": "largeDB2", "perf": 6044.95, "source": "autotuned"},
{"m": 13, "n": 23, "k": 26, "tile_m": 4, "tile_n": 3, "threads": 32, "grouping": 11, "minblocks": 7, "algorithm": "medium", "perf": 6320.59, "source": "autotuned"},
{"m": 13, "n": 26, "k": 4, "tile_m": 7, "tile_n": 2, "threads": 128, "grouping": 16, "minblocks": 8, "algorithm": "medium", "perf": 3589.44, "source": "autotuned"},
{"m": 13, "n": 26, "k": 5, "tile_m": 7, "tile_n": 2, "threads": 32, "grouping": 7, "minblocks": 17, "algorithm": "medium", "perf": 3806.27, "source": "autotuned"},
{"m": 13, "n": 26, "k": 9, "tile_m": 7, "tile_n": 2, "w": 4, "v": 26, "threads": 32, "grouping": 16, "minblocks": 1, "algorithm": "largeDB2", "perf": 5319.84, "source": "autotuned"},
{"m": 13, "n": 26, "k": 13, "tile_m": 7, "tile_n": 2, "w": 6, "v": 26, "threads": 32, "grouping": 16, "minblocks": 2, "algorithm": "largeDB2", "perf": 5988.25, "source": "autotuned"},
{"m": 13, "n": 26, "k": 22, "tile_m": 7, "tile_n": 2, "w": 8, "v": 16, "threads": 32, "grouping": 16, "minblocks": 1, "algorithm": "largeDB2", "perf": 6486.91, "source": "autotuned"},
{"m": 13, "n": 26, "k": 23, "tile_m": 7, "tile_n": 2, "w": 8, "v": 26, "threads": 32, "grouping": 16, "minblocks": 1, "algorithm": "largeDB2", "perf": 6623.88, "source": "autotuned"},
{"m": 13, "n": 26, "k": 26, "tile_m": 7, "tile_n": 2, "w": 10, "v": 26, "threads": 32, "grouping": 16, "minblocks": 4, "algorithm": "largeDB2", "perf": 6835.73, "source": "autotuned"},
{"m": 14, "n": 14, "k": 14, "tile_m": 8, "tile_n": 1, "threads": 32, "grouping": 8, "minblocks": 20, "algorithm": "medium", "perf": 4630.72, "source": "autotuned"},
{"m": 15, "n": 15, "k": 15, "tile_m": 2, "tile_n": 4, "threads": 32, "grouping": 11, "minblocks": 1, "algorithm": "medium", "perf": 5264.12, "source": "autotuned"},
{"m": 16, "n": 5, "k": 5, "tile_m": 1, "tile_n": 3, "threads": 96, "grouping": 8, "minblocks": 16, "algorithm": "medium", "perf": 1607.55, "source": "autotuned"},
{"m": 16, "n": 5, "k": 9, "tile_m": 1, "tile_n": 3, "threads": 32, "grouping": 5, "minblocks": 25, "algorithm": "medium", "perf": 2109.19, "source": "autotuned"},
{"m": 16, "n": 5, "k": 13, "tile_m": 1, "tile_n": 3, "threads": 32, "grouping": 8, "minblocks": 16, "algorithm": "medium", "perf": 2442.56, "source": "autotuned"},
{"m": 16, "n": 5, "k": 16, "tile_m": 1, "tile_n": 3, "w": 6, "v": 4, "threads": 32, "grouping": 16, "minblocks": 12, "algorithm": "largeDB2", "perf": 2801.07, "source": "autotuned"},
{"m": 16, "n": 5, "k": 23, "tile_m": 1, "tile_n": 3, "w": 10, "v": 4, "threads": 32, "grouping": 16, "minblocks": 12, "algorithm": "largeDB2", "perf": 3031.42, "source": "autotuned"},
{"m": 16, "n": 9, "k": 5, "tile_m": 1, "tile_n": 5, "threads": 96, "grouping": 11, "minblocks": 13, "algorithm": "medium", "perf": 2563.08, "source": "autotuned"},
{"m": 16, "n": 9, "k": 9, "tile_m": 1, "tile_n": 5, "threads": 32, "grouping": 7, "minblocks": 23, "algorithm": "medium", "perf": 3201.88, "source": "autotuned"},
{"m": 16, "n": 9, "k": 13, "tile_m": 2, "tile_n": 3, "threads": 32, "grouping": 8, "minblocks": 10, "algorithm": "medium", "perf": 3812.52, "source": "autotuned"},
{"m": 16, "n": 9, "k": 16, "tile_m": 2, "tile_n": 3, "threads": 32, "grouping": 8, "minblocks": 18, "algorithm": "medium", "perf": 4199.56, "source": "autotuned"},
{"m": 16, "n": 9, "k": 17, "tile_m": 2, "tile_n": 3, "threads": 32, "grouping": 8, "minblocks": 7, "algorithm": "medium", "perf": 4248.38, "source": "autotuned"},
{"m": 16, "n": 9, "k": 22, "tile_m": 2, "tile_n": 3, "w": 10, "v": 6, "threads": 32, "grouping": 16, "minblocks": 2, "algorithm": "largeDB2", "perf": 4421.85, "source": "autotuned"},
{"m": 16, "n": 9, "k": 23, "tile_m": 2, "tile_n": 3, "w": 10, "v": 8, "threads": 32, "grouping": 16, "minblocks": 4, "algorithm": "largeDB2", "perf": 4475.06, "source": "autotuned"},
{"m": 16, "n": 13, "k": 5, "tile_m": 2, "tile_n": 4, "threads": 96, "grouping": 11, "minblocks": 13, "algorithm": "medium", "perf": 3429.64, "source": "autotuned"},
{"m": 16, "n": 13, "k": 9, "tile_m": 2, "tile_n": 4, "threads": 32, "grouping": 8, "minblocks": 18, "algorithm": "medium", "perf": 4142.89, "source": "autotuned"},
{"m": 16, "n": 13, "k": 13, "tile_m": 2, "tile_n": 4, "threads": 32, "grouping": 8, "minblocks": 17, "algorithm": "medium", "perf": 4722.56, "source": "autotuned"},
{"m": 16, "n": 13, "k": 16, "tile_m": 2, "tile_n": 4, "w": 6, "v": 12, "threads": 32, "grouping": 16, "minblocks": 12, "algorithm": "largeDB2", "perf": 5250.85, "source": "autotuned"},
{"m": 16, "n": 13, "k": 23, "tile_m": 2, "tile_n": 4, "w": 8, "v": 12, "threads": 32, "grouping": 16, "minblocks": 12, "algorithm": "largeDB2", "perf": 5427.78, "source": "autotuned"},
{"m": 16, "n": 16, "k": 9, "tile_m": 2, "tile_n": 4, "threads": 32, "grouping": 8, "minblocks": 17, "algorithm": "medium", "perf": 5407.6, "source": "autotuned"},
{"m": 16, "n": 16, "k": 13, "tile_m": 2, "tile_n": 4, "w": 6, "v": 16, "threads": 32, "grouping": 16, "minblocks": 12, "algorithm": "largeDB2", "perf": 6074.89, "source": "autotuned"},
{"m": 16, "n": 16, "k": 16, "tile_m": 2, "tile_n": 4, "threads": 32, "grouping": 8, "minblocks": 13, "algorithm": "medium", "perf": 6802.35, "source": "autotuned"},
{"m": 16, "n": 16, "k": 17, "tile_m": 2, "tile_n": 4, "threads": 32, "grouping": 8, "minblocks": 14, "algorithm": "medium", "perf": 6745.91, "source": "autotuned"},
{"m": 16, "n": 16, "k": 22, "tile_m": 2, "tile_n": 4, "threads": 32, "grouping": 16, "minblocks": 11, "algorithm": "medium", "perf": 7007.16, "source": "autotuned"},
{"m": 16, "n": 16, "k": 23, "tile_m": 2, "tile_n": 4, "threads": 32, "grouping": 12, "minblocks": 1, "algorithm": "medium", "perf": 6835.4, "source": "autotuned"},
{"m": 16, "n": 17, "k": 9, "tile_m": 2, "tile_n": 5, "threads": 32, "grouping": 8, "minblocks": 1, "algorithm": "medium", "perf": 4969.09, "source": "autotuned"},
{"m": 16, "n": 17, "k": 16, "tile_m": 2, "tile_n": 5, "w": 6, "v": 16, "threads": 32, "grouping": 16, "minblocks": 8, "algorithm": "largeDB2", "perf": 5966.23, "source": "autotuned"},
{"m": 16, "n": 17, "k": 17, "tile_m": 2, "tile_n": 5, "threads": 32, "grouping": 8, "minblocks": 13, "algorithm": "medium", "perf": 5942.76, "source": "autotuned"},
{"m": 16, "n": 17, "k": 22, "tile_m": 2, "tile_n": 5, "w": 10, "v": 16, "threads": 32, "grouping": 16, "minblocks": 12, "algorithm": "largeDB2", "perf": 6156.19, "source": "autotuned"},
{"m": 16, "n": 17, "k": 23, "tile_m": 2, "tile_n": 5, "w": 8, "v": 14, "threads": 32, "grouping": 16, "minblocks": 4, "algorithm": "largeDB2", "perf": 6237.16, "source": "autotuned"},
{"m": 16, "n": 22, "k": 9, "tile_m": 2, "tile_n": 6, "threads": 32, "grouping": 8, "minblocks": 16, "algorithm": "medium", "perf": 5804.01, "source": "autotuned"},
{"m": 16, "n": 22, "k": 16, "tile_m": 2, "tile_n": 6, "w": 6, "v": 22, "threads": 32, "grouping": 16, "minblocks": 2, "algorithm": "largeDB2", "perf": 6995.56, "source": "autotuned"},
{"m": 16, "n": 22, "k": 17, "tile_m": 2, "tile_n": 6, "w": 8, "v": 22, "threads": 32, "grouping": 16, "minblocks": 12, "algorithm": "largeDB2", "perf": 6835.79, "source": "autotuned"},
{"m": 16, "n": 22, "k": 22, "tile_m": 2, "tile_n": 6, "w": 8, "v": 22, "threads": 32, "grouping": 16, "minblocks": 2, "algorithm": "largeDB2", "perf": 7235.14, "source": "autotuned"},
{"m": 16, "n": 22, "k": 23, "tile_m": 2, "tile_n": 6, "w": 10, "v": 20, "threads": 32, "grouping": 16, "minblocks": 8, "algorithm": "largeDB2", "perf": 7276.31, "source": "autotuned"},
{"m": 16, "n": 23, "k": 5, "tile_m": 2, "tile_n": 6, "threads": 128, "grouping": 16, "minblocks": 8, "algorithm": "medium", "perf": 4717.41, "source": "autotuned"},
{"m": 16, "n": 23, "k": 9, "tile_m": 2, "tile_n": 6, "threads": 32, "grouping": 8, "minblocks": 13, "algorithm": "medium", "perf": 5948.0, "source": "autotuned"},
{"m": 16, "n": 23, "k": 13, "tile_m": 2, "tile_n": 6, "w": 6, "v": 20, "threads": 32, "grouping": 16, "minblocks": 2, "algorithm": "largeDB2", "perf": 6982.73, "source": "autotuned"},
{"m": 16, "n": 23, "k": 16, "tile_m": 2, "tile_n": 6, "w": 6, "v": 22, "threads": 32, "grouping": 16, "minblocks": 12, "algorithm": "largeDB2", "perf": 7101.9, "source": "autotuned"},
{"m": 16, "n": 23, "k": 17, "tile_m": 2, "tile_n": 6, "w": 6, "v": 16, "threads": 32, "grouping": 16, "minblocks": 1, "algorithm": "largeDB2", "perf": 6958.44, "source": "autotuned"},
{"m": 16, "n": 23, "k": 22, "tile_m": 2, "tile_n": 6, "w": 8, "v": 16, "threads": 32, "grouping": 16, "minblocks": 1, "algorithm": "largeDB2", "perf": 7366.76, "source": "autotuned"},
{"m": 16, "n": 23, "k": 23, "tile_m": 2, "tile_n": 6, "w": 10, "v": 14, "threads": 32, "grouping": 16, "minblocks": 1, "algorithm": "largeDB2", "perf": 7537.07, "source": "autotuned"},
{"m": 17, "n": 9, "k": 9, "tile_m": 3, "tile_n": 2, "threads": 160, "grouping": 16, "minblocks": 8, "algorithm": "medium", "perf": 3218.3, "source": "autotuned"},
{"m": 17, "n": 9, "k": 16, "tile_m": 3, "tile_n": 2, "threads": 32, "grouping": 8, "minblocks": 18, "algorithm": "medium", "perf": 4038.2, "source": "autotuned"},
{"m": 17, "n": 9, "k": 17, "tile_m": 3, "tile_n": 2, "threads": 32, "grouping": 8, "minblocks": 4, "algorithm": "medium", "perf": 3973.75, "source": "autotuned"},
{"m": 17, "n": 9, "k": 22, "tile_m": 3, "tile_n": 2, "w": 10, "v": 8, "threads": 32, "grouping": 16, "minblocks": 1, "algorithm": "largeDB2", "perf": 4158.57, "source": "autotuned"},
{"m": 17, "n": 9, "k": 23, "tile_m": 3, "tile_n": 2, "w": 10, "v": 8, "threads": 32, "grouping": 16, "minblocks": 2, "algorithm": "largeDB2", "perf": 4242.79, "source": "autotuned"},
{"m": 17, "n": 13, "k": 13, "tile_m": 3, "tile_n": 3, "threads": 32, "grouping": 8, "minblocks": 18, "algorithm": "medium", "perf": 4631.58, "source": "autotuned"},
{"m": 17, "n": 13, "k": 17, "tile_m": 3, "tile_n": 3, "w": 8, "v": 8, "threads": 32, "grouping": 16, "minblocks": 4, "algorithm": "largeDB2", "perf": 4936.31, "source": "autotuned"},
{"m": 17, "n": 13, "k": 23, "tile_m": 3, "tile_n": 3, "w": 8, "v": 12, "threads": 32, "grouping": 16, "minblocks": 4, "algorithm": "largeDB2", "perf": 5220.32, "source": "autotuned"},
{"m": 17, "n": 16, "k": 9, "tile_m": 3, "tile_n": 4, "threads": 32, "grouping": 8, "minblocks": 5, "algorithm": "medium", "perf": 4818.51, "source": "autotuned"},
{"m": 17, "n": 16, "k": 16, "tile_m": 3, "tile_n": 4, "w": 6, "v": 16, "threads": 32, "grouping": 16, "minblocks": 12, "algorithm": "largeDB2", "perf": 5748.27, "source": "autotuned"},
{"m": 17, "n": 16, "k": 22, "tile_m": 3, "tile_n": 4, "w": 8, "v": 16, "threads": 32, "grouping": 16, "minblocks": 12, "algorithm": "largeDB2", "perf": 6001.88, "source": "autotuned"},
{"m": 17, "n": 16, "k": 23, "tile_m": 3, "tile_n": 4, "w": 10, "v": 16, "threads": 32, "grouping": 16, "minblocks": 2, "algorithm": "largeDB2", "perf": 6003.79, "source": "autotuned"},
{"m": 17, "n": 17, "k": 9, "tile_m": 3, "tile_n": 5, "threads": 32, "grouping": 8, "minblocks": 16, "algorithm": "medium", "perf": 4833.84, "source": "autotuned"},
{"m": 17, "n": 17, "k": 13, "tile_m": 3, "tile_n": 5, "threads": 32, "grouping": 8, "minblocks": 14, "algorithm": "medium", "perf": 5361.16, "source": "autotuned"},
{"m": 17, "n": 17, "k": 16, "tile_m": 3, "tile_n": 4, "threads": 32, "grouping": 8, "minblocks": 13, "algorithm": "medium", "perf": 6205.87, "source": "autotuned"},
{"m": 17, "n": 17, "k": 17, "tile_m": 3, "tile_n": 5, "threads": 32, "grouping": 11, "minblocks": 12, "algorithm": "medium", "perf": 5777.27, "source": "autotuned"},
{"m": 17, "n": 17, "k": 22, "tile_m": 3, "tile_n": 4, "threads": 32, "grouping": 16, "minblocks": 4, "algorithm": "medium", "perf": 6415.59, "source": "autotuned"},
{"m": 17, "n": 17, "k": 23, "tile_m": 3, "tile_n": 5, "threads": 32, "grouping": 11, "minblocks": 2, "algorithm": "medium", "perf": 5926.09, "source": "autotuned"},
{"m": 17, "n": 22, "k": 9, "tile_m": 5, "tile_n": 3, "w": 4, "v": 22, "threads": 32, "grouping": 16, "minblocks": 8, "algorithm": "largeDB2", "perf": 5401.69, "source": "autotuned"},
{"m": 17, "n": 22, "k": 16, "tile_m": 3, "tile_n": 5, "w": 6, "v": 22, "threads": 32, "grouping": 16, "minblocks": 8, "algorithm": "largeDB2", "perf": 6494.61, "source": "autotuned"},
{"m": 17, "n": 22, "k": 17, "tile_m": 3, "tile_n": 5, "w": 8, "v": 22, "threads": 32, "grouping": 16, "minblocks": 1, "algorithm": "largeDB2", "perf": 6552.18, "source": "autotuned"},
{"m": 17, "n": 22, "k": 22, "tile_m": 3, "tile_n": 5, "w": 8, "v": 22, "threads": 32, "grouping": 16, "minblocks": 1, "algorithm": "largeDB2", "perf": 6928.09, "source": "autotuned"},
{"m": 17, "n": 22, "k": 23, "tile_m": 3, "tile_n": 5, "w": 10, "v": 22, "threads": 32, "grouping": 16, "minblocks": 12, "algorithm": "largeDB2", "perf": 7064.6, "source": "autotuned"},
{"m": 17, "n": 23, "k": 9, "tile_m": 3, "tile_n": 5, "threads": 32, "grouping": 8, "minblocks": 15, "algorithm": "medium", "perf": 5650.24, "source": "autotuned"},
{"m": 17, "n": 23, "k": 13, "tile_m": 3, "tile_n": 5, "threads": 32, "grouping": 8, "minblocks": 14, "algorithm": "medium", "perf": 6398.39, "source": "autotuned"},
{"m": 17, "n": 23, "k": 16, "tile_m": 3, "tile_n": 5, "w": 6, "v": 20, "threads": 32, "grouping": 16, "minblocks": 12, "algorithm": "largeDB2", "perf": 6516.44, "source": "autotuned"},
{"m": 17, "n": 23, "k": 17, "tile_m": 3, "tile_n": 5, "w": 8, "v": 20, "threads": 32, "grouping": 16, "minblocks": 4, "algorithm": "largeDB2", "perf": 6666.86, "source": "autotuned"},
{"m": 17, "n": 23, "k": 22, "tile_m": 3, "tile_n": 5, "w": 8, "v": 20, "threads": 32, "grouping": 16, "minblocks": 4, "algorithm": "largeDB2", "perf": 7170.57, "source": "autotuned"},
{"m": 17, "n": 23, "k": 23, "tile_m": 3, "tile_n": 5, "w": 10, "v": 20, "threads": 32, "grouping": 16, "minblocks": 4, "algorithm": "largeDB2", "perf": 7254.69, "source": "autotuned"},
{"m": 18, "n": 18, "k": 18, "tile_m": 3, "tile_n": 4, "threads": 32, "grouping": 16, "minblocks": 2, "algorithm": "medium", "perf": 6847.21, "source": "autotuned"},
{"m": 19, "n": 19, "k": 19, "tile_m": 5, "tile_n": 3, "threads": 32, "grouping": 11, "minblocks": 6, "algorithm": "medium", "perf": 6629.12, "source": "autotuned"},
{"m": 20, "n": 11, "k": 11, "tile_m": 2, "tile_n": 4, "threads": 32, "grouping": 8, "minblocks": 20, "algorithm": "medium", "perf": 4284.52, "source": "autotuned"},
{"m": 20, "n": 11, "k": 12, "tile_m": 2, "tile_n": 4, "threads": 32, "grouping": 8, "minblocks": 13, "algorithm": "medium", "perf": 4318.6, "source": "autotuned"},
{"m": 20, "n": 11, "k": 20, "tile_m": 2, "tile_n": 4, "w": 8, "v": 10, "threads": 32, "grouping": 16, "minblocks": 12, "algorithm": "largeDB2", "perf": 4937.97, "source": "autotuned"},
{"m": 20, "n": 11, "k": 25, "tile_m": 2, "tile_n": 4, "w": 10, "v": 8, "threads": 32, "grouping": 16, "minblocks": 8, "algorithm": "largeDB2", "perf": 5022.87, "source": "autotuned"},
{"m": 20, "n": 11, "k": 32, "tile_m": 2, "tile_n": 4, "w": 14, "v": 8, "threads": 32, "grouping": 16, "minblocks": 8, "algorithm": "largeDB2", "perf": 5467.55, "source": "autotuned"},
{"m": 20, "n": 12, "k": 11, "tile_m": 2, "tile_n": 4, "threads": 32, "grouping": 8, "minblocks": 13, "algorithm": "medium", "perf": 4481.67, "source": "autotuned"},
{"m": 20, "n": 12, "k": 12, "tile_m": 2, "tile_n": 4, "threads": 32, "grouping": 8, "minblocks": 17, "algorithm": "medium", "perf": 4690.11, "source": "autotuned"},
{"m": 20, "n": 12, "k": 20, "tile_m": 10, "tile_n": 1, "w": 8, "v": 10, "threads": 32, "grouping": 16, "minblocks": 1, "algorithm": "largeDB2", "perf": 5272.51, "source": "autotuned"},
{"m": 20, "n": 12, "k": 25, "tile_m": 2, "tile_n": 4, "w": 10, "v": 12, "threads": 32, "grouping": 16, "minblocks": 12, "algorithm": "largeDB2", "perf": 5504.62, "source": "autotuned"},
{"m": 20, "n": 12, "k": 32, "tile_m": 2, "tile_n": 4, "w": 12, "v": 12, "threads": 32, "grouping": 16, "minblocks": 12, "algorithm": "largeDB2", "perf": 5958.43, "source": "autotuned"},
{"m": 20, "n": 20, "k": 11, "tile_m": 5, "tile_n": 3, "w": 4, "v": 20, "threads": 32, "grouping": 16, "minblocks": 2, "algorithm": "largeDB2", "perf": 6466.27, "source": "autotuned"},
{"m": 20, "n": 20, "k": 25, "tile_m": 5, "tile_n": 3, "threads": 32, "grouping": 16, "minblocks": 7, "algorithm": "medium", "perf": 7599.23, "source": "autotuned"},
{"m": 20, "n": 20, "k": 32, "tile_m": 5, "tile_n": 3, "threads": 32, "grouping": 16, "minblocks": 4, "algorithm": "medium", "perf": 8030.94, "source": "autotuned"},
{"m": 20, "n": 25, "k": 11, "tile_m": 10, "tile_n": 2, "w": 4, "v": 16, "threads": 32, "grouping": 16, "minblocks": 12, "algorithm": "largeDB2", "perf": 6778.3, "source": "autotuned"},
{"m": 20, "n": 25, "k": 12, "tile_m": 10, "tile_n": 2, "w": 4, "v": 24, "threads": 32, "grouping": 16, "minblocks": 12, "algorithm": "largeDB2", "perf": 6838.44, "source": "autotuned"},
{"m": 20, "n": 25, "k": 20, "tile_m": 10, "tile_n": 2, "w": 8, "v": 24, "threads": 32, "grouping": 16, "minblocks": 8, "algorithm": "largeDB2", "perf": 7882.68, "source": "autotuned"},
{"m": 20, "n": 25, "k": 25, "tile_m": 10, "tile_n": 2, "w": 10, "v": 16, "threads": 32, "grouping": 16, "minblocks": 12, "algorithm": "largeDB2", "perf": 8244.33, "source": "autotuned"},
{"m": 20, "n": 25, "k": 32, "tile_m": 10, "tile_n": 2, "w": 12, "v": 24, "threads": 32, "grouping": 16, "minblocks": 8, "algorithm": "largeDB2", "perf": 8888.37, "source": "autotuned"},
{"m": 20, "n": 32, "k": 12, "tile_m": 10, "tile_n": 2, "w": 4, "v": 32, "threads": 32, "grouping": 16, "minblocks": 8, "algorithm": "largeDB2", "perf": 8606.12, "source": "autotuned"},
{"m": 20, "n": 32, "k": 25, "tile_m": 10, "tile_n": 2, "w": 10, "v": 32, "threads": 32, "grouping": 16, "minblocks": 8, "algorithm": "largeDB2", "perf": 10292.6, "source": "autotuned"},
{"m": 21, "n": 21, "k": 21, "tile_m": 6, "tile_n": 3, "w": 8, "v": 20, "threads": 32, "grouping": 16, "minblocks": 1, "algorithm": "largeDB2", "perf": 7051.94, "source": "autotuned"},
{"m": 22, "n": 4, "k": 4, "tile_m": 1, "tile_n": 4, "threads": 96, "grouping": 9, "minblocks": 14, "algorithm": "medium", "perf": 1454.31, "source": "autotuned"},
{"m": 22, "n": 4, "k": 5, "tile_m": 1, "tile_n": 4, "threads": 32, "grouping": 7, "minblocks": 10, "algorithm": "medium", "perf": 1630.14, "source": "autotuned"},
{"m": 22, "n": 4, "k": 9, "tile_m": 1, "tile_n": 4, "threads": 64, "grouping": 8, "minblocks": 20, "algorithm": "medium", "perf": 2076.12, "source": "autotuned"},
{"m": 22, "n": 4, "k": 13, "tile_m": 1, "tile_n": 4, "threads": 32, "grouping": 8, "minblocks": 2, "algorithm": "medium", "perf": 2505.71, "source": "autotuned"},
{"m": 22, "n": 4, "k": 22, "tile_m": 1, "tile_n": 4, "w": 10, "v": 4, "threads": 32, "grouping": 16, "minblocks": 4, "algorithm": "largeDB2", "perf": 2812.11, "source": "autotuned"},
{"m": 22, "n": 4, "k": 23, "tile_m": 1, "tile_n": 4, "threads": 32, "grouping": 8, "minblocks": 13, "algorithm": "medium", "perf": 2861.0, "source": "autotuned"},
{"m": 22, "n": 4, "k": 26, "tile_m": 1, "tile_n": 4, "threads": 32, "grouping": 11, "minblocks": 4, "algorithm": "medium", "perf": 2752.84, "source": "autotuned"},
{"m": 22, "n": 5, "k": 4, "tile_m": 1, "tile_n": 5, "threads": 96, "grouping": 11, "minblocks": 11, "algorithm": "medium", "perf": 1673.3, "source": "autotuned"},
{"m": 22, "n": 5, "k": 5, "tile_m": 1, "tile_n": 5, "threads": 32, "grouping": 8, "minblocks": 3, "algorithm": "medium", "perf": 1882.68, "source": "autotuned"},
{"m": 22, "n": 5, "k": 9, "tile_m": 1, "tile_n": 5, "threads": 96, "grouping": 11, "minblocks": 11, "algorithm": "medium", "perf": 2302.6, "source": "autotuned"},
{"m": 22, "n": 5, "k": 13, "tile_m": 1, "tile_n": 5, "threads": 32, "grouping": 8, "minblocks": 21, "algorithm": "medium", "perf": 2762.81, "source": "autotuned"},
{"m": 22, "n": 5, "k": 22, "tile_m": 1, "tile_n": 5, "threads": 32, "grouping": 8, "minblocks": 13, "algorithm": "medium", "perf": 3070.47, "source": "autotuned"},
{"m": 22, "n": 5, "k": 23, "tile_m": 1, "tile_n": 5, "threads": 32, "grouping": 8, "minblocks": 6, "algorithm": "medium", "perf": 3148.73, "source": "autotuned"},
{"m": 22, "n": 9, "k": 4, "tile_m": 3, "tile_n": 3, "threads": 96, "grouping": 11, "minblocks": 12, "algorithm": "medium", "perf": 2587.35, "source": "autotuned"},
{"m": 22, "n": 9, "k": 5, "tile_m": 3, "tile_n": 3, "threads": 128, "grouping": 16, "minblocks": 9, "algorithm": "medium", "perf": 2628.56, "source": "autotuned"},
{"m": 22, "n": 9, "k": 9, "tile_m": 3, "tile_n": 3, "threads": 32, "grouping": 8, "minblocks": 15, "algorithm": "medium", "perf": 3572.26, "source": "autotuned"},
{"m": 22, "n": 9, "k": 13, "tile_m": 3, "tile_n": 3, "threads": 32, "grouping": 8, "minblocks": 15, "algorithm": "medium", "perf": 4212.36, "source": "autotuned"},
{"m": 22, "n": 9, "k": 17, "tile_m": 3, "tile_n": 3, "threads": 32, "grouping": 8, "minblocks": 13, "algorithm": "medium", "perf": 4475.48, "source": "autotuned"},
{"m": 22, "n": 9, "k": 22, "tile_m": 3, "tile_n": 3, "w": 10, "v": 8, "threads": 32, "grouping": 16, "minblocks": 1, "algorithm": "largeDB2", "perf": 4703.88, "source": "autotuned"},
{"m": 22, "n": 9, "k": 23, "tile_m": 3, "tile_n": 3, "w": 8, "v": 8, "threads": 32, "grouping": 16, "minblocks": 8, "algorithm": "largeDB2", "perf": 4689.87, "source": "autotuned"},
{"m": 22, "n": 13, "k": 4, "tile_m": 3, "tile_n": 4, "threads": 96, "grouping": 13, "minblocks": 10, "algorithm": "medium", "perf": 3511.38, "source": "autotuned"},
{"m": 22, "n": 13, "k": 5, "tile_m": 3, "tile_n": 4, "threads": 128, "grouping": 16, "minblocks": 8, "algorithm": "medium", "perf": 3722.7, "source": "autotuned"},
{"m": 22, "n": 13, "k": 9, "tile_m": 3, "tile_n": 4, "threads": 32, "grouping": 8, "minblocks": 10, "algorithm": "medium", "perf": 4871.91, "source": "autotuned"},
{"m": 22, "n": 13, "k": 13, "tile_m": 3, "tile_n": 4, "threads": 32, "grouping": 8, "minblocks": 16, "algorithm": "medium", "perf": 5496.3, "source": "autotuned"},
{"m": 22, "n": 13, "k": 22, "tile_m": 3, "tile_n": 4, "w": 10, "v": 12, "threads": 32, "grouping": 16, "minblocks": 4, "algorithm": "largeDB2", "perf": 6038.34, "source": "autotuned"},
{"m": 22, "n": 13, "k": 23, "tile_m": 3, "tile_n": 4, "w": 8, "v": 12, "threads": 32, "grouping": 16, "minblocks": 4, "algorithm": "largeDB2", "perf": 6138.11, "source": "autotuned"},
{"m": 22, "n": 13, "k": 26, "tile_m": 3, "tile_n": 4, "w": 10, "v": 12, "threads": 32, "grouping": 16, "minblocks": 12, "algorithm": "largeDB2", "perf": 6335.88, "source": "autotuned"},
{"m": 22, "n": 16, "k": 9, "tile_m": 3, "tile_n": 4, "w": 4, "v": 16, "threads": 32, "grouping": 16, "minblocks": 12, "algorithm": "largeDB2", "perf": 6157.36, "source": "autotuned"},
{"m": 22, "n": 16, "k": 16, "tile_m": 3, "tile_n": 4, "threads": 32, "grouping": 8, "minblocks": 13, "algorithm": "medium", "perf": 6943.83, "source": "autotuned"},
{"m": 22, "n": 16, "k": 17, "tile_m": 3, "tile_n": 4, "w": 8, "v": 16, "threads": 32, "grouping": 16, "minblocks": 1, "algorithm": "largeDB2", "perf": 6867.16, "source": "autotuned"},
{"m": 22, "n": 16, "k": 22, "tile_m": 3, "tile_n": 4, "w": 8, "v": 16, "threads": 32, "grouping": 16, "minblocks": 4, "algorithm": "largeDB2", "perf": 7264.54, "source": "autotuned"},
{"m": 22, "n": 16, "k": 23, "tile_m": 3, "tile_n": 4, "w": 8, "v": 16, "threads": 32, "grouping": 16, "minblocks": 8, "algorithm": "largeDB2", "perf": 7324.57, "source": "autotuned"},
{"m": 22, "n": 17, "k": 9, "tile_m": 3, "tile_n": 5, "threads": 32, "grouping": 8, "minblocks": 13, "algorithm": "medium", "perf": 5367.25, "source": "autotuned"},
{"m": 22, "n": 17, "k": 16, "tile_m": 3, "tile_n": 5, "w": 6, "v": 16, "threads": 32, "grouping": 16, "minblocks": 4, "algorithm": "largeDB2", "perf": 6549.09, "source": "autotuned"},
{"m": 22, "n": 17, "k": 17, "tile_m": 3, "tile_n": 5, "w": 8, "v": 16, "threads": 32, "grouping": 16, "minblocks": 4, "algorithm": "largeDB2", "perf": 6511.93, "source": "autotuned"},
{"m": 22, "n": 17, "k": 22, "tile_m": 3, "tile_n": 5, "w": 10, "v": 10, "threads": 32, "grouping": 16, "minblocks": 12, "algorithm": "largeDB2", "perf": 6963.26, "source": "autotuned"},
{"m": 22, "n": 17, "k": 23, "tile_m": 3, "tile_n": 5, "w": 8, "v": 16, "threads": 32, "grouping": 16, "minblocks": 1, "algorithm": "largeDB2", "perf": 7166.59, "source": "autotuned"},
{"m": 22, "n": 22, "k": 4, "tile_m": 3, "tile_n": 4, "threads": 96, "grouping": 16, "minblocks": 8, "algorithm": "medium", "perf": 4766.05, "source": "autotuned"},
{"m": 22, "n": 22, "k": 5, "tile_m": 3, "tile_n": 3, "threads": 128, "grouping": 16, "minblocks": 10, "algorithm": "medium", "perf": 4964.64, "source": "autotuned"},
{"m": 22, "n": 22, "k": 9, "tile_m": 6, "tile_n": 3, "w": 4, "v": 22, "threads": 32, "grouping": 16, "minblocks": 2, "algorithm": "largeDB2", "perf": 6333.37, "source": "autotuned"},
{"m": 22, "n": 22, "k": 13, "tile_m": 3, "tile_n": 6, "w": 6, "v": 22, "threads": 32, "grouping": 16, "minblocks": 2, "algorithm": "largeDB2", "perf": 7152.23, "source": "autotuned"},
{"m": 22, "n": 22, "k": 16, "tile_m": 3, "tile_n": 6, "w": 6, "v": 22, "threads": 32, "grouping": 16, "minblocks": 2, "algorithm": "largeDB2", "perf": 7723.25, "source": "autotuned"},
{"m": 22, "n": 22, "k": 17, "tile_m": 3, "tile_n": 6, "w": 6, "v": 22, "threads": 32, "grouping": 16, "minblocks": 1, "algorithm": "largeDB2", "perf": 7708.93, "source": "autotuned"},
{"m": 22, "n": 22, "k": 22, "tile_m": 3, "tile_n": 6, "w": 8, "v": 20, "threads": 32, "grouping": 16, "minblocks": 1, "algorithm": "largeDB2", "perf": 8343.08, "source": "autotuned"},
{"m": 22, "n": 22, "k": 23, "tile_m": 3, "tile_n": 6, "w": 8, "v": 20, "threads": 32, "grouping": 16, "minblocks": 4, "algorithm": "largeDB2", "perf": 8517.7, "source": "autotuned"},
{"m": 22, "n": 22, "k": 26, "tile_m": 3, "tile_n": 6, "w": 10, "v": 22, "threads": 32, "grouping": 16, "minblocks": 1, "algorithm": "largeDB2", "perf": 8866.82, "source": "autotuned"},
{"m": 22, "n": 22, "k": 32, "tile_m": 3, "tile_n": 6, "w": 12, "v": 22, "threads": 32, "grouping": 16, "minblocks": 12, "algorithm": "largeDB2", "perf": 9280.85, "source": "autotuned"},
{"m": 22, "n": 23, "k": 4, "tile_m": 3, "tile_n": 3, "threads": 96, "grouping": 16, "minblocks": 12, "algorithm": "medium", "perf": 4932.11, "source": "autotuned"},
{"m": 22, "n": 23, "k": 5, "tile_m": 3, "tile_n": 3, "threads": 128, "grouping": 11, "minblocks": 11, "algorithm": "medium", "perf": 5097.26, "source": "autotuned"},
{"m": 22, "n": 23, "k": 9, "tile_m": 6, "tile_n": 3, "w": 4, "v": 12, "threads": 32, "grouping": 16, "minblocks": 1, "algorithm": "largeDB2", "perf": 6473.84, "source": "autotuned"},
{"m": 22, "n": 23, "k": 16, "tile_m": 3, "tile_n": 6, "w": 6, "v": 20, "threads": 32, "grouping": 16, "minblocks": 2, "algorithm": "largeDB2", "perf": 7688.48, "source": "autotuned"},
{"m": 22, "n": 23, "k": 17, "tile_m": 3, "tile_n": 6, "w": 8, "v": 20, "threads": 32, "grouping": 16, "minblocks": 8, "algorithm": "largeDB2", "perf": 7808.25, "source": "autotuned"},
{"m": 22, "n": 23, "k": 22, "tile_m": 3, "tile_n": 6, "w": 8, "v": 22, "threads": 32, "grouping": 16, "minblocks": 8, "algorithm": "largeDB2", "perf": 8519.88, "source": "autotuned"},
{"m": 22, "n": 23, "k": 23, "tile_m": 3, "tile_n": 6, "w": 8, "v": 22, "threads": 32, "grouping": 16, "minblocks": 1, "algorithm": "largeDB2", "perf": 8623.43, "source": "autotuned"},
{"m": 22, "n": 26, "k": 5, "tile_m": 3, "tile_n": 4, "threads": 192, "grouping": 21, "minblocks": 6, "algorithm": "medium", "perf": 5145.49, "source": "autotuned"},
{"m": 22, "n": 26, "k": 9, "tile_m": 11, "tile_n": 2, "w": 4, "v": 26, "threads": 32, "grouping": 16, "minblocks": 4, "algorithm": "largeDB2", "perf": 6835.76, "source": "autotuned"},
{"m": 22, "n": 26, "k": 13, "tile_m": 6, "tile_n": 4, "w": 6, "v": 26, "threads": 32, "grouping": 16, "minblocks": 12, "algorithm": "largeDB2", "perf": 7416.08, "source": "autotuned"},
{"m": 22, "n": 26, "k": 22, "tile_m": 3, "tile_n": 7, "w": 8, "v": 26, "threads": 32, "grouping": 16, "minblocks": 12, "algorithm": "largeDB2", "perf": 9004.24, "source": "autotuned"},
{"m": 22, "n": 26, "k": 23, "tile_m": 3, "tile_n": 7, "w": 8, "v": 26, "threads": 32, "grouping": 16, "minblocks": 12, "algorithm": "largeDB2", "perf": 9185.75, "source": "autotuned"},
{"m": 22, "n": 26, "k": 26, "tile_m": 3, "tile_n": 7, "w": 10, "v": 26, "threads": 32, "grouping": 16, "minblocks": 2, "algorithm": "largeDB2", "perf": 9301.78, "source": "autotuned"},
{"m": 22, "n": 32, "k": 22, "tile_m": 3, "tile_n": 8, "w": 8, "v": 32, "threads": 32, "grouping": 16, "minblocks": 8, "algorithm": "largeDB2", "perf": 10423.5, "source": "autotuned"},
{"m": 22, "n": 32, "k": 32, "tile_m": 3, "tile_n": 8, "w": 12, "v": 30, "threads": 32, "grouping": 16, "minblocks": 8, "algorithm": "largeDB2", "perf": 11146.8, "source": "autotuned"},
{"m": 23, "n": 4, "k": 5, "tile_m": 1, "tile_n": 4, "threads": 32, "grouping": 7, "minblocks": 2, "algorithm": "medium", "perf": 1691.7, "source": "autotuned"},
{"m": 23, "n": 4, "k": 9, "tile_m": 1, "tile_n": 4, "threads": 64, "grouping": 8, "minblocks": 19, "algorithm": "medium", "perf": 2159.92, "source": "autotuned"},
{"m": 23, "n": 4, "k": 13, "tile_m": 1, "tile_n": 4, "threads": 32, "grouping": 8, "minblocks": 20, "algorithm": "medium", "perf": 2555.26, "source": "autotuned"},
{"m": 23, "n": 4, "k": 22, "tile_m": 1, "tile_n": 4, "threads": 32, "grouping": 8, "minblocks": 13, "algorithm": "medium", "perf": 2895.78, "source": "autotuned"},
{"m": 23, "n": 4, "k": 23, "tile_m": 1, "tile_n": 4, "w": 10, "v": 4, "threads": 32, "grouping": 16, "minblocks": 12, "algorithm": "largeDB2", "perf": 2798.34, "source": "autotuned"},
{"m": 23, "n": 4, "k": 26, "tile_m": 1, "tile_n": 4, "threads": 32, "grouping": 11, "minblocks": 5, "algorithm": "medium", "perf": 2904.52, "source": "autotuned"},
{"m": 23, "n": 5, "k": 4, "tile_m": 1, "tile_n": 5, "threads": 96, "grouping": 11, "minblocks": 11, "algorithm": "medium", "perf": 1758.51, "source": "autotuned"},
{"m": 23, "n": 5, "k": 5, "tile_m": 1, "tile_n": 5, "threads": 32, "grouping": 8, "minblocks": 7, "algorithm": "medium", "perf": 1971.72, "source": "autotuned"},
{"m": 23, "n": 5, "k": 9, "tile_m": 1, "tile_n": 5, "threads": 96, "grouping": 8, "minblocks": 16, "algorithm": "medium", "perf": 2429.39, "source": "autotuned"},
{"m": 23, "n": 5, "k": 22, "tile_m": 1, "tile_n": 5, "threads": 32, "grouping": 8, "minblocks": 13, "algorithm": "medium", "perf": 3170.42, "source": "autotuned"},
{"m": 23, "n": 5, "k": 26, "tile_m": 1, "tile_n": 5, "threads": 32, "grouping": 11, "minblocks": 4, "algorithm": "medium", "perf": 3276.84, "source": "autotuned"},
{"m": 23, "n": 9, "k": 4, "tile_m": 3, "tile_n": 3, "threads": 96, "grouping": 11, "minblocks": 11, "algorithm": "medium", "perf": 2696.15, "source": "autotuned"},
{"m": 23, "n": 9, "k": 5, "tile_m": 3, "tile_n": 3, "threads": 128, "grouping": 16, "minblocks": 9, "algorithm": "medium", "perf": 2806.39, "source": "autotuned"},
{"m": 23, "n": 9, "k": 9, "tile_m": 3, "tile_n": 3, "threads": 32, "grouping": 7, "minblocks": 17, "algorithm": "medium", "perf": 3706.16, "source": "autotuned"},
{"m": 23, "n": 9, "k": 13, "tile_m": 3, "tile_n": 3, "threads": 32, "grouping": 8, "minblocks": 14, "algorithm": "medium", "perf": 4289.79, "source": "autotuned"},
{"m": 23, "n": 9, "k": 16, "tile_m": 3, "tile_n": 3, "threads": 32, "grouping": 8, "minblocks": 14, "algorithm": "medium", "perf": 4559.22, "source": "autotuned"},
{"m": 23, "n": 9, "k": 17, "tile_m": 3, "tile_n": 3, "w": 8, "v": 8, "threads": 32, "grouping": 16, "minblocks": 12, "algorithm": "largeDB2", "perf": 4567.6, "source": "autotuned"},
{"m": 23, "n": 9, "k": 23, "tile_m": 3, "tile_n": 3, "w": 8, "v": 8, "threads": 32, "grouping": 16, "minblocks": 1, "algorithm": "largeDB2", "perf": 4808.97, "source": "autotuned"},
{"m": 23, "n": 9, "k": 26, "tile_m": 3, "tile_n": 3, "w": 10, "v": 8, "threads": 32, "grouping": 16, "minblocks": 1, "algorithm": "largeDB2", "perf": 4942.18, "source": "autotuned"},
{"m": 23, "n": 13, "k": 5, "tile_m": 3, "tile_n": 4, "threads": 128, "grouping": 16, "minblocks": 8, "algorithm": "medium", "perf": 3876.78, "source": "autotuned"},
{"m": 23, "n": 13, "k": 9, "tile_m": 3, "tile_n": 4, "w": 4, "v": 12, "threads": 32, "grouping": 16, "minblocks": 12, "algorithm": "largeDB2", "perf": 5033.83, "source": "autotuned"},
{"m": 23, "n": 13, "k": 13, "tile_m": 3, "tile_n": 4, "w": 6, "v": 12, "threads": 32, "grouping": 16, "minblocks": 2, "algorithm": "largeDB2", "perf": 5667.95, "source": "autotuned"},
{"m": 23, "n": 13, "k": 16, "tile_m": 3, "tile_n": 4, "w": 6, "v": 12, "threads": 32, "grouping": 16, "minblocks": 8, "algorithm": "largeDB2", "perf": 5989.36, "source": "autotuned"},
{"m": 23, "n": 13, "k": 17, "tile_m": 3, "tile_n": 4, "w": 8, "v": 12, "threads": 32, "grouping": 16, "minblocks": 8, "algorithm": "largeDB2", "perf": 5919.19, "source": "autotuned"},
{"m": 23, "n": 13, "k": 22, "tile_m": 3, "tile_n": 4, "w": 8, "v": 12, "threads": 32, "grouping": 16, "minblocks": 4, "algorithm": "largeDB2", "perf": 6209.55, "source": "autotuned"},
{"m": 23, "n": 13, "k": 26, "tile_m": 3, "tile_n": 4, "w": 10, "v": 12, "threads": 32, "grouping": 16, "minblocks": 8, "algorithm": "largeDB2", "perf": 6460.62, "source": "autotuned"},
{"m": 23, "n": 16, "k": 9, "tile_m": 3, "tile_n": 4, "w": 4, "v": 16, "threads": 32, "grouping": 16, "minblocks": 12, "algorithm": "largeDB2", "perf": 6165.7, "source": "autotuned"},
{"m": 23, "n": 16, "k": 16, "tile_m": 3, "tile_n": 4, "w": 6, "v": 16, "threads": 32, "grouping": 16, "minblocks": 4, "algorithm": "largeDB2", "perf": 7133.44, "source": "autotuned"},
{"m": 23, "n": 16, "k": 17, "tile_m": 3, "tile_n": 4, "w": 8, "v": 16, "threads": 32, "grouping": 16, "minblocks": 1, "algorithm": "largeDB2", "perf": 6994.73, "source": "autotuned"},
{"m": 23, "n": 16, "k": 22, "tile_m": 3, "tile_n": 4, "w": 8, "v": 16, "threads": 32, "grouping": 16, "minblocks": 1, "algorithm": "largeDB2", "perf": 7434.39, "source": "autotuned"},
{"m": 23, "n": 16, "k": 23, "tile_m": 3, "tile_n": 4, "w": 10, "v": 16, "threads": 32, "grouping": 16, "minblocks": 2, "algorithm": "largeDB2", "perf": 7505.89, "source": "autotuned"},
{"m": 23, "n": 17, "k": 9, "tile_m": 3, "tile_n": 5, "threads": 32, "grouping": 8, "minblocks": 13, "algorithm": "medium", "perf": 5702.11, "source": "autotuned"},
{"m": 23, "n": 17, "k": 13, "tile_m": 3, "tile_n": 5, "w": 6, "v": 16, "threads": 32, "grouping": 16, "minblocks": 4, "algorithm": "largeDB2", "perf": 6479.93, "source": "autotuned"},
{"m": 23, "n": 17, "k": 16, "tile_m": 3, "tile_n": 5, "w": 6, "v": 14, "threads": 32, "grouping": 16, "minblocks": 12, "algorithm": "largeDB2", "perf": 6704.95, "source": "autotuned"},
{"m": 23, "n": 17, "k": 23, "tile_m": 3, "tile_n": 5, "w": 10, "v": 14, "threads": 32, "grouping": 16, "minblocks": 4, "algorithm": "largeDB2", "perf": 7293.9, "source": "autotuned"},
{"m": 23, "n": 22, "k": 4, "tile_m": 3, "tile_n": 4, "threads": 96, "grouping": 16, "minblocks": 7, "algorithm": "medium", "perf": 4948.19, "source": "autotuned"},
{"m": 23, "n": 22, "k": 5, "tile_m": 3, "tile_n": 3, "threads": 128, "grouping": 11, "minblocks": 12, "algorithm": "medium", "perf": 5151.74, "source": "autotuned"},
{"m": 23, "n": 22, "k": 9, "tile_m": 6, "tile_n": 3, "w": 4, "v": 22, "threads": 32, "grouping": 16, "minblocks": 4, "algorithm": "largeDB2", "perf": 6715.61, "source": "autotuned"},
{"m": 23, "n": 22, "k": 13, "tile_m": 3, "tile_n": 6, "w": 6, "v": 22, "threads": 32, "grouping": 16, "minblocks": 8, "algorithm": "largeDB2", "perf": 7440.7, "source": "autotuned"},
{"m": 23, "n": 22, "k": 16, "tile_m": 3, "tile_n": 6, "w": 6, "v": 22, "threads": 32, "grouping": 16, "minblocks": 12, "algorithm": "largeDB2", "perf": 7942.33, "source": "autotuned"},
{"m": 23, "n": 22, "k": 17, "tile_m": 3, "tile_n": 6, "w": 8, "v": 22, "threads": 32, "grouping": 16, "minblocks": 2, "algorithm": "largeDB2", "perf": 7942.79, "source": "autotuned"},
{"m": 23, "n": 22, "k": 22, "tile_m": 3, "tile_n": 6, "w": 8, "v": 20, "threads": 32, "grouping": 16, "minblocks": 4, "algorithm": "largeDB2", "perf": 8632.15, "source": "autotuned"},
{"m": 23, "n": 22, "k": 26, "tile_m": 3, "tile_n": 6, "w": 10, "v": 22, "threads": 32, "grouping": 16, "minblocks": 8, "algorithm": "largeDB2", "perf": 9024.08, "source": "autotuned"},
{"m": 23, "n": 23, "k": 5, "tile_m": 3, "tile_n": 3, "threads": 128, "grouping": 16, "minblocks": 9, "algorithm": "medium", "perf": 5399.65, "source": "autotuned"},
{"m": 23, "n": 23, "k": 9, "tile_m": 6, "tile_n": 3, "w": 4, "v": 22, "threads": 32, "grouping": 16, "minblocks": 1, "algorithm": "largeDB2", "perf": 6832.84, "source": "autotuned"},
{"m": 23, "n": 23, "k": 13, "tile_m": 3, "tile_n": 6, "w": 6, "v": 22, "threads": 32, "grouping": 16, "minblocks": 8, "algorithm": "largeDB2", "perf": 7584.51, "source": "autotuned"},
{"m": 23, "n": 23, "k": 16, "tile_m": 3, "tile_n": 6, "w": 6, "v": 20, "threads": 32, "grouping": 16, "minblocks": 2, "algorithm": "largeDB2", "perf": 8084.0, "source": "autotuned"},
{"m": 23, "n": 23, "k": 17, "tile_m": 3, "tile_n": 6, "w": 6, "v": 22, "threads": 32, "grouping": 16, "minblocks": 4, "algorithm": "largeDB2", "perf": 8138.55, "source": "autotuned"},
{"m": 23, "n": 23, "k": 22, "tile_m": 3, "tile_n": 6, "w": 8, "v": 20, "threads": 32, "grouping": 16, "minblocks": 8, "algorithm": "largeDB2", "perf": 8904.87, "source": "autotuned"},
{"m": 23, "n": 23, "k": 23, "tile_m": 3, "tile_n": 6, "w": 8, "v": 22, "threads": 32, "grouping": 16, "minblocks": 4, "algorithm": "largeDB2", "perf": 8920.7, "source": "autotuned"},
{"m": 23, "n": 23, "k": 26, "tile_m": 3, "tile_n": 6, "w": 10, "v": 20, "threads": 32, "grouping": 16, "minblocks": 1, "algorithm": "largeDB2", "perf": 9271.09, "source": "autotuned"},
{"m": 23, "n": 26, "k": 4, "tile_m": 3, "tile_n": 4, "threads": 128, "grouping": 16, "minblocks": 8, "algorithm": "medium", "perf": 5190.34, "source": "autotuned"},
{"m": 23, "n": 26, "k": 5, "tile_m": 3, "tile_n": 4, "threads": 160, "grouping": 16, "minblocks": 8, "algorithm": "medium", "perf": 5201.62, "source": "autotuned"},
{"m": 23, "n": 26, "k": 9, "tile_m": 6, "tile_n": 4, "w": 4, "v": 26, "threads": 32, "grouping": 16, "minblocks": 8, "algorithm": "largeDB2", "perf": 6676.74, "source": "autotuned"},
{"m": 23, "n": 26, "k": 13, "tile_m": 6, "tile_n": 4, "w": 6, "v": 26, "threads": 32, "grouping": 16, "minblocks": 2, "algorithm": "largeDB2", "perf": 7564.62, "source": "autotuned"},
{"m": 23, "n": 26, "k": 22, "tile_m": 3, "tile_n": 7, "w": 8, "v": 26, "threads": 32, "grouping": 16, "minblocks": 12, "algorithm": "largeDB2", "perf": 9326.8, "source": "autotuned"},
{"m": 23, "n": 26, "k": 23, "tile_m": 3, "tile_n": 7, "w": 8, "v": 26, "threads": 32, "grouping": 16, "minblocks": 4, "algorithm": "largeDB2", "perf": 9393.47, "source": "autotuned"},
{"m": 23, "n": 26, "k": 26, "tile_m": 3, "tile_n": 7, "w": 10, "v": 26, "threads": 32, "grouping": 16, "minblocks": 1, "algorithm": "largeDB2", "perf": 9666.16, "source": "autotuned"},
{"m": 24, "n": 5, "k": 5, "tile_m": 1, "tile_n": 5, "threads": 32, "grouping": 8, "minblocks": 12, "algorithm": "medium", "perf": 2045.28, "source": "autotuned"},
{"m": 24, "n": 5, "k": 13, "tile_m": 2, "tile_n": 3, "threads": 32, "grouping": 8, "minblocks": 13, "algorithm": "medium", "perf": 2983.72, "source": "autotuned"},
{"m": 24, "n": 5, "k": 24, "tile_m": 1, "tile_n": 5, "threads": 32, "grouping": 11, "minblocks": 7, "algorithm": "medium", "perf": 3353.78, "source": "autotuned"},
{"m": 24, "n": 5, "k": 26, "tile_m": 1, "tile_n": 5, "threads": 32, "grouping": 11, "minblocks": 6, "algorithm": "medium", "perf": 3379.51, "source": "autotuned"},
{"m": 24, "n": 5, "k": 32, "tile_m": 2, "tile_n": 3, "w": 12, "v": 4, "threads": 32, "grouping": 16, "minblocks": 8, "algorithm": "largeDB2", "perf": 3542.45, "source": "autotuned"},
{"m": 24, "n": 13, "k": 5, "tile_m": 3, "tile_n": 4, "threads": 128, "grouping": 16, "minblocks": 8, "algorithm": "medium", "perf": 4078.37, "source": "autotuned"},
{"m": 24, "n": 13, "k": 13, "tile_m": 3, "tile_n": 4, "w": 6, "v": 12, "threads": 32, "grouping": 16, "minblocks": 4, "algorithm": "largeDB2", "perf": 6040.6, "source": "autotuned"},
{"m": 24, "n": 13, "k": 24, "tile_m": 3, "tile_n": 4, "w": 8, "v": 12, "threads": 32, "grouping": 16, "minblocks": 1, "algorithm": "largeDB2", "perf": 6703.77, "source": "autotuned"},
{"m": 24, "n": 13, "k": 26, "tile_m": 3, "tile_n": 4, "w": 12, "v": 12, "threads": 32, "grouping": 16, "minblocks": 8, "algorithm": "largeDB2", "perf": 6735.92, "source": "autotuned"},
{"m": 24, "n": 13, "k": 32, "tile_m": 3, "tile_n": 4, "w": 12, "v": 12, "threads": 32, "grouping": 16, "minblocks": 4, "algorithm": "largeDB2", "perf": 7217.87, "source": "autotuned"},
{"m": 24, "n": 24, "k": 5, "tile_m": 3, "tile_n": 3, "threads": 128, "grouping": 16, "minblocks": 10, "algorithm": "medium", "perf": 6026.99, "source": "autotuned"},
{"m": 24, "n": 24, "k": 13, "tile_m": 3, "tile_n": 6, "w": 6, "v": 24, "threads": 32, "grouping": 16, "minblocks": 12, "algorithm": "largeDB2", "perf": 8249.27, "source": "autotuned"},
{"m": 24, "n": 24, "k": 24, "tile_m": 3, "tile_n": 6, "w": 8, "v": 18, "threads": 32, "grouping": 16, "minblocks": 12, "algorithm": "largeDB2", "perf": 10177.9, "source": "autotuned"},
{"m": 24, "n": 24, "k": 26, "tile_m": 3, "tile_n": 6, "w": 10, "v": 22, "threads": 32, "grouping": 16, "minblocks": 12, "algorithm": "largeDB2", "perf": 10211.8, "source": "autotuned"},
{"m": 24, "n": 24, "k": 32, "tile_m": 3, "tile_n": 6, "w": 12, "v": 24, "threads": 32, "grouping": 16, "minblocks": 2, "algorithm": "largeDB2", "perf": 10850.0, "source": "autotuned"},
{"m": 24, "n": 26, "k": 5, "tile_m": 3, "tile_n": 4, "threads": 192, "grouping": 21, "minblocks": 6, "algorithm": "medium", "perf": 5453.87, "source": "autotuned"},
{"m": 24, "n": 26, "k": 13, "tile_m": 6, "tile_n": 4, "w": 6, "v": 26, "threads": 32, "grouping": 16, "minblocks": 1, "algorithm": "largeDB2", "perf": 7787.46, "source": "autotuned"},
{"m": 24, "n": 26, "k": 24, "tile_m": 3, "tile_n": 7, "w": 8, "v": 26, "threads": 32, "grouping": 16, "minblocks": 1, "algorithm": "largeDB2", "perf": 10036.2, "source": "autotuned"},
{"m": 24, "n": 26, "k": 26, "tile_m": 3, "tile_n": 7, "w": 10, "v": 24, "threads": 32, "grouping": 16, "minblocks": 8, "algorithm": "largeDB2", "perf": 10120.0, "source": "autotuned"},
{"m": 24, "n": 26, "k": 32, "tile_m": 3, "tile_n": 7, "w": 12, "v": 20, "threads": 32, "grouping": 16, "minblocks": 2, "algorithm": "largeDB2", "perf": 10547.9, "source": "autotuned"},
{"m": 24, "n": 32, "k": 5, "tile_m": 3, "tile_n": 4, "threads": 192, "grouping": 21, "minblocks": 6, "algorithm": "medium", "perf": 6707.57, "source": "autotuned"},
{"m": 24, "n": 32, "k": 24, "tile_m": 3, "tile_n": 8, "w": 8, "v": 32, "threads": 32, "grouping": 16, "minblocks": 8, "algorithm": "largeDB2", "perf": 11374.3, "source": "autotuned"},
{"m": 24, "n": 32, "k": 26, "tile_m": 3, "tile_n": 8, "w": 10, "v": 32, "threads": 32, "grouping": 16, "minblocks": 1, "algorithm": "largeDB2", "perf": 11541.4, "source": "autotuned"},
{"m": 24, "n": 32, "k": 32, "tile_m": 3, "tile_n": 8, "w": 12, "v": 32, "threads": 32, "grouping": 16, "minblocks": 8, "algorithm": "largeDB2", "perf": 12124.1, "source": "autotuned"},
{"m": 25, "n": 4, "k": 4, "tile_m": 1, "tile_n": 4, "threads": 32, "grouping": 6, "minblocks": 8, "algorithm": "medium", "perf": 1532.29, "source": "autotuned"},
{"m": 25, "n": 4, "k": 5, "tile_m": 1, "tile_n": 4, "threads": 32, "grouping": 7, "minblocks": 1, "algorithm": "medium", "perf": 1791.39, "source": "autotuned"},
{"m": 25, "n": 4, "k": 7, "tile_m": 1, "tile_n": 4, "threads": 32, "grouping": 8, "minblocks": 13, "algorithm": "medium", "perf": 2167.47, "source": "autotuned"},
{"m": 25, "n": 4, "k": 9, "tile_m": 1, "tile_n": 4, "threads": 64, "grouping": 9, "minblocks": 19, "algorithm": "medium", "perf": 2313.89, "source": "autotuned"},
{"m": 25, "n": 4, "k": 13, "tile_m": 1, "tile_n": 4, "threads": 32, "grouping": 8, "minblocks": 17, "algorithm": "medium", "perf": 2670.85, "source": "autotuned"},
{"m": 25, "n": 4, "k": 25, "tile_m": 1, "tile_n": 4, "threads": 32, "grouping": 8, "minblocks": 7, "algorithm": "medium", "perf": 3206.13, "source": "autotuned"},
{"m": 25, "n": 4, "k": 26, "tile_m": 1, "tile_n": 4, "threads": 32, "grouping": 11, "minblocks": 2, "algorithm": "medium", "perf": 2979.17, "source": "autotuned"},
{"m": 25, "n": 4, "k": 28, "tile_m": 1, "tile_n": 4, "threads": 32, "grouping": 11, "minblocks": 7, "algorithm": "medium", "perf": 3009.27, "source": "autotuned"},
{"m": 25, "n": 4, "k": 32, "tile_m": 1, "tile_n": 4, "threads": 32, "grouping": 11, "minblocks": 5, "algorithm": "medium", "perf": 3126.99, "source": "autotuned"},
{"m": 25, "n": 4, "k": 45, "tile_m": 1, "tile_n": 4, "w": 22, "v": 4, "threads": 32, "grouping": 16, "minblocks": 12, "algorithm": "largeDB2", "perf": 3267.41, "source": "autotuned"},
{"m": 25, "n": 5, "k": 4, "tile_m": 1, "tile_n": 5, "threads": 32, "grouping": 7, "minblocks": 19, "algorithm": "medium", "perf": 1814.53, "source": "autotuned"},
{"m": 25, "n": 5, "k": 5, "tile_m": 1, "tile_n": 5, "threads": 32, "grouping": 8, "minblocks": 1, "algorithm": "medium", "perf": 2120.02, "source": "autotuned"},
{"m": 25, "n": 5, "k": 7, "tile_m": 1, "tile_n": 5, "threads": 32, "grouping": 6, "minblocks": 26, "algorithm": "medium", "perf": 2256.69, "source": "autotuned"},
{"m": 25, "n": 5, "k": 9, "tile_m": 1, "tile_n": 5, "threads": 96, "grouping": 8, "minblocks": 16, "algorithm": "medium", "perf": 2578.39, "source": "autotuned"},
{"m": 25, "n": 5, "k": 13, "tile_m": 1, "tile_n": 5, "threads": 32, "grouping": 8, "minblocks": 17, "algorithm": "medium", "perf": 2981.8, "source": "autotuned"},
{"m": 25, "n": 5, "k": 25, "tile_m": 1, "tile_n": 5, "threads": 32, "grouping": 11, "minblocks": 4, "algorithm": "medium", "perf": 3372.14, "source": "autotuned"},
{"m": 25, "n": 5, "k": 26, "tile_m": 1, "tile_n": 5, "threads": 32, "grouping": 11, "minblocks": 8, "algorithm": "medium", "perf": 3446.31, "source": "autotuned"},
{"m": 25, "n": 5, "k": 28, "tile_m": 1, "tile_n": 5, "threads": 32, "grouping": 11, "minblocks": 5, "algorithm": "medium", "perf": 3431.32, "source": "autotuned"},
{"m": 25, "n": 5, "k": 32, "tile_m": 1, "tile_n": 5, "threads": 32, "grouping": 11, "minblocks": 1, "algorithm": "medium", "perf": 3496.58, "source": "autotuned"},
{"m": 25, "n": 5, "k": 45, "tile_m": 1, "tile_n": 5, "w": 12, "v": 4, "threads": 32, "grouping": 16, "minblocks": 1, "algorithm": "largeDB2", "perf": 3537.36, "source": "autotuned"},
{"m": 25, "n": 7, "k": 4, "tile_m": 1, "tile_n": 7, "threads": 32, "grouping": 8, "minblocks": 24, "algorithm": "medium", "perf": 2335.44, "source": "autotuned"},
{"m": 25, "n": 7, "k": 5, "tile_m": 1, "tile_n": 7, "threads": 128, "grouping": 16, "minblocks": 8, "algorithm": "medium", "perf": 2523.96, "source": "autotuned"},
{"m": 25, "n": 7, "k": 7, "tile_m": 1, "tile_n": 7, "threads": 32, "grouping": 7, "minblocks": 17, "algorithm": "medium", "perf": 2885.97, "source": "autotuned"},
{"m": 25, "n": 7, "k": 9, "tile_m": 1, "tile_n": 7, "threads": 96, "grouping": 11, "minblocks": 11, "algorithm": "medium", "perf": 3250.35, "source": "autotuned"},
{"m": 25, "n": 7, "k": 13, "tile_m": 1, "tile_n": 7, "threads": 32, "grouping": 8, "minblocks": 18, "algorithm": "medium", "perf": 3771.48, "source": "autotuned"},
{"m": 25, "n": 7, "k": 25, "tile_m": 1, "tile_n": 7, "threads": 32, "grouping": 11, "minblocks": 9, "algorithm": "medium", "perf": 4092.61, "source": "autotuned"},
{"m": 25, "n": 7, "k": 26, "tile_m": 1, "tile_n": 7, "threads": 32, "grouping": 11, "minblocks": 9, "algorithm": "medium", "perf": 4097.92, "source": "autotuned"},
{"m": 25, "n": 7, "k": 28, "tile_m": 1, "tile_n": 7, "threads": 32, "grouping": 11, "minblocks": 2, "algorithm": "medium", "perf": 4110.87, "source": "autotuned"},
{"m": 25, "n": 7, "k": 32, "tile_m": 1, "tile_n": 7, "threads": 32, "grouping": 11, "minblocks": 5, "algorithm": "medium", "perf": 4272.88, "source": "autotuned"},
{"m": 25, "n": 7, "k": 45, "tile_m": 1, "tile_n": 7, "w": 12, "v": 6, "threads": 32, "grouping": 16, "minblocks": 1, "algorithm": "largeDB2", "perf": 4510.86, "source": "autotuned"},
{"m": 25, "n": 9, "k": 5, "tile_m": 1, "tile_n": 9, "threads": 128, "grouping": 16, "minblocks": 9, "algorithm": "medium", "perf": 2959.33, "source": "autotuned"},
{"m": 25, "n": 9, "k": 7, "tile_m": 1, "tile_n": 9, "threads": 32, "grouping": 8, "minblocks": 13, "algorithm": "medium", "perf": 3350.07, "source": "autotuned"},
{"m": 25, "n": 9, "k": 9, "tile_m": 3, "tile_n": 3, "threads": 96, "grouping": 11, "minblocks": 11, "algorithm": "medium", "perf": 3649.79, "source": "autotuned"},
{"m": 25, "n": 9, "k": 13, "tile_m": 1, "tile_n": 9, "threads": 32, "grouping": 8, "minblocks": 18, "algorithm": "medium", "perf": 4194.86, "source": "autotuned"},
{"m": 25, "n": 9, "k": 25, "tile_m": 3, "tile_n": 3, "w": 10, "v": 6, "threads": 32, "grouping": 16, "minblocks": 2, "algorithm": "largeDB2", "perf": 4738.99, "source": "autotuned"},
{"m": 25, "n": 9, "k": 26, "tile_m": 3, "tile_n": 3, "w": 10, "v": 6, "threads": 32, "grouping": 16, "minblocks": 12, "algorithm": "largeDB2", "perf": 4777.0, "source": "autotuned"},
{"m": 25, "n": 9, "k": 28, "tile_m": 3, "tile_n": 3, "w": 10, "v": 8, "threads": 32, "grouping": 16, "minblocks": 1, "algorithm": "largeDB2", "perf": 4856.38, "source": "autotuned"},
{"m": 25, "n": 9, "k": 32, "tile_m": 3, "tile_n": 3, "w": 12, "v": 8, "threads": 32, "grouping": 16, "minblocks": 2, "algorithm": "largeDB2", "perf": 5037.71, "source": "autotuned"},
{"m": 25, "n": 9, "k": 45, "tile_m": 3, "tile_n": 3, "w": 20, "v": 8, "threads": 32, "grouping": 16, "minblocks": 8, "algorithm": "largeDB2", "perf": 5277.83, "source": "autotuned"},
{"m": 25, "n": 11, "k": 11, "tile_m": 1, "tile_n": 11, "threads": 32, "grouping": 8, "minblocks": 4, "algorithm": "medium", "perf": 4595.21, "source": "autotuned"},
{"m": 25, "n": 11, "k": 20, "tile_m": 5, "tile_n": 2, "w": 8, "v": 10, "threads": 32, "grouping": 16, "minblocks": 4, "algorithm": "largeDB2", "perf": 5001.56, "source": "autotuned"},
{"m": 25, "n": 11, "k": 32, "tile_m": 5, "tile_n": 2, "w": 14, "v": 8, "threads": 32, "grouping": 16, "minblocks": 1, "algorithm": "largeDB2", "perf": 5571.36, "source": "autotuned"},
{"m": 25, "n": 12, "k": 11, "tile_m": 1, "tile_n": 12, "threads": 32, "grouping": 8, "minblocks": 14, "algorithm": "medium", "perf": 4795.69, "source": "autotuned"},
{"m": 25, "n": 12, "k": 12, "tile_m": 5, "tile_n": 2, "w": 4, "v": 12, "threads": 32, "grouping": 16, "minblocks": 8, "algorithm": "largeDB2", "perf": 4948.87, "source": "autotuned"},
{"m": 25, "n": 12, "k": 20, "tile_m": 5, "tile_n": 2, "w": 8, "v": 12, "threads": 32, "grouping": 16, "minblocks": 12, "algorithm": "largeDB2", "perf": 5479.5, "source": "autotuned"},
{"m": 25, "n": 13, "k": 4, "tile_m": 7, "tile_n": 2, "threads": 128, "grouping": 16, "minblocks": 8, "algorithm": "medium", "perf": 3244.71, "source": "autotuned"},
{"m": 25, "n": 13, "k": 5, "tile_m": 7, "tile_n": 2, "threads": 128, "grouping": 18, "minblocks": 7, "algorithm": "medium", "perf": 3633.0, "source": "autotuned"},
{"m": 25, "n": 13, "k": 7, "tile_m": 7, "tile_n": 2, "threads": 32, "grouping": 8, "minblocks": 11, "algorithm": "medium", "perf": 4085.66, "source": "autotuned"},
{"m": 25, "n": 13, "k": 9, "tile_m": 7, "tile_n": 2, "threads": 32, "grouping": 8, "minblocks": 20, "algorithm": "medium", "perf": 4365.41, "source": "autotuned"},
{"m": 25, "n": 13, "k": 14, "tile_m": 7, "tile_n": 2, "w": 6, "v": 12, "threads": 32, "grouping": 16, "minblocks": 4, "algorithm": "largeDB2", "perf": 5031.05, "source": "autotuned"},
{"m": 25, "n": 13, "k": 26, "tile_m": 5, "tile_n": 3, "w": 10, "v": 12, "threads": 32, "grouping": 16, "minblocks": 1, "algorithm": "largeDB2", "perf": 5694.57, "source": "autotuned"},
{"m": 25, "n": 13, "k": 28, "tile_m": 7, "tile_n": 2, "w": 12, "v": 12, "threads": 32, "grouping": 16, "minblocks": 4, "algorithm": "largeDB2", "perf": 5738.29, "source": "autotuned"},
{"m": 25, "n": 13, "k": 32, "tile_m": 5, "tile_n": 3, "w": 12, "v": 12, "threads": 32, "grouping": 16, "minblocks": 2, "algorithm": "largeDB2", "perf": 5908.7, "source": "autotuned"},
{"m": 25, "n": 13, "k": 45, "tile_m": 5, "tile_n": 3, "w": 18, "v": 12, "threads": 32, "grouping": 16, "minblocks": 1, "algorithm": "largeDB2", "perf": 6204.23, "source": "autotuned"},
{"m": 25, "n": 14, "k": 13, "tile_m": 7, "tile_n": 2, "w": 6, "v": 14, "threads": 32, "grouping": 16, "minblocks": 1, "algorithm": "largeDB2", "perf": 5450.8, "source": "autotuned"},
{"m": 25, "n": 14, "k": 14, "tile_m": 7, "tile_n": 2, "w": 6, "v": 14, "threads": 32, "grouping": 16, "minblocks": 1, "algorithm": "largeDB2", "perf": 5444.13, "source": "autotuned"},
{"m": 25, "n": 14, "k": 26, "tile_m": 7, "tile_n": 2, "w": 10, "v": 14, "threads": 32, "grouping": 16, "minblocks": 2, "algorithm": "largeDB2", "perf": 6154.73, "source": "autotuned"},
{"m": 25, "n": 14, "k": 32, "tile_m": 7, "tile_n": 2, "w": 12, "v": 14, "threads": 32, "grouping": 16, "minblocks": 4, "algorithm": "largeDB2", "perf": 6349.99, "source": "autotuned"},
{"m": 25, "n": 20, "k": 11, "tile_m": 7, "tile_n": 3, "w": 4, "v": 20, "threads": 32, "grouping": 16, "minblocks": 4, "algorithm": "largeDB2", "perf": 6482.78, "source": "autotuned"},
{"m": 25, "n": 20, "k": 12, "tile_m": 7, "tile_n": 3, "w": 4, "v": 20, "threads": 32, "grouping": 16, "minblocks": 12, "algorithm": "largeDB2", "perf": 6535.62, "source": "autotuned"},
{"m": 25, "n": 20, "k": 20, "tile_m": 7, "tile_n": 3, "w": 8, "v": 20, "threads": 32, "grouping": 16, "minblocks": 8, "algorithm": "largeDB2", "perf": 7349.83, "source": "autotuned"},
{"m": 25, "n": 20, "k": 25, "tile_m": 7, "tile_n": 3, "w": 10, "v": 20, "threads": 32, "grouping": 16, "minblocks": 4, "algorithm": "largeDB2", "perf": 7829.62, "source": "autotuned"},
{"m": 25, "n": 20, "k": 32, "tile_m": 7, "tile_n": 3, "w": 12, "v": 20, "threads": 32, "grouping": 16, "minblocks": 4, "algorithm": "largeDB2", "perf": 8153.34, "source": "autotuned"},
{"m": 25, "n": 25, "k": 4, "tile_m": 3, "tile_n": 4, "threads": 128, "grouping": 14, "minblocks": 9, "algorithm": "medium", "perf": 4816.6, "source": "autotuned"},
{"m": 25, "n": 25, "k": 5, "tile_m": 3, "tile_n": 4, "threads": 128, "grouping": 18, "minblocks": 9, "algorithm": "medium", "perf": 5260.37, "source": "autotuned"},
{"m": 25, "n": 25, "k": 7, "tile_m": 3, "tile_n": 4, "threads": 192, "grouping": 21, "minblocks": 6, "algorithm": "medium", "perf": 5589.23, "source": "autotuned"},
{"m": 25, "n": 25, "k": 9, "tile_m": 7, "tile_n": 4, "w": 4, "v": 24, "threads": 32, "grouping": 16, "minblocks": 12, "algorithm": "largeDB2", "perf": 6601.59, "source": "autotuned"},
{"m": 25, "n": 25, "k": 11, "tile_m": 7, "tile_n": 4, "w": 4, "v": 24, "threads": 32, "grouping": 16, "minblocks": 1, "algorithm": "largeDB2", "perf": 6974.8, "source": "autotuned"},
{"m": 25, "n": 25, "k": 12, "tile_m": 7, "tile_n": 4, "w": 4, "v": 24, "threads": 32, "grouping": 16, "minblocks": 12, "algorithm": "largeDB2", "perf": 7213.79, "source": "autotuned"},
{"m": 25, "n": 25, "k": 13, "tile_m": 5, "tile_n": 5, "w": 6, "v": 24, "threads": 32, "grouping": 16, "minblocks": 8, "algorithm": "largeDB2", "perf": 7284.92, "source": "autotuned"},
{"m": 25, "n": 25, "k": 14, "tile_m": 7, "tile_n": 4, "w": 6, "v": 24, "threads": 32, "grouping": 16, "minblocks": 8, "algorithm": "largeDB2", "perf": 7470.33, "source": "autotuned"},
{"m": 25, "n": 25, "k": 20, "tile_m": 7, "tile_n": 4, "w": 8, "v": 24, "threads": 32, "grouping": 16, "minblocks": 4, "algorithm": "largeDB2", "perf": 8172.49, "source": "autotuned"},
{"m": 25, "n": 25, "k": 26, "tile_m": 7, "tile_n": 4, "w": 10, "v": 24, "threads": 32, "grouping": 16, "minblocks": 8, "algorithm": "largeDB2", "perf": 8678.63, "source": "autotuned"},
{"m": 25, "n": 25, "k": 28, "tile_m": 7, "tile_n": 4, "w": 10, "v": 24, "threads": 32, "grouping": 16, "minblocks": 8, "algorithm": "largeDB2", "perf": 8725.1, "source": "autotuned"},
{"m": 25, "n": 25, "k": 32, "tile_m": 5, "tile_n": 5, "w": 12, "v": 24, "threads": 32, "grouping": 16, "minblocks": 8, "algorithm": "largeDB2", "perf": 8889.03, "source": "autotuned"},
{"m": 25, "n": 26, "k": 4, "tile_m": 3, "tile_n": 4, "threads": 128, "grouping": 16, "minblocks": 9, "algorithm": "medium", "perf": 4989.57, "source": "autotuned"},
{"m": 25, "n": 26, "k": 5, "tile_m": 3, "tile_n": 4, "threads": 160, "grouping": 16, "minblocks": 8, "algorithm": "medium", "perf": 5165.81, "source": "autotuned"},
{"m": 25, "n": 26, "k": 7, "tile_m": 3, "tile_n": 4, "threads": 192, "grouping": 21, "minblocks": 6, "algorithm": "medium", "perf": 5842.65, "source": "autotuned"},
{"m": 25, "n": 26, "k": 26, "tile_m": 7, "tile_n": 4, "w": 10, "v": 26, "threads": 32, "grouping": 16, "minblocks": 8, "algorithm": "largeDB2", "perf": 9087.23, "source": "autotuned"},
{"m": 25, "n": 26, "k": 45, "tile_m": 7, "tile_n": 4, "w": 16, "v": 26, "threads": 32, "grouping": 16, "minblocks": 8, "algorithm": "largeDB2", "perf": 9732.5, "source": "autotuned"},
{"m": 25, "n": 28, "k": 4, "tile_m": 3, "tile_n": 4, "threads": 128, "grouping": 16, "minblocks": 9, "algorithm": "medium", "perf": 5352.84, "source": "autotuned"},
{"m": 25, "n": 28, "k": 13, "tile_m": 7, "tile_n": 4, "w": 6, "v": 28, "threads": 32, "grouping": 16, "minblocks": 8, "algorithm": "largeDB2", "perf": 8077.06, "source": "autotuned"},
{"m": 25, "n": 28, "k": 25, "tile_m": 7, "tile_n": 4, "w": 10, "v": 28, "threads": 32, "grouping": 16, "minblocks": 8, "algorithm": "largeDB2", "perf": 9498.36, "source": "autotuned"},
{"m": 25, "n": 28, "k": 32, "tile_m": 7, "tile_n": 4, "w": 12, "v": 28, "threads": 32, "grouping": 16, "minblocks": 8, "algorithm": "largeDB2", "perf": 10022.5, "source": "autotuned"},
{"m": 25, "n": 28, "k": 45, "tile_m": 7, "tile_n": 4, "w": 16, "v": 28, "threads": 32, "grouping": 16, "minblocks": 8, "algorithm": "largeDB2", "perf": 10286.1, "source": "autotuned"},
{"m": 25, "n": 32, "k": 5, "tile_m": 7, "tile_n": 2, "threads": 192, "grouping": 21, "minblocks": 6, "algorithm": "medium", "perf": 5659.48, "source": "autotuned"},
{"m": 25, "n": 32, "k": 7, "tile_m": 7, "tile_n": 2, "threads": 256, "grouping": 31, "minblocks": 4, "algorithm": "medium", "perf": 6135.54, "source": "autotuned"},
{"m": 25, "n": 32, "k": 9, "tile_m": 7, "tile_n": 4, "w": 4, "v": 32, "threads": 32, "grouping": 16, "minblocks": 4, "algorithm": "largeDB2", "perf": 8642.7, "source": "autotuned"},
{"m": 25, "n": 32, "k": 12, "tile_m": 7, "tile_n": 4, "w": 4, "v": 32, "threads": 32, "grouping": 16, "minblocks": 1, "algorithm": "largeDB2", "perf": 9065.14, "source": "autotuned"},
{"m": 25, "n": 32, "k": 14, "tile_m": 7, "tile_n": 4, "w": 6, "v": 32, "threads": 32, "grouping": 16, "minblocks": 8, "algorithm": "largeDB2", "perf": 9443.8, "source": "autotuned"},
{"m": 25, "n": 32, "k": 20, "tile_m": 7, "tile_n": 4, "w": 8, "v": 32, "threads": 32, "grouping": 16, "minblocks": 1, "algorithm": "largeDB2", "perf": 10490.5, "source": "autotuned"},
{"m": 25, "n": 32, "k": 25, "tile_m": 7, "tile_n": 4, "w": 10, "v": 32, "threads": 32, "grouping": 16, "minblocks": 8, "algorithm": "largeDB2", "perf": 10867.1, "source": "autotuned"},
{"m": 25, "n": 32, "k": 26, "tile_m": 7, "tile_n": 4, "w": 10, "v": 32, "threads": 32, "grouping": 16, "minblocks": 8, "algorithm": "largeDB2", "perf": 10880.2, "source": "autotuned"},
{"m": 25, "n": 32, "k": 28, "tile_m": 7, "tile_n": 4, "w": 10, "v": 32, "threads": 32, "grouping": 16, "minblocks": 8, "algorithm": "largeDB2", "perf": 11105.4, "source": "autotuned"},
{"m": 25, "n": 32, "k": 32, "tile_m": 7, "tile_n": 4, "w": 12, "v": 32, "threads": 32, "grouping": 16, "minblocks": 8, "algorithm": "largeDB2", "perf": 11239.8, "source": "autotuned"},
{"m": 25, "n": 32, "k": 45, "tile_m": 7, "tile_n": 4, "w": 18, "v": 24, "threads": 32, "grouping": 16, "minblocks": 4, "algorithm": "largeDB2", "perf": 11694.5, "source": "autotuned"},
{"m": 25, "n": 45, "k": 4, "tile_m": 3, "tile_n": 4, "threads": 192, "grouping": 31, "minblocks": 5, "algorithm": "medium", "perf": 5564.16, "source": "autotuned"},
{"m": 25, "n": 45, "k": 7, "tile_m": 7, "tile_n": 2, "threads": 96, "grouping": 16, "minblocks": 7, "algorithm": "medium", "perf": 6089.25, "source": "autotuned"},
{"m": 25, "n": 45, "k": 13, "tile_m": 7, "tile_n": 6, "w": 6, "v": 42, "threads": 32, "grouping": 16, "minblocks": 2, "algorithm": "largeDB2", "perf": 9690.6, "source": "autotuned"},
{"m": 25, "n": 45, "k": 25, "tile_m": 7, "tile_n": 6, "w": 10, "v": 44, "threads": 32, "grouping": 16, "minblocks": 2, "algorithm": "largeDB2", "perf": 11486.3, "source": "autotuned"},
{"m": 25, "n": 45, "k": 26, "tile_m": 7, "tile_n": 6, "w": 10, "v": 44, "threads": 32, "grouping": 16, "minblocks": 1, "algorithm": "largeDB2", "perf": 11513.3, "source": "autotuned"},
{"m": 25, "n": 45, "k": 28, "tile_m": 7, "tile_n": 6, "w": 12, "v": 44, "threads": 32, "grouping": 16, "minblocks": 1, "algorithm": "largeDB2", "perf": 11804.4, "source": "autotuned"},
{"m": 25, "n": 45, "k": 32, "tile_m": 7, "tile_n": 6, "w": 12, "v": 44, "threads": 32, "grouping": 16, "minblocks": 1, "algorithm": "largeDB2", "perf": 12089.7, "source": "autotuned"},
{"m": 26, "n": 4, "k": 4, "tile_m": 1, "tile_n": 4, "threads": 32, "grouping": 7, "minblocks": 4, "algorithm": "medium", "perf": 1580.04, "source": "autotuned"},
{"m": 26, "n": 4, "k": 9, "tile_m": 1, "tile_n": 4, "threads": 64, "grouping": 9, "minblocks": 17, "algorithm": "medium", "perf": 2420.32, "source": "autotuned"},
{"m": 26, "n": 4, "k": 13, "tile_m": 1, "tile_n": 4, "threads": 32, "grouping": 8, "minblocks": 14, "algorithm": "medium", "perf": 2766.95, "source": "autotuned"},
{"m": 26, "n": 4, "k": 22, "tile_m": 1, "tile_n": 4, "threads": 96, "grouping": 12, "minblocks": 11, "algorithm": "medium", "perf": 2982.43, "source": "autotuned"},
{"m": 26, "n": 4, "k": 23, "tile_m": 1, "tile_n": 4, "threads": 32, "grouping": 11, "minblocks": 5, "algorithm": "medium", "perf": 3068.41, "source": "autotuned"},
{"m": 26, "n": 5, "k": 5, "tile_m": 1, "tile_n": 5, "threads": 32, "grouping": 8, "minblocks": 2, "algorithm": "medium", "perf": 2192.73, "source": "autotuned"},
{"m": 26, "n": 5, "k": 9, "tile_m": 1, "tile_n": 5, "threads": 96, "grouping": 11, "minblocks": 11, "algorithm": "medium", "perf": 2675.73, "source": "autotuned"},
{"m": 26, "n": 5, "k": 13, "tile_m": 1, "tile_n": 5, "threads": 32, "grouping": 8, "minblocks": 15, "algorithm": "medium", "perf": 3101.07, "source": "autotuned"},
{"m": 26, "n": 5, "k": 23, "tile_m": 1, "tile_n": 5, "threads": 32, "grouping": 11, "minblocks": 1, "algorithm": "medium", "perf": 3461.73, "source": "autotuned"},
{"m": 26, "n": 5, "k": 26, "tile_m": 1, "tile_n": 5, "threads": 32, "grouping": 11, "minblocks": 8, "algorithm": "medium", "perf": 3486.82, "source": "autotuned"},
{"m": 26, "n": 9, "k": 5, "tile_m": 1, "tile_n": 9, "threads": 32, "grouping": 6, "minblocks": 27, "algorithm": "medium", "perf": 2851.07, "source": "autotuned"},
{"m": 26, "n": 9, "k": 13, "tile_m": 1, "tile_n": 9, "threads": 32, "grouping": 8, "minblocks": 17, "algorithm": "medium", "perf": 4361.09, "source": "autotuned"},
{"m": 26, "n": 9, "k": 22, "tile_m": 3, "tile_n": 3, "w": 8, "v": 8, "threads": 32, "grouping": 16, "minblocks": 8, "algorithm": "largeDB2", "perf": 4788.85, "source": "autotuned"},
{"m": 26, "n": 9, "k": 23, "tile_m": 3, "tile_n": 3, "w": 8, "v": 6, "threads": 32, "grouping": 16, "minblocks": 12, "algorithm": "largeDB2", "perf": 4835.64, "source": "autotuned"},
{"m": 26, "n": 9, "k": 26, "tile_m": 3, "tile_n": 3, "w": 10, "v": 8, "threads": 32, "grouping": 16, "minblocks": 2, "algorithm": "largeDB2", "perf": 4939.85, "source": "autotuned"},
{"m": 26, "n": 13, "k": 5, "tile_m": 7, "tile_n": 2, "threads": 32, "grouping": 8, "minblocks": 16, "algorithm": "medium", "perf": 3605.64, "source": "autotuned"},
{"m": 26, "n": 13, "k": 9, "tile_m": 5, "tile_n": 3, "threads": 32, "grouping": 8, "minblocks": 15, "algorithm": "medium", "perf": 4859.0, "source": "autotuned"},
{"m": 26, "n": 13, "k": 13, "tile_m": 5, "tile_n": 3, "w": 6, "v": 12, "threads": 32, "grouping": 16, "minblocks": 4, "algorithm": "largeDB2", "perf": 5514.9, "source": "autotuned"},
{"m": 26, "n": 13, "k": 22, "tile_m": 5, "tile_n": 3, "w": 8, "v": 12, "threads": 32, "grouping": 16, "minblocks": 12, "algorithm": "largeDB2", "perf": 6103.66, "source": "autotuned"},
{"m": 26, "n": 13, "k": 23, "tile_m": 5, "tile_n": 3, "w": 8, "v": 12, "threads": 32, "grouping": 16, "minblocks": 1, "algorithm": "largeDB2", "perf": 6163.62, "source": "autotuned"},
{"m": 26, "n": 13, "k": 26, "tile_m": 5, "tile_n": 3, "w": 10, "v": 12, "threads": 32, "grouping": 16, "minblocks": 12, "algorithm": "largeDB2", "perf": 6324.28, "source": "autotuned"},
{"m": 26, "n": 22, "k": 4, "tile_m": 3, "tile_n": 4, "threads": 128, "grouping": 16, "minblocks": 9, "algorithm": "medium", "perf": 4627.41, "source": "autotuned"},
{"m": 26, "n": 22, "k": 5, "tile_m": 1, "tile_n": 8, "threads": 160, "grouping": 16, "minblocks": 8, "algorithm": "medium", "perf": 4832.59, "source": "autotuned"},
{"m": 26, "n": 22, "k": 9, "tile_m": 7, "tile_n": 3, "w": 4, "v": 22, "threads": 32, "grouping": 16, "minblocks": 1, "algorithm": "largeDB2", "perf": 7139.01, "source": "autotuned"},
{"m": 26, "n": 22, "k": 13, "tile_m": 7, "tile_n": 3, "w": 6, "v": 22, "threads": 32, "grouping": 16, "minblocks": 2, "algorithm": "largeDB2", "perf": 7488.25, "source": "autotuned"},
{"m": 26, "n": 22, "k": 23, "tile_m": 7, "tile_n": 3, "w": 8, "v": 22, "threads": 32, "grouping": 16, "minblocks": 12, "algorithm": "largeDB2", "perf": 8539.98, "source": "autotuned"},
{"m": 26, "n": 22, "k": 26, "tile_m": 7, "tile_n": 3, "w": 10, "v": 22, "threads": 32, "grouping": 16, "minblocks": 4, "algorithm": "largeDB2", "perf": 8787.15, "source": "autotuned"},
{"m": 26, "n": 23, "k": 4, "tile_m": 1, "tile_n": 8, "threads": 128, "grouping": 16, "minblocks": 10, "algorithm": "medium", "perf": 4700.88, "source": "autotuned"},
{"m": 26, "n": 23, "k": 5, "tile_m": 1, "tile_n": 8, "threads": 160, "grouping": 25, "minblocks": 6, "algorithm": "medium", "perf": 4937.57, "source": "autotuned"},
{"m": 26, "n": 23, "k": 9, "tile_m": 7, "tile_n": 3, "w": 4, "v": 22, "threads": 32, "grouping": 16, "minblocks": 8, "algorithm": "largeDB2", "perf": 7065.2, "source": "autotuned"},
{"m": 26, "n": 23, "k": 13, "tile_m": 7, "tile_n": 3, "w": 6, "v": 20, "threads": 32, "grouping": 16, "minblocks": 1, "algorithm": "largeDB2", "perf": 7554.82, "source": "autotuned"},
{"m": 26, "n": 23, "k": 22, "tile_m": 7, "tile_n": 3, "w": 8, "v": 12, "threads": 32, "grouping": 16, "minblocks": 4, "algorithm": "largeDB2", "perf": 8765.62, "source": "autotuned"},
{"m": 26, "n": 23, "k": 23, "tile_m": 7, "tile_n": 3, "w": 8, "v": 12, "threads": 32, "grouping": 16, "minblocks": 2, "algorithm": "largeDB2", "perf": 8826.97, "source": "autotuned"},
{"m": 26, "n": 26, "k": 4, "tile_m": 3, "tile_n": 4, "threads": 128, "grouping": 18, "minblocks": 8, "algorithm": "medium", "perf": 5149.63, "source": "autotuned"},
{"m": 26, "n": 26, "k": 5, "tile_m": 3, "tile_n": 4, "threads": 160, "grouping": 21, "minblocks": 7, "algorithm": "medium", "perf": 5332.9, "source": "autotuned"},
{"m": 26, "n": 26, "k": 9, "tile_m": 7, "tile_n": 4, "w": 4, "v": 26, "threads": 32, "grouping": 16, "minblocks": 4, "algorithm": "largeDB2", "perf": 7394.78, "source": "autotuned"},
{"m": 26, "n": 26, "k": 13, "tile_m": 7, "tile_n": 4, "w": 6, "v": 26, "threads": 32, "grouping": 16, "minblocks": 1, "algorithm": "largeDB2", "perf": 7921.97, "source": "autotuned"},
{"m": 26, "n": 26, "k": 22, "tile_m": 7, "tile_n": 4, "w": 8, "v": 26, "threads": 32, "grouping": 16, "minblocks": 8, "algorithm": "largeDB2", "perf": 9286.3, "source": "autotuned"},
{"m": 26, "n": 26, "k": 23, "tile_m": 7, "tile_n": 4, "w": 8, "v": 26, "threads": 32, "grouping": 16, "minblocks": 1, "algorithm": "largeDB2", "perf": 9259.49, "source": "autotuned"},
{"m": 26, "n": 26, "k": 26, "tile_m": 5, "tile_n": 6, "w": 10, "v": 26, "threads": 32, "grouping": 16, "minblocks": 2, "algorithm": "largeDB2", "perf": 9393.5, "source": "autotuned"},
{"m": 28, "n": 4, "k": 5, "tile_m": 1, "tile_n": 4, "threads": 32, "grouping": 5, "minblocks": 27, "algorithm": "medium", "perf": 1902.12, "source": "autotuned"},
{"m": 28, "n": 4, "k": 13, "tile_m": 1, "tile_n": 4, "threads": 64, "grouping": 5, "minblocks": 15, "algorithm": "medium", "perf": 2788.14, "source": "autotuned"},
{"m": 28, "n": 4, "k": 28, "tile_m": 1, "tile_n": 4, "w": 12, "v": 4, "threads": 32, "grouping": 16, "minblocks": 12, "algorithm": "largeDB2", "perf": 3106.95, "source": "autotuned"},
{"m": 28, "n": 5, "k": 25, "tile_m": 3, "tile_n": 2, "w": 10, "v": 4, "threads": 32, "grouping": 16, "minblocks": 1, "algorithm": "largeDB2", "perf": 3451.62, "source": "autotuned"},
{"m": 28, "n": 28, "k": 28, "tile_m": 5, "tile_n": 6, "w": 10, "v": 28, "threads": 32, "grouping": 16, "minblocks": 8, "algorithm": "largeDB2", "perf": 10877.9, "source": "autotuned"},
{"m": 29, "n": 14, "k": 14, "tile_m": 3, "tile_n": 5, "w": 6, "v": 14, "threads": 32, "grouping": 16, "minblocks": 2, "algorithm": "largeDB2", "perf": 6629.35, "source": "autotuned"},
{"m": 29, "n": 14, "k": 16, "tile_m": 3, "tile_n": 5, "w": 6, "v": 14, "threads": 32, "grouping": 16, "minblocks": 12, "algorithm": "largeDB2", "perf": 6773.48, "source": "autotuned"},
{"m": 29, "n": 14, "k": 29, "tile_m": 3, "tile_n": 5, "w": 10, "v": 14, "threads": 32, "grouping": 16, "minblocks": 12, "algorithm": "largeDB2", "perf": 7878.05, "source": "autotuned"},
{"m": 29, "n": 14, "k": 32, "tile_m": 3, "tile_n": 5, "w": 12, "v": 14, "threads": 32, "grouping": 16, "minblocks": 1, "algorithm": "largeDB2", "perf": 8129.31, "source": "autotuned"},
{"m": 29, "n": 16, "k": 14, "tile_m": 3, "tile_n": 6, "w": 6, "v": 16, "threads": 32, "grouping": 16, "minblocks": 4, "algorithm": "largeDB2", "perf": 7143.31, "source": "autotuned"},
{"m": 29, "n": 16, "k": 16, "tile_m": 3, "tile_n": 6, "w": 6, "v": 16, "threads": 32, "grouping": 16, "minblocks": 8, "algorithm": "largeDB2", "perf": 7416.43, "source": "autotuned"},
{"m": 29, "n": 29, "k": 14, "tile_m": 5, "tile_n": 6, "w": 6, "v": 28, "threads": 32, "grouping": 16, "minblocks": 4, "algorithm": "largeDB2", "perf": 9367.19, "source": "autotuned"},
{"m": 29, "n": 29, "k": 16, "tile_m": 5, "tile_n": 6, "w": 6, "v": 28, "threads": 32, "grouping": 16, "minblocks": 8, "algorithm": "largeDB2", "perf": 10027.5, "source": "autotuned"},
{"m": 29, "n": 29, "k": 29, "tile_m": 5, "tile_n": 6, "w": 10, "v": 28, "threads": 32, "grouping": 16, "minblocks": 8, "algorithm": "largeDB2", "perf": 11380.8, "source": "autotuned"},
{"m": 29, "n": 29, "k": 32, "tile_m": 5, "tile_n": 6, "w": 12, "v": 28, "threads": 32, "grouping": 16, "minblocks": 8, "algorithm": "largeDB2", "perf": 11568.7, "source": "autotuned"},
{"m": 29, "n": 32, "k": 14, "tile_m": 9, "tile_n": 4, "w": 6, "v": 32, "threads": 32, "grouping": 16, "minblocks": 8, "algorithm": "largeDB2", "perf": 9679.29, "source": "autotuned"},
{"m": 29, "n": 32, "k": 29, "tile_m": 5, "tile_n": 7, "w": 10, "v": 32, "threads": 32, "grouping": 16, "minblocks": 2, "algorithm": "largeDB2", "perf": 11423.1, "source": "autotuned"},
{"m": 29, "n": 32, "k": 32, "tile_m": 5, "tile_n": 7, "w": 12, "v": 32, "threads": 32, "grouping": 16, "minblocks": 8, "algorithm": "largeDB2", "perf": 11578.0, "source": "autotuned"},
{"m": 30, "n": 30, "k": 30, "tile_m": 5, "tile_n": 6, "w": 12, "v": 30, "threads": 32, "grouping": 16, "minblocks": 4, "algorithm": "largeDB2", "perf": 12200.8, "source": "autotuned"},
{"m": 31, "n": 31, "k": 31, "tile_m": 9, "tile_n": 4, "w": 8, "v": 30, "threads": 32, "grouping": 16, "minblocks": 8, "algorithm": "largeDB2", "perf": 11422.1, "source": "autotuned"},
{"m": 32, "n": 4, "k": 13, "tile_m": 1, "tile_n": 4, "w": 6, "v": 4, "threads": 32, "grouping": 16, "minblocks": 4, "algorithm": "largeDB2", "perf": 3130.48, "source": "autotuned"},
{"m": 32, "n": 4, "k": 25, "tile_m": 1, "tile_n": 4, "w": 12, "v": 4, "threads": 64, "grouping": 16, "minblocks": 4, "algorithm": "largeDB2", "perf": 3322.84, "source": "autotuned"},
{"m": 32, "n": 4, "k": 26, "tile_m": 1, "tile_n": 4, "w": 10, "v": 4, "threads": 64, "grouping": 16, "minblocks": 4, "algorithm": "largeDB2", "perf": 3375.17, "source": "autotuned"},
{"m": 32, "n": 4, "k": 28, "tile_m": 2, "tile_n": 2, "w": 12, "v": 4, "threads": 64, "grouping": 16, "minblocks": 4, "algorithm": "largeDB2", "perf": 3472.83, "source": "autotuned"},
{"m": 32, "n": 4, "k": 32, "tile_m": 1, "tile_n": 4, "w": 12, "v": 4, "threads": 64, "grouping": 16, "minblocks": 2, "algorithm": "largeDB2", "perf": 3638.79, "source": "autotuned"},
{"m": 32, "n": 5, "k": 4, "tile_m": 1, "tile_n": 5, "threads": 32, "grouping": 5, "minblocks": 27, "algorithm": "medium", "perf": 2104.46, "source": "autotuned"},
{"m": 32, "n": 5, "k": 5, "tile_m": 1, "tile_n": 5, "threads": 32, "grouping": 5, "minblocks": 26, "algorithm": "medium", "perf": 2409.42, "source": "autotuned"},
{"m": 32, "n": 5, "k": 7, "tile_m": 2, "tile_n": 3, "threads": 32, "grouping": 5, "minblocks": 26, "algorithm": "medium", "perf": 2712.11, "source": "autotuned"},
{"m": 32, "n": 5, "k": 16, "tile_m": 1, "tile_n": 5, "w": 6, "v": 4, "threads": 32, "grouping": 16, "minblocks": 1, "algorithm": "largeDB2", "perf": 3664.83, "source": "autotuned"},
{"m": 32, "n": 5, "k": 26, "tile_m": 1, "tile_n": 5, "w": 10, "v": 4, "threads": 64, "grouping": 16, "minblocks": 8, "algorithm": "largeDB2", "perf": 4015.41, "source": "autotuned"},
{"m": 32, "n": 5, "k": 45, "tile_m": 1, "tile_n": 5, "w": 18, "v": 4, "threads": 64, "grouping": 16, "minblocks": 8, "algorithm": "largeDB2", "perf": 4442.18, "source": "autotuned"},
{"m": 32, "n": 7, "k": 4, "tile_m": 1, "tile_n": 7, "threads": 32, "grouping": 5, "minblocks": 26, "algorithm": "medium", "perf": 2626.61, "source": "autotuned"},
{"m": 32, "n": 7, "k": 7, "tile_m": 2, "tile_n": 4, "threads": 32, "grouping": 5, "minblocks": 25, "algorithm": "medium", "perf": 3403.42, "source": "autotuned"},
{"m": 32, "n": 7, "k": 9, "tile_m": 2, "tile_n": 4, "w": 4, "v": 6, "threads": 32, "grouping": 16, "minblocks": 12, "algorithm": "largeDB2", "perf": 4101.62, "source": "autotuned"},
{"m": 32, "n": 7, "k": 13, "tile_m": 2, "tile_n": 4, "w": 6, "v": 6, "threads": 32, "grouping": 16, "minblocks": 12, "algorithm": "largeDB2", "perf": 4632.86, "source": "autotuned"},
{"m": 32, "n": 7, "k": 26, "tile_m": 1, "tile_n": 7, "w": 10, "v": 6, "threads": 32, "grouping": 16, "minblocks": 4, "algorithm": "largeDB2", "perf": 5116.35, "source": "autotuned"},
{"m": 32, "n": 7, "k": 32, "tile_m": 2, "tile_n": 4, "w": 12, "v": 4, "threads": 32, "grouping": 16, "minblocks": 1, "algorithm": "largeDB2", "perf": 5479.04, "source": "autotuned"},
{"m": 32, "n": 7, "k": 45, "tile_m": 2, "tile_n": 4, "w": 16, "v": 6, "threads": 32, "grouping": 16, "minblocks": 12, "algorithm": "largeDB2", "perf": 5731.23, "source": "autotuned"},
{"m": 32, "n": 9, "k": 7, "tile_m": 2, "tile_n": 3, "threads": 64, "grouping": 5, "minblocks": 15, "algorithm": "medium", "perf": 4022.53, "source": "autotuned"},
{"m": 32, "n": 9, "k": 12, "tile_m": 2, "tile_n": 5, "threads": 32, "grouping": 4, "minblocks": 16, "algorithm": "medium", "perf": 4945.75, "source": "autotuned"},
{"m": 32, "n": 9, "k": 13, "tile_m": 2, "tile_n": 5, "w": 6, "v": 8, "threads": 32, "grouping": 16, "minblocks": 8, "algorithm": "largeDB2", "perf": 5467.4, "source": "autotuned"},
{"m": 32, "n": 9, "k": 25, "tile_m": 2, "tile_n": 5, "w": 10, "v": 8, "threads": 32, "grouping": 16, "minblocks": 8, "algorithm": "largeDB2", "perf": 6117.43, "source": "autotuned"},
{"m": 32, "n": 9, "k": 26, "tile_m": 2, "tile_n": 5, "w": 10, "v": 6, "threads": 32, "grouping": 16, "minblocks": 1, "algorithm": "largeDB2", "perf": 6198.9, "source": "autotuned"},
{"m": 32, "n": 9, "k": 32, "tile_m": 2, "tile_n": 5, "w": 14, "v": 8, "threads": 32, "grouping": 16, "minblocks": 8, "algorithm": "largeDB2", "perf": 6510.51, "source": "autotuned"},
{"m": 32, "n": 9, "k": 45, "tile_m": 2, "tile_n": 5, "w": 16, "v": 8, "threads": 32, "grouping": 16, "minblocks": 1, "algorithm": "largeDB2", "perf": 6886.0, "source": "autotuned"},
{"m": 32, "n": 10, "k": 9, "tile_m": 2, "tile_n": 4, "w": 4, "v": 10, "threads": 64, "grouping": 16, "minblocks": 12, "algorithm": "largeDB2", "perf": 4813.53, "source": "autotuned"},
{"m": 32, "n": 10, "k": 10, "tile_m": 2, "tile_n": 3, "w": 4, "v": 10, "threads": 64, "grouping": 16, "minblocks": 2, "algorithm": "largeDB2", "perf": 5006.78, "source": "autotuned"},
{"m": 32, "n": 10, "k": 32, "tile_m": 2, "tile_n": 5, "w": 12, "v": 10, "threads": 32, "grouping": 16, "minblocks": 2, "algorithm": "largeDB2", "perf": 7131.49, "source": "autotuned"},
{"m": 32, "n": 11, "k": 11, "tile_m": 2, "tile_n": 6, "threads": 32, "grouping": 4, "minblocks": 15, "algorithm": "medium", "perf": 5419.6, "source": "autotuned"},
{"m": 32, "n": 11, "k": 12, "tile_m": 2, "tile_n": 6, "threads": 32, "grouping": 4, "minblocks": 15, "algorithm": "medium", "perf": 5591.51, "source": "autotuned"},
{"m": 32, "n": 11, "k": 20, "tile_m": 2, "tile_n": 6, "w": 8, "v": 10, "threads": 32, "grouping": 16, "minblocks": 4, "algorithm": "largeDB2", "perf": 6660.34, "source": "autotuned"},
{"m": 32, "n": 11, "k": 32, "tile_m": 2, "tile_n": 6, "w": 12, "v": 10, "threads": 32, "grouping": 16, "minblocks": 1, "algorithm": "largeDB2", "perf": 7568.87, "source": "autotuned"},
{"m": 32, "n": 12, "k": 11, "tile_m": 2, "tile_n": 4, "w": 4, "v": 12, "threads": 64, "grouping": 16, "minblocks": 12, "algorithm": "largeDB2", "perf": 6059.25, "source": "autotuned"},
{"m": 32, "n": 12, "k": 20, "tile_m": 2, "tile_n": 6, "w": 8, "v": 12, "threads": 32, "grouping": 16, "minblocks": 12, "algorithm": "largeDB2", "perf": 7318.89, "source": "autotuned"},
{"m": 32, "n": 12, "k": 26, "tile_m": 2, "tile_n": 6, "w": 10, "v": 12, "threads": 32, "grouping": 16, "minblocks": 1, "algorithm": "largeDB2", "perf": 7780.15, "source": "autotuned"},
{"m": 32, "n": 12, "k": 32, "tile_m": 2, "tile_n": 6, "w": 12, "v": 12, "threads": 32, "grouping": 16, "minblocks": 12, "algorithm": "largeDB2", "perf": 8244.02, "source": "autotuned"},
{"m": 32, "n": 13, "k": 7, "tile_m": 1, "tile_n": 7, "threads": 96, "grouping": 5, "minblocks": 13, "algorithm": "medium", "perf": 4702.03, "source": "autotuned"},
{"m": 32, "n": 13, "k": 9, "tile_m": 2, "tile_n": 4, "w": 4, "v": 12, "threads": 64, "grouping": 16, "minblocks": 12, "algorithm": "largeDB2", "perf": 5637.49, "source": "autotuned"},
{"m": 32, "n": 13, "k": 13, "tile_m": 2, "tile_n": 7, "threads": 32, "grouping": 4, "minblocks": 13, "algorithm": "medium", "perf": 6114.95, "source": "autotuned"},
{"m": 32, "n": 13, "k": 16, "tile_m": 6, "tile_n": 3, "w": 6, "v": 12, "threads": 32, "grouping": 16, "minblocks": 4, "algorithm": "largeDB2", "perf": 6228.33, "source": "autotuned"},
{"m": 32, "n": 13, "k": 28, "tile_m": 2, "tile_n": 7, "w": 10, "v": 12, "threads": 32, "grouping": 16, "minblocks": 2, "algorithm": "largeDB2", "perf": 7986.05, "source": "autotuned"},
{"m": 32, "n": 14, "k": 13, "tile_m": 2, "tile_n": 4, "w": 6, "v": 12, "threads": 96, "grouping": 16, "minblocks": 12, "algorithm": "largeDB2", "perf": 6458.78, "source": "autotuned"},
{"m": 32, "n": 16, "k": 5, "tile_m": 2, "tile_n": 4, "threads": 192, "grouping": 32, "minblocks": 5, "algorithm": "medium", "perf": 4903.4, "source": "autotuned"},
{"m": 32, "n": 16, "k": 12, "tile_m": 2, "tile_n": 4, "w": 4, "v": 16, "threads": 64, "grouping": 16, "minblocks": 12, "algorithm": "largeDB2", "perf": 7495.02, "source": "autotuned"},
{"m": 32, "n": 16, "k": 13, "tile_m": 2, "tile_n": 4, "w": 6, "v": 10, "threads": 96, "grouping": 16, "minblocks": 12, "algorithm": "largeDB2", "perf": 7354.29, "source": "autotuned"},
{"m": 32, "n": 20, "k": 11, "tile_m": 6, "tile_n": 4, "w": 4, "v": 20, "threads": 32, "grouping": 16, "minblocks": 8, "algorithm": "largeDB2", "perf": 7787.17, "source": "autotuned"},
{"m": 32, "n": 20, "k": 20, "tile_m": 6, "tile_n": 4, "w": 8, "v": 20, "threads": 32, "grouping": 16, "minblocks": 12, "algorithm": "largeDB2", "perf": 9074.42, "source": "autotuned"},
{"m": 32, "n": 22, "k": 9, "tile_m": 9, "tile_n": 3, "w": 4, "v": 22, "threads": 32, "grouping": 16, "minblocks": 8, "algorithm": "largeDB2", "perf": 7287.83, "source": "autotuned"},
{"m": 32, "n": 24, "k": 5, "tile_m": 2, "tile_n": 6, "threads": 192, "grouping": 32, "minblocks": 4, "algorithm": "medium", "perf": 6430.58, "source": "autotuned"},
{"m": 32, "n": 24, "k": 13, "tile_m": 2, "tile_n": 6, "w": 6, "v": 14, "threads": 64, "grouping": 16, "minblocks": 12, "algorithm": "largeDB2", "perf": 8922.38, "source": "autotuned"},
{"m": 32, "n": 24, "k": 24, "tile_m": 2, "tile_n": 6, "w": 10, "v": 20, "threads": 96, "grouping": 16, "minblocks": 8, "algorithm": "largeDB2", "perf": 10166.0, "source": "autotuned"},
{"m": 32, "n": 24, "k": 26, "tile_m": 2, "tile_n": 6, "w": 12, "v": 24, "threads": 96, "grouping": 16, "minblocks": 8, "algorithm": "largeDB2", "perf": 10387.0, "source": "autotuned"},
{"m": 32, "n": 24, "k": 32, "tile_m": 2, "tile_n": 6, "w": 12, "v": 12, "threads": 96, "grouping": 16, "minblocks": 8, "algorithm": "largeDB2", "perf": 10702.5, "source": "autotuned"},
{"m": 32, "n": 25, "k": 5, "tile_m": 2, "tile_n": 7, "threads": 192, "grouping": 32, "minblocks": 4, "algorithm": "medium", "perf": 5992.89, "source": "autotuned"},
{"m": 32, "n": 25, "k": 7, "tile_m": 2, "tile_n": 5, "threads": 256, "grouping": 32, "minblocks": 4, "algorithm": "medium", "perf": 6358.4, "source": "autotuned"},
{"m": 32, "n": 25, "k": 13, "tile_m": 6, "tile_n": 5, "w": 6, "v": 24, "threads": 32, "grouping": 16, "minblocks": 2, "algorithm": "largeDB2", "perf": 8467.11, "source": "autotuned"},
{"m": 32, "n": 25, "k": 26, "tile_m": 6, "tile_n": 5, "w": 10, "v": 22, "threads": 32, "grouping": 16, "minblocks": 4, "algorithm": "largeDB2", "perf": 10417.1, "source": "autotuned"},
{"m": 32, "n": 25, "k": 32, "tile_m": 6, "tile_n": 5, "w": 8, "v": 14, "threads": 32, "grouping": 16, "minblocks": 4, "algorithm": "largeDB2", "perf": 10717.6, "source": "autotuned"},
{"m": 32, "n": 25, "k": 45, "tile_m": 6, "tile_n": 5, "w": 20, "v": 20, "threads": 32, "grouping": 16, "minblocks": 2, "algorithm": "largeDB2", "perf": 11040.8, "source": "autotuned"},
{"m": 32, "n": 26, "k": 5, "tile_m": 2, "tile_n": 7, "threads": 192, "grouping": 32, "minblocks": 4, "algorithm": "medium", "perf": 6226.38, "source": "autotuned"},
{"m": 32, "n": 26, "k": 7, "tile_m": 2, "tile_n": 4, "threads": 256, "grouping": 32, "minblocks": 4, "algorithm": "medium", "perf": 6536.07, "source": "autotuned"},
{"m": 32, "n": 26, "k": 9, "tile_m": 9, "tile_n": 4, "w": 4, "v": 26, "threads": 32, "grouping": 16, "minblocks": 4, "algorithm": "largeDB2", "perf": 7515.39, "source": "autotuned"},
{"m": 32, "n": 26, "k": 12, "tile_m": 9, "tile_n": 4, "w": 4, "v": 26, "threads": 32, "grouping": 16, "minblocks": 8, "algorithm": "largeDB2", "perf": 8141.67, "source": "autotuned"},
{"m": 32, "n": 26, "k": 24, "tile_m": 4, "tile_n": 7, "w": 8, "v": 20, "threads": 32, "grouping": 16, "minblocks": 8, "algorithm": "largeDB2", "perf": 9977.14, "source": "autotuned"},
{"m": 32, "n": 26, "k": 28, "tile_m": 6, "tile_n": 6, "w": 10, "v": 26, "threads": 32, "grouping": 16, "minblocks": 2, "algorithm": "largeDB2", "perf": 10174.6, "source": "autotuned"},
{"m": 32, "n": 26, "k": 32, "tile_m": 4, "tile_n": 7, "w": 12, "v": 26, "threads": 32, "grouping": 16, "minblocks": 4, "algorithm": "largeDB2", "perf": 10507.2, "source": "autotuned"},
{"m": 32, "n": 26, "k": 45, "tile_m": 4, "tile_n": 7, "w": 12, "v": 26, "threads": 32, "grouping": 16, "minblocks": 8, "algorithm": "largeDB2", "perf": 10622.6, "source": "autotuned"},
{"m": 32, "n": 28, "k": 4, "tile_m": 2, "tile_n": 7, "threads": 160, "grouping": 32, "minblocks": 4, "algorithm": "medium", "perf": 6079.91, "source": "autotuned"},
{"m": 32, "n": 28, "k": 13, "tile_m": 6, "tile_n": 6, "w": 6, "v": 28, "threads": 32, "grouping": 16, "minblocks": 4, "algorithm": "largeDB2", "perf": 8974.31, "source": "autotuned"},
{"m": 32, "n": 28, "k": 25, "tile_m": 6, "tile_n": 6, "w": 10, "v": 28, "threads": 32, "grouping": 16, "minblocks": 4, "algorithm": "largeDB2", "perf": 10717.6, "source": "autotuned"},
{"m": 32, "n": 28, "k": 26, "tile_m": 6, "tile_n": 6, "w": 10, "v": 28, "threads": 32, "grouping": 16, "minblocks": 8, "algorithm": "largeDB2", "perf": 10886.0, "source": "autotuned"},
{"m": 32, "n": 28, "k": 28, "tile_m": 6, "tile_n": 6, "w": 10, "v": 28, "threads": 32, "grouping": 16, "minblocks": 4, "algorithm": "largeDB2", "perf": 10941.4, "source": "autotuned"},
{"m": 32, "n": 28, "k": 32, "tile_m": 4, "tile_n": 7, "w": 12, "v": 20, "threads": 32, "grouping": 16, "minblocks": 2, "algorithm": "largeDB2", "perf": 11125.3, "source": "autotuned"},
{"m": 32, "n": 28, "k": 45, "tile_m": 4, "tile_n": 7, "w": 16, "v": 28, "threads": 32, "grouping": 16, "minblocks": 1, "algorithm": "largeDB2", "perf": 11397.7, "source": "autotuned"},
{"m": 32, "n": 29, "k": 29, "tile_m": 6, "tile_n": 6, "w": 12, "v": 28, "threads": 32, "grouping": 16, "minblocks": 1, "algorithm": "largeDB2", "perf": 11086.0, "source": "autotuned"},
{"m": 32, "n": 32, "k": 4, "tile_m": 2, "tile_n": 8, "threads": 160, "grouping": 32, "minblocks": 4, "algorithm": "medium", "perf": 6909.41, "source": "autotuned"},
{"m": 32, "n": 32, "k": 7, "tile_m": 2, "tile_n": 4, "threads": 256, "grouping": 32, "minblocks": 4, "algorithm": "medium", "perf": 7746.03, "source": "autotuned"},
{"m": 32, "n": 32, "k": 10, "tile_m": 9, "tile_n": 4, "w": 4, "v": 32, "threads": 32, "grouping": 16, "minblocks": 4, "algorithm": "largeDB2", "perf": 9531.51, "source": "autotuned"},
{"m": 32, "n": 32, "k": 11, "tile_m": 9, "tile_n": 4, "w": 4, "v": 30, "threads": 32, "grouping": 16, "minblocks": 8, "algorithm": "largeDB2", "perf": 9655.12, "source": "autotuned"},
{"m": 32, "n": 32, "k": 16, "tile_m": 9, "tile_n": 4, "w": 6, "v": 30, "threads": 32, "grouping": 16, "minblocks": 2, "algorithm": "largeDB2", "perf": 10718.8, "source": "autotuned"},
{"m": 32, "n": 32, "k": 22, "tile_m": 9, "tile_n": 4, "w": 8, "v": 28, "threads": 32, "grouping": 16, "minblocks": 8, "algorithm": "largeDB2", "perf": 11470.2, "source": "autotuned"},
{"m": 32, "n": 32, "k": 24, "tile_m": 9, "tile_n": 4, "w": 8, "v": 28, "threads": 32, "grouping": 16, "minblocks": 4, "algorithm": "largeDB2", "perf": 11741.9, "source": "autotuned"},
{"m": 32, "n": 32, "k": 25, "tile_m": 9, "tile_n": 4, "w": 10, "v": 32, "threads": 32, "grouping": 16, "minblocks": 2, "algorithm": "largeDB2", "perf": 11694.9, "source": "autotuned"},
{"m": 32, "n": 32, "k": 26, "tile_m": 9, "tile_n": 4, "w": 10, "v": 32, "threads": 32, "grouping": 16, "minblocks": 4, "algorithm": "largeDB2", "perf": 11822.6, "source": "autotuned"},
{"m": 32, "n": 32, "k": 29, "tile_m": 9, "tile_n": 4, "w": 8, "v": 28, "threads": 32, "grouping": 16, "minblocks": 8, "algorithm": "largeDB2", "perf": 12047.6, "source": "autotuned"},
{"m": 32, "n": 32, "k": 32, "tile_m": 9, "tile_n": 4, "w": 8, "v": 28, "threads": 32, "grouping": 16, "minblocks": 8, "algorithm": "largeDB2", "perf": 12252.0, "source": "autotuned"},
{"m": 32, "n": 32, "k": 45, "tile_m": 9, "tile_n": 4, "w": 8, "v": 30, "threads": 32, "grouping": 16, "minblocks": 8, "algorithm": "largeDB2", "perf": 12558.6, "source": "autotuned"},
{"m": 32, "n": 45, "k": 5, "tile_m": 2, "tile_n": 6, "threads": 256, "grouping": 32, "minblocks": 4, "algorithm": "medium", "perf": 7626.81, "source": "autotuned"},
{"m": 32, "n": 45, "k": 7, "tile_m": 2, "tile_n": 4, "threads": 320, "grouping": 32, "minblocks": 4, "algorithm": "medium", "perf": 7895.97, "source": "autotuned"},
{"m": 32, "n": 45, "k": 9, "tile_m": 2, "tile_n": 6, "threads": 416, "grouping": 32, "minblocks": 2, "algorithm": "medium", "perf": 7721.29, "source": "autotuned"},
{"m": 32, "n": 45, "k": 28, "tile_m": 8, "tile_n": 6, "w": 12, "v": 24, "threads": 32, "grouping": 16, "minblocks": 4, "algorithm": "largeDB2", "perf": 11421.4, "source": "autotuned"},
{"m": 45, "n": 45, "k": 45, "tile_m": 6, "tile_n": 6, "w": 8, "v": 44, "threads": 64, "grouping": 16, "minblocks": 4, "algorithm": "largeDB2", "perf": 13820.9, "source": "autotuned"},
{"m": 55, "n": 55, "k": 32, "tile_m": 7, "tile_n": 7, "w": 12, "v": 54, "threads": 64, "grouping": 16, "minblocks": 1, "algorithm": "largeDB2", "perf": 14666.8, "source": "autotuned"},
{"m": 64, "n": 64, "k": 64, "tile_m": 4, "tile_n": 8, "w": 12, "v": 54, "threads": 128, "grouping": 16, "minblocks": 1, "algorithm": "largeDB2", "perf": 15634.4, "source": "autotuned"},
{"m": 72, "n": 72, "k": 72, "tile_m": 9, "tile_n": 5, "w": 8, "v": 36, "threads": 128, "grouping": 16, "minblocks": 1, "algorithm": "largeDB2", "perf": 15456.6, "source": "autotuned"}
]